酒店名称,评论日期,评论内容,入住房型
H13,2020-06-03,**酒店住过好几次了，在**酒店来说酒店的档次和位置都是很好的选择，喜欢这里的面向大海的开阔视野，也能看到港珠澳大桥的日夜景致。早餐比以前丰富，停车方便。感谢前台美女周小姐，服务很周到非常贴心，下次还会来！（建议房间增加蓝牙小音箱，洗浴用品升级一下就更好了）,贵宾楼豪华海景大床房
H13,2020-06-05,很热情，只是有一次保洁未锁门,贵宾楼豪华海景大床房
H13,2020-06-05,服务是真的好，十分注重细节，超五星水平，无论是大堂经理还有帮拿行李的小哥哥，早餐的服务人员，还是送我们去长隆的司机。带着两个神兽就是需要这样的体服务，带娃的家庭强烈推荐，这年头大家见多了酒店的硬件，软实力这么好的还真是少见。,贵宾楼豪华海景大床房
H13,2020-06-06,豪华上档次，服务周到，干净整洁，,豪华山景大床房
H13,2020-06-06,服务好，设施新,豪华海景双床房
H13,2020-06-07,酒店依山傍海，位置非常好。服务很到位，儿童乐园非常大，管理很好，分区域分年龄安排游戏区，类似大型商场的儿童乐园区。小朋友玩的很开心！,豪华山景大床房
H13,2020-06-07,酒店施经理很周到，给我们介绍酒店以客户为中心的理念。儿童乐园真不错，很大很干净，带小朋友来很不错，大人小孩玩的都很开心，值得推荐！酒店位置也很好，会再来,豪华山景大床房
H13,2020-06-08,设施比较老了，我们每晚200升级了海景房，视野就好多了，这个价位的酒店拼的就只有服务了，可惜服务是不太匹配的，特殊时期入住（春节，疫情），欢迎水果都没有。早餐品种比较丰富，口味中规中矩,经典山景双床房
H13,2020-06-08,没问题??哦,豪华山景大床房
H13,2020-06-08,没问题??喔,豪华山景大床房
H13,2020-06-11,客人很满意，张经理的服务态度很好，值得再次入住,豪华山景大床房
H13,2020-06-12,挺好的，就是没有儿童活动区,豪华山景双床房
H13,2020-06-12,环境超棒哦,豪华山景大床房
H13,2020-06-13,看海酒店 服务比较周到,豪华山景大床房
H13,2020-06-13,比较好的酒店,豪华山景双床房
H13,2020-06-14,早餐很丰盛，服务员态度都很好。特别是前台接待的mm很热情，还免费送了一份水果，下次有机会还会再来入住。,豪华山景大床房
H13,2020-06-14,位置景观都很好，就是服务意识有待提高，门童看见行李多都不上前帮忙，也不帮开车门，这点不像是五星级该有的样子,豪华山景大床房
H13,2020-06-15,第二次住这酒店，感觉很不错??景观很好,贵宾楼豪华海景大床房
H13,2020-06-15,酒店面相港珠澳大桥，附近很多食海鲜的，早餐超级丰富，房间免费升级了，比长隆酒店好多多了。九点半有免费巴士去长隆,贵宾楼豪华海景大床房
H13,2020-06-15,**酒店自助晚餐环境优美，出品海鲜非常新鲜，生蚝任吃，酒水畅饮，非常不错，客房卫生干净整洁，服务很好，尤其是餐饮部的韦明月经理对我们的小孩特别关照，还亲自带小朋友去儿童俱乐部玩，用餐时也是非常照顾我们，介绍出品，帮忙取餐，第二天下来用早餐对小朋友也是非常友好的，下次还会过来的。,贵宾楼豪华海景家庭房
H13,2020-06-15,这次入住**酒店、非常满意，特别感谢西餐厅，小高、小韦对我的服务非常热情周到、特别是高炎知道我生日、给我一个惊喜、送了一份生日蛋糕。小韦给我给了一碗长寿面，还要感谢客房部、白燕群送我糖水还送我矿泉水。江潮霞，林四青，何燕玲都很好每天都给我送水，在异乡有一种家里感觉。酒店高大尚、望着窗外蓝天白云港珠奥大桥、心情美美哒！以后有机会还会来入住**酒店??,豪华海景大床房
H13,2020-06-17,不愧是五星级的酒店，的确没让人失望从抵达酒店到离开，都受到了无微不至的关怀，要知道只有员工发自内心的爱着这家酒店，才能提供如此超出预期的世界级服务酒店地理位置优越离**酒店火车站打车10分钟即可到达，下个坡就是情侣南路，后面就是酒吧街，离市区也不远，周围餐饮娱乐设施齐全。酒店早餐品种多样且美味。酒店提供免费接送长隆往返的服务，时间是9:30出发，5:30返回。最后再次感谢各位的周到服务：酒店大堂副理梁震，因为考虑到我们是三个人的入住体验为我们临时升级房型并介绍推荐**酒店的景点和美食，又因为天热为我们贴心送上了糖水和水果来解暑首席礼宾师施小元（哇塞，金钥匙哎）听说我们要去长隆，特意为我们准备了雨衣和可以带进去的水接送我们去长隆的司机王师傅和耿师傅也是让人感觉特别善良、可爱、淳朴每个人都用心服务着每位到访的顾客。可以说是我入住过服务最好的酒店了推荐????,贵宾楼豪华海景大床房
H13,2020-06-17,??你有无敌海景也就算了！还能拉开窗帘就一览无余看到传说中的珠港澳大桥??！太过分了！?? 而且，窗前就是岩石海浪棕榈树??的情侣路，走过去朝霞里晨跑还是晚霞里散步，1分钟！要不要这么多福利在一起啊！让人觉得不真实好不好？！？?? 地段好就算了，还有把人逼出选择困难症的华丽丽滴早餐，一会儿要吃地道河粉和生滚粥，一会儿要吃咖啡布丁??奶酪???……真的很容易让人吃太多好不好？！？（另外，离**酒店必吃的颓记茶餐厅、酒吧街的很多海鲜??馆子也就走路5分钟，又好吃又便宜！觉得一天应该吃5顿...真的容易吃太肥吖？！??）??好吃好喝也就算了，酒店每个工作人员还那么贴心懂人很温暖！带小盆友去长隆海洋世界，二话不说！有车送！下午回来，一言不合，派车接！来回要50公里哦，很贵的！酒店商务车不要钱吗，服务经理Allen Shi大哥？餐厅经理Ada每天早餐喜欢和我家小盆友聊两句，一听说他要生日，哇小姐姐太有心了！第二天早上一顶超级巧克力蛋糕??隆重登场！惊喜得我家小哥说都不会话了！一会儿我们坐飞机??要起飞时，他还沉浸在树莓巧克力里“妈妈，我最喜欢**酒店了！妈妈我们什么时候再来啊？” 一家酒店为**酒店带盐！也是没SHE了！这里特别感谢Ada小姐姐！（还有饼房小姐姐，听说小盆友爱吃巧克力，忙乎了一早上！真是太有爱??了！）你说这样的服务能不让你感动吗？害我码字这么多????另外，如果不是疫情，拱北口岸去澳门没多远，窗外就看到口岸的楼！??沿着情侣路下去一路上有海滨???浴场，爱情邮局，海珠渔女，贝壳音乐厅，一串都有料！??酒店二楼还有个儿童游乐场，干净宽敞，酒店还备给客人一次性袜子，儿子进去就不出来，闹的我们睡很晚????不过最让我家小盆友极度舒适的是暖烘烘的马桶盖，坐在上面就能看厕所里的电视喜羊羊，特别是那个能...冲屁屁的...日本马桶，这不是搞得我回家要花银子??提升家庭基础建设嘛？？！！！??????疫情期间，她们说生意很难，很多时候是开一天赔一天，但大家真的很努力！作为一个满意的客人，啥也不说啦！五星推荐！??????**酒店 （ZhuHai Grand Bay Hotel）啦！,贵宾楼豪华海景大床房
H13,2020-06-17,总的来说是好，非常好,贵宾楼豪华海景大床房
H13,2020-06-18,不孤单的商务行，只因有您的陪伴，“珠江**酒店”。非常棒的一次商务出行体验，因为疫情，独自一人商旅“**酒店”转“中山”、“广州”，第一天预住，前台 cherry/周阳敏（美女）热情的服务和对我首次来**酒店不熟悉，事无巨细的一一解答，让我对**酒店这个城市有了初步的了解，因为疫情，去程，返程都没有办法准确由自己来确定，所以而后几天反反复复的续订，感恩她的优惠价格和给我延迟退房的福利，一家公司有这样的员工，**酒店，一定能人气爆棚！入住还有一些甜心服务，我的衣服没有叫衣架，收拾房子阿姨就帮我弄了晾衣杆，温馨，夏天热，酒店备好了“银耳羹”，真的超级贴心，这次住酒店基本是工作比较忙，没有办法去寻找美食，一楼的自助餐厅的服务员也超级棒，值得一提的是，陈姐（陈洁群）温馨美食推荐和周到的咖啡服务，感恩遇见您们，遇见您“**酒店”疫情后我还会来寻找您们的足迹，感受**酒店不一样的入住体验和尊享式的入住体验，万语千言，千言万语总结为“再见”！我喜欢上您了，**酒店.,贵宾楼豪华海景大床房
H13,2020-06-18,位置佳，性价比高,贵宾楼豪华海景大床房
H13,2020-06-18,非常不错的一家酒店，各方位都很好,经典海景家庭套房
H13,2020-06-19,体验很好，下次会再来,豪华山景大床房
H13,2020-06-20,位置绝佳，出门即海，吃完饭情侣路散步美滋滋；风景绝美，无遮挡海景，直看港珠澳大桥（我最初选择这里的原因）；服务绝赞，西餐厅的Ada韦经理和客房部邓经理完美诠释了酒店人的认真负责和热情。酒店提供长隆和码头接送，现在入住还送下午茶，实在想不到不选择**酒店的风格，以后还会推荐给朋友们！主楼比较新，对于装修有要求的朋友可以选择主楼，但是房间稍微小一点，另外每天还有免费瑜伽课，非常棒！ps洗漱用品很赞！,豪华海景双床房
H13,2020-06-20,好的很！！！,豪华海景双床房
H13,2020-06-20,很好很好很好,豪华山景大床房
H13,2020-06-21,大堂经理周小姐服务好. 态度好。下次来**酒店还订这家,豪华海景大床房
H13,2020-06-21,环境非常好，躺在床上就可以看到港珠澳大桥，二楼中餐厅口味不错，价格适中，送的下午茶品种多，份量大，赞！,豪华海景双床房
H13,2020-06-21,酒店离海边情侣路很近，位置很好，景色很棒。还免费给升级了海景套房。服务员也很热情，给女儿送了小兔子玩偶和酒精洗手液。早餐绝对丰富。,贵宾楼豪华海景大床房
H13,2020-06-22,首先酒店的位置无敌，去哪都方便。房间干净卫生，而且特别安静。非常感谢周婵经理！悉心准备的许多小细节让人感到贴心与温暖。很完美的一次入住体验！,贵宾楼豪华海景大床房
H13,2020-06-24,环境优美，依山傍海，前台服务态度热情，房间干净。,贵宾楼豪华海景大床房
H13,2020-06-24,非常不错的酒店，酒吧街旁、紧挨情侣路海边，看日出最好,贵宾楼豪华海景大床房
H13,2020-06-24,酒店位置很不错，海景很好，对面就可以看到港珠澳大桥，视野开阔，让人心情不错，刚觉超棒！,贵宾楼豪华海景大床房
H13,2020-06-26,酒店依山傍海、闹中取静，位置绝佳，房间宽敞干净，入住体验相当棒,贵宾楼豪华海景大床房
H13,2020-06-26,酒店服务很好，早餐也很丰富。订了第二天的晚餐海鲜自助，也很满意。位置能看到海景，非常不错。而且有很适合小朋友玩的乐园，非常推荐亲子入住,贵宾楼豪华海景大床房
H13,2020-06-27,酒店位置很好，景观不错，我这次住的是主楼，斜对角一点的位置，虽然设施还算新但是房间确实比较小，服务吧就算一般，确实没有感受到五星的服务，而且房间的被子总有一股味道，隔音也比较差，晚上能听到楼上的说话声音，下水的声音。,贵宾楼豪华海景大床房
H13,2020-06-27,酒店位置好，挨着情侣路的，前台小姐姐给升级了大房型，着实大，哈哈哈，大堂副理梁震，从入住介绍酒店设施及周边景点，细致入微，到离店之前问询还有什么需求，服务周到细致，交通便利，早餐相当不错??，品种多，水果好吃??，特别是菠萝，哈哈哈哈哈??，期待下次再见,贵宾楼豪华海景大床房
H13,2020-06-27,酒店面朝大海，可以看到港珠澳大桥，新开了儿童俱乐部，小朋友每天都过去玩得很开心，餐饮部的服务很好，尤其是明月小姐姐和饼房李宇师傅，明月小姐姐特别照顾我们的小朋友，每天下来吃早餐都帮她们取餐，跟她们一起互动，并且赠送了可爱的小礼物，饼房的张宇师傅是已经在收餐走了，但是小朋友很喜欢吃蛋糕，又重新去拿到小朋友，对小朋友很照顾，服务态度很好。,贵宾楼豪华海景大床房
H13,2020-06-27,停车位置充足，服务很好，入住迅速，前台升级房间，房间风景很好，可见大桥 海景开阔，卫生很好，设施全备，早餐出品丰富，品种很多，餐饮部吴经理服务很好，给我们特殊照顾，还有餐饮部的Ada经理很细心，照顾我们小朋友，帮忙取餐，赠送小蛋糕，与小朋友互动很好，这次住得很满意。,贵宾楼豪华海景大床房
H13,2020-06-27,地段 景观 服务都很棒 下次去**酒店还会住这 每个环节的服务都很好 重点赞一下 房间的这幅画有点潦草 哈哈哈,贵宾楼豪华海景大床房
H13,2020-06-27,酒店各方面都相当的满意，让我映像最深刻就是大堂副经理梁振从入住到离开关心与慰问有一种一见如故的感觉，住宿各方面都很舒服，相当满意,豪华山景双床房
H13,2020-06-27,酒店的位置真的好赞！设施也很全面！赠送的下午茶真的太走心了！,豪华海景双床房
H13,2020-06-27,服务确实太好了，应该是我住过体验最好的五星级酒店。一开始早餐问题造成了些理解上的偏差，但是服务人员都很到位，多次跟我沟通，前台人员黄丽还帮我升级了房间。后面大堂经理梁震一直招呼我们一行人 还给送水果送糖水，太棒了，下次来**酒店还会住这个酒店,豪华山景大床房
H13,2020-06-27,明月小姐姐服务很好，细心周到，特别照顾我们第一次过来玩的朋友，包括介绍酒店，餐厅的出品，朋友也感受到了餐厅服务人员的热情，西餐厅的自助晚餐出品也很好，自助晚餐食材新鲜，品质很好。,贵宾楼豪华海景大床房
H13,2020-06-27,每次来**酒店的首选，房间的布置和景观都非常好，住得很舒心，酒店工作人员都非常温柔，尤其是餐饮部服务Ada经理全程提供了很多帮助，细心耐心的解答我们的景点问题，让我们在有宾至如归的亲切感，感谢,贵宾楼豪华海景大床房
H13,2020-06-27,会再次选择！,贵宾楼豪华海景大床房
H13,2020-06-27,酒店大堂梁经理服务热情周到，知道我们要去长隆，专门给了四套雨衣，还安排酒店专车负责接送，从长隆回酒店时，专车司机张师傅带我们绕海边走，欣赏了一下海景。餐饮部韦经理看见我们带了两个孩子，在我们离开酒店当天给孩子准备了下午茶的餐点，真的是贴心。这次的住店非常满意。,贵宾楼豪华海景大床房
H13,2020-06-28,端午节考虑到外出风险，最后选择**酒店，这酒店网上评分比较高，所以最终也确认了这一家，住了三天，说说感受吧。虽说都是情侣大道上的五星酒店，价格相对来说偏高（可能是过节，也能理解），如果你不差钱，那就无所谓了，硬件没得说了，高大上，泳池健身房配套的都有，很不错，早餐花样多，中外旅客都能满足，这酒店服务我个人觉得热情，到位。特别要感谢前台周美女，山景房免费升级海景房，这个很给力，同时酒店配车，接送去长隆，感谢耿师傅。一句话，如果你不差钱，同时又要顶级的服务，选择这家酒店不后悔。,经典山景双床房
H13,2020-06-28,**酒店是我住过最有温度的酒店之一，从踏入酒店那刻开始你会发现服务员彬彬有礼、热情周到，让人无比舒心！这方面比定位更高端的**酒店瑞吉还要好，下次来**酒店还会选择海湾！这里要特别感谢Jenny副总、Ada韦，你们的亲和力让我留下深刻的印象，也令我的旅程增色不少！,豪华海景双床房
H13,2020-06-28,很方便，环境好，早餐丰富,豪华山景大床房
H13,2020-06-28,早餐丰富 客房干净,贵宾楼豪华海景大床房
H13,2020-06-28,舒服整洁 服务过关,贵宾楼尊贵海景套房
H13,2020-06-28,服务不错 干净整洁,豪华山景双床房
H13,2020-06-29,基本高分，就是停车场小了,豪华山景双床房
H13,2020-06-29,服务很棒，大堂副理小梁全程微信服务，推荐景点，安排甜点，还免费延长退房时间。酒店位置非常好，走到海边只要5分钟，而且一路上很舒服。海景房可以看到港珠澳大桥，风景很美。闹中取静，低调奢华，我喜欢。哦，对了儿童乐园有个超级大的滑滑梯，宝宝玩得很开心。,经典海景家庭套房
H13,2020-06-29,舒适安心强力推荐,豪华山景双床房
H13,2020-07-01,酒店温馨，服务一流,贵宾楼豪华海景大床房
H13,2020-07-01,环境好，服务好，免费升级房型,豪华山景大床房
H13,2020-07-01,这是入住海湾，非常满意，订的是带接送机套餐的房型，司机大哥服务很周到，提前就与我联系确认，然后当天一下飞机，收到的第一条信息也是司机大哥的，感觉很温暖，然后让我震惊的事来咯......酒店竟安排了玛莎拉蒂来接我，玛莎拉蒂耶！！！我还是第一次坐呢...这也太赚了吧，酒店离机场有一个多小时的路呢，就因为我订了这个套餐，来回接送都免费，而且都用玛莎拉蒂，这酒店值得推荐！！！,豪华山景双床房
H13,2020-07-02,房间正对面就是海景，落地窗非常棒,贵宾楼豪华海景大床房
H13,2020-07-02,第一次来**酒店，网上选了好久订了**酒店，确实和评价一样，服务很周到，一下车有人拿行李，量体温，办完手续送到房间，退房时候东西落下的，还没走远，本来说回去拿的，结果酒店安排司机直接给送过来了，太感谢了，下次来**酒店还住这家。,豪华山景双床房
H13,2020-07-02,适合带孩子，早餐品质不错，尤其是前台服务特别好，房间安静，人也不多，下次还来的，点明那个亲子套房。,豪华海景大床房
H13,2020-07-02,酒店服务很好，给客人从山景房升级到看到港珠澳大桥的海景房，接待的客人很满意，早餐不错，酒店设施也很完善，下次还来,豪华山景大床房
H13,2020-07-03,超级超级好的住宿体验，我们是家庭三代出游，带爷爷奶奶来看海。这里的工作人员特别的热情，都非常贴心的照顾我们，想的很周到，施经理亲自带我们升级房间，房间的落地窗看海景一级棒??管家姜姜，张裕艳，林泗清都特别细心，晚上给爷爷奶奶送牛奶和糖水，还有很多工作人员都很热情的招待帮助我们！房间很新，住宿特别舒服，卫生也很好的，还有特别丰盛的下午茶和早餐，下次来**酒店一定还选择**酒店！,豪华山景双床房
H13,2020-07-03,超级超级好的住宿体验，我们是家庭三代出游，带爷爷奶奶来看海。这里的工作人员特别的热情，都非常贴心的照顾我们，想的很周到，施经理亲自带我们升级房间，房间的落地窗看海景一级棒??管家姜姜，张裕艳，林泗清都特别细心，晚上给爷爷奶奶送牛奶和糖水，还有很多工作人员都很热情的招待帮助我们！房间很新，住宿特别舒服，卫生也很好的，还有特别丰盛的下午茶和早餐，下次来**酒店一定还选择**酒店！,豪华海景双床房
H13,2020-07-04,酒店位置不错，靠海，海景房可以看到澳门、港珠澳大桥，夜晚灯光漂亮。韦经理和小高美女服务十分热心周到，关怀备至，吃不完的下午茶点心还帮忙打包，点赞,豪华海景双床房
H13,2020-07-04,酒店环境整洁，房间布局堪称完美，优雅又不失情调，服务周到，让人无比舒心。给我营造了一种家的感觉，无论大处到小处都是那么无懈可击，价格也很合理，并且在情侣路附近，前台小姐姐金涵帮忙升级了房间，不仅设施齐全而且更漂亮面积还大，房间外观是现代质感的建筑，简洁典雅，造型刚中有柔，尽显青岛地域建筑风情。房间内厅和卧室都是正南向的。宽敞的阳台，将蓝天、海水和阳光融合在一起，白天可感受阳光的明媚，晚上可享受满天星光的浪漫。会体会到奢华海景风光，流连忘返。酒店位置位于市中心地段，外出购物非常的方便，酒店的大堂装修豪华，进去以后给客人的视野非常开阔。同时金涵也很热情几乎对于客人的要求是有求必应。酒店房间的设施非常先进，同时房间里面的卫生也很干净，诺大的落地窗可以看到整个城市的夜景，酒店房间里面的床也很舒适。金涵对酒店设施及周边景点，到晚上订外卖还推荐相关店铺，全程微信服务，事无巨细，所有问题均一一解答，服务亲力亲为，真的感觉到顾客就是上帝，海景房客人看到港珠澳大桥，景色还很棒。我的朋友都对他大力称赞，称赞她很有才能，是一个出色的工作者。我在此更恭贺贵公司能聘请得一个出类拔萃的人才，他日一定能为公司取得更好的佳绩。对了，顺带点名表扬礼宾部的小黄，笑容温暖，气质形象佳。,豪华山景大床房
H13,2020-07-04,一次非常满意的入住，酒店人员服务非常好，原本预定了豪华海景大床房，但个人喜欢房间空间大一点的，前台叫人带我去贵宾楼看另外的房间，贵宾楼的望海房面积大很多，原本说贵宾楼的装修旧一点，但房间很干净 也没有很旧的感觉，只是装修风格不一样而已，房间送了水果盘，晚上还贴心的送上两杯牛奶，预定的房间送了双早还有双下午茶，但时间问题都没享受到，但非常感谢酒店的贴心服务 让我这个旅行有了一份归属感。,豪华海景大床房
H13,2020-07-05,个人觉得这个酒店可以说是**酒店最好的酒店了，无论环境、服务或是位置，都是符合五星级的标准。还有早餐，非常丰盛，用餐的环境也是非常的雅致。总之，选择它没错！,贵宾楼豪华海景大床房
H13,2020-07-05,环境优美，服务态度很好，主动帮小朋友的衣服烘干，非常感谢,经典海景双床房
H13,2020-07-05,住过不少酒店，第一次点评，这家酒店的服务确实不错，没到酒店就有人提前联系，帮忙安排好房间，到了之后专人接待，刚好这次过去要请朋友吃一餐饭，本来去之前还纠结去哪里吃，没想到这么靠谱，介绍的餐厅朋友特别喜欢，酒店里酒店外的事情都能帮忙安排，真是太感谢了，下次去**酒店一定会再住这家。,豪华山景大床房
H13,2020-07-06,很满意的一次入住，大堂门童服务很热情，看到车过来，马上跑出来帮我开车门，拿行李，前台的小姑娘还帮我升级到了海景房，最后一直把我送到电梯口，给我介绍酒店的设施项目，服务很热情，很细致，给你们点赞。,豪华山景大床房
H13,2020-07-06,看到网上这家酒店的众多好评特意定了一晚。果然没让人失望。酒店的位置很好，硬件也非常好，前台小姐姐看我们带了孩子，很热情地升级到家庭房，孩子们简直太喜欢了。酒店施经理还专门和我们第二天要去的横琴湾酒店联系，让我们第二天能提前安排入住，简直不能更棒！,贵宾楼豪华海景大床房
H13,2020-07-06,过来出差，酒店确实不错，从进门到办入住再到房间，每个环节服务都不错，服务人员彬彬有礼，感谢前台小姐姐，房间卫生也很干净，住的很舒服。,豪华海景大床房
H13,2020-07-06,酒店有去长隆的车子，很方便第二天过去长隆。同时有个儿童游乐场，虽然不大，但是由于人也不多，服务的小哥哥姐姐非常贴心的带几个孩子，孩子们玩得很开心。酒店景观一级棒，下来就是情侣南路，附近也有很多吃饭的选择，非常不错,贵宾楼豪华海景大床房
H13,2020-07-06,是迄今为止我们住过的服务最好的酒店！给韦经理和施经理点赞！点赞酒店业的海底捞！再来**酒店还想住这里！,豪华山景大床房
H13,2020-07-07,海景很漂亮,豪华山景大床房
H13,2020-07-08,位置非常好！,贵宾楼豪华海景大床房
H13,2020-07-08,酒店就在情侣路，环境很好，服务很棒！我们一家有老人有小孩，酒店提供的用品也不错，还贴心煮了糖水，泳池也很干净，被太阳晒得很暖和。,经典海景家庭套房
