酒店名称,评论日期,评论内容,入住房型
H18,2020-08-06,房间非常棒,君悦园景双床房
H18,2020-08-06,第一次住这家，不错,君悦大床客房
H18,2020-08-07,免费升级江景房，赞??,君悦双床客房
H18,2020-08-07,很棒，经常住旗下品牌酒店,君悦大床客房
H18,2020-08-07,带娃去玩，虽然小蛮腰偏了一点，但风景也是极好,广州塔景房
H18,2020-08-07,第一次在五星级酒店睡不足1米宽的床，两边都是空的，老年人一个翻身差点掉下床，真心不建议入住他们的双床房，紧凑度堪比香港的房间格局,君悦园景双床房
H18,2020-08-07,管理严格一句话，高档酒店性价比一般般没有自助早餐，装修还可以停车费要收费，反正下回我不会再住，没有服务,君悦大床客房
H18,2020-08-08,珠江新城核心地段的酒店，这次特别在工作日住了一下，总体感觉是非常自在的，21世纪的新酒店便捷感，特地设在高楼层的lobby也非常具有隐秘性。虽然房间格局特殊，但利用率非常高，也不会让人觉得不舒服什么的，非常赞！下次有机会还会来住的！,君悦大床客房
H18,2020-08-08,**保持品质服务！,君悦大床客房
H18,2020-08-08,酒店不错，在花城汇广场旁边。,君悦大床客房
H18,2020-08-08,优点:酒店位置还不错，前台服务很热情，保洁人员也很好缺点:房间布局迷宫一样；床头是浴室，屋子比较潮湿；灯光控制也不是很合理；自助晚餐服务人员不足，即使提前预订也不会有比较满意的位置（除非提前一星期），这是住过宾馆当中唯一一家住店客人没有优先权益，因为带孩子提前预定距离取餐区较近地方，而且特意早去，只为早吃完早走人，毕竟不是来拍照约会打卡请客吃饭，结果即使空了很多位置，还是给了最远的座位，难道就不会协调一下吗？住了四天最后一顿晚餐真是一次糟糕的经历，根本吃不下，离店前留下很深刻的记忆，但却不是美好的；既然自助晚餐生意这么火，可以考虑把宾馆业务取消改成饭店；早餐一般吧,广州塔景房
H18,2020-08-08,早餐好吃，房间舒适,君悦大床客房
H18,2020-08-08,很好，，，，,君悦大床客房
H18,2020-08-08,位置特别好，服务周到，送一次性消毒纸巾、免洗手消毒液等，房间干净清洁。,君悦大床客房
H18,2020-08-09,酒店位置一级棒，对面就是安永大厦和高德置地广场。服务也很周到友好，早餐丰盛多样，必须好评。只是房间的隔音效果可能会没那么好,君悦大床客房
H18,2020-08-09,酒店不错，值得再次入住,君悦大床客房
H18,2020-08-09,又续住了套房，很不错。,豪华套房
H18,2020-08-09,第一次住这里，不错！,君悦大床客房
H18,2020-08-09,还可以吧，就是大堂和客房分两个电梯走，比较麻烦,君悦大床客房
H18,2020-08-09,酒店位置还可以，环境服务都说的过去。,君悦大床客房
H18,2020-08-09,纸巾很臭很劣质，五星的酒店不应该吧……入住后下楼比较麻烦,君悦双床客房
H18,2020-08-09,酒店位置很不错 在cbd这边 设施确实有点老旧 但是卫生还不错 主要是工作人员态度非常棒 晚上觉得房子有点潮 就带着我们看了好几间让我们选择 并且还提供了空气净化器 好评,君悦大床客房
H18,2020-08-09,位置很好，夜景好看,君悦园景双床房
H18,2020-08-09,服务好，很贴心。,豪华套房
H18,2020-08-10,房间小 浴室设计不怎么合理,君悦大床客房
H18,2020-08-10,酒店设施、服务尚可！餐饮就不近人意呀,君悦套房
H18,2020-08-10,品质有保障，重点是早餐不错,君悦大床客房
H18,2020-08-10,都是这样子的管理,君悦大床客房
H18,2020-08-10,酒店位置很好，出行很方便。就是酒店房间布局都有点奇怪，有点像迷宫，然后从停车场到房间得转两次电梯。其他的都还可以。,君悦大床客房
H18,2020-08-11,很赞的酒店,君悦大床客房
H18,2020-08-11,之前去广州塔住过一次，这次果断给几个小伙伴预订了，环境卫生包括早餐都行，就是旧了点。,君悦园景大床房
H18,2020-08-11,早餐不错,君悦园景双床房
H18,2020-08-12,格局很好 床很舒适,君悦大床客房
H18,2020-08-12,早餐非常好！,君悦双床客房
H18,2020-08-12,位置方便，就是大堂设定在22层不太适应,君悦大床客房
H18,2020-08-13,房间格局有点不是很亮,君悦大床客房
H18,2020-08-13,酒店设施挺好的！,君悦套房
H18,2020-08-13,空间很大，很安静,君悦大床客房
H18,2020-08-13,房间一般，除了位置好以外乏善可陈。结账开发票还额外收我6%的税点，这是明令禁止的吧。,君悦大床客房
H18,2020-08-14,交通方便离花城广场近,君悦园景大床房
H18,2020-08-14,地址绝对优,君悦园景双床房
H18,2020-08-14,来广州出差选择了不会错的商务第一选择，地理位置很不错，商务风，出去就图住个踏实，住的很舒服，标准5星。,嘉宾轩园景客房
H18,2020-08-14,交通方便早餐丰富,君悦园景大床房
H18,2020-08-14,早餐自助丯富,君悦套房
H18,2020-08-14,自助餐好像不错,君悦大床客房
H18,2020-08-14,酒店接待人员服务热情，地理位置出行方便，洗发沐浴产品挺好，早餐品种丰富，用餐环境很赞因为带孩子办事，定了双床，床只有1米，很少见这么窄的了，老怕孩子掉下去了，也有些老旧塌陷了。如其他住客所说房间设计不习惯，总体上房间舒适度一般吧,君悦园景双床房
H18,2020-08-15,在餐厅蚊子较多，一会功夫腿上被叮了三个包！,广州塔景房
H18,2020-08-15,早餐丰富 房间设施不错 装修风格节约时尚 适合商务出行,豪华套房
H18,2020-08-15,只能说还可以吧,君悦大床客房
H18,2020-08-15,多次入住这家酒店了，一如既往地好评。早餐丰富，地理位置优越，房间宽敞明亮，服务员服务周到，热情。赞一个。,君悦大床客房
H18,2020-08-15,多次入住这家酒店了，房间卫生很好，前台和服务员服务周到，态度好，早餐非常丰富，地理位置优越，5星级名副其实。,君悦大床客房
H18,2020-08-16,位置好，服务好，早餐味道不错，就是房间内布局怪怪的，进门的感觉不敞亮。,君悦大床客房
H18,2020-08-16,除了楼层不高，有点贵，其他都好！,广州塔景房
H18,2020-08-16,服务好设施新,君悦大床客房
H18,2020-08-16,交通方便步行去花城广场方便,君悦园景双床房
H18,2020-08-16,首先，这个楼层特别不方便。你需要先到22层大堂，然后走另一部客房电梯，往下去你的客房楼层。这意味着你如果从房间出门，要原路返回，先从客房电梯上到22层，再走另一部电梯下到1层出去。其次，房型和设施非常迷惑。房型让人找东西找半天，设施也因为房间空间较小而构造简单和不人性化。我们定的塔景房，最后入住10楼和14楼，看塔景只能说看得到，周围都是高楼，看得也不太方便。最后，我强烈吐槽一下这个花洒，壁挂时无法扭动上下角度，搞得我洗澡只能手持。我朋友说要怎么怎么搞一下就可以扭动，但是我上下左右扭动半天都不知道怎么弄，我觉得让客人这么费劲的设计，就很反人类，很影响心情。总之这家**我是不会再来了，住了一晚就赶紧换酒店了。,广州塔景房
H18,2020-08-16,觉得一般般,君悦园景大床房
H18,2020-08-16,还不错！！,君悦大床客房
H18,2020-08-16,还不错！！,君悦双床客房
H18,2020-08-16,还不错 ！！,君悦大床客房
H18,2020-08-17,设施有点老，但品质很好，**的服务没的说，特色空中大堂很**，性价比高，早餐收餐稍早，而且稍显狼狈，不太五星级,君悦大床客房
H18,2020-08-17,环境优美，服务好,君悦双床客房
H18,2020-08-17,一人早餐，环境好,君悦双床客房
H18,2020-08-17,早餐棒棒哒，房间景色不错，唯一的不足就是浴缸和马桶都比较精致。,君悦园景大床房
H18,2020-08-17,还算可以吧,君悦大床客房
H18,2020-08-18,早餐很不錯，房間改裝的格局有些浪費空間，帶小朋友入住得選大床房，單人床一米帶孩子睡太窄了。地理位置好，環境還不錯,君悦大床客房
H18,2020-08-18,不错不错 环境不错 干净卫生 住了两晚 服务态度很好：：：：：：：：：：：：：：：：：：：：：,君悦大床客房
H18,2020-08-18,四星都勉强。房间太小，设施陈旧。,君悦大床客房
H18,2020-08-18,这家酒店在**酒店新城花城广场附近，周边都是高楼大厦，也有几个更豪华的酒店，这一家价格最低了，而且也要点名表扬这里的早餐，中西式品类都有，味道也很好，我走的时候还带了两个益力多路上喝，这还是前台人美声甜的小姐姐告诉我的，还为我家娃免费加了一份早餐。就是大家都吐槽他家双床好小，确实是1米的，挨在一起特小气。但是枕头和被子都很软很舒服，服务也很好，晚上回来浴室门，地垫，窗帘都准备好了。还有他家房间布局，我走的时候才发现有各种隔门可以完全把浴室部分遮起来，但真的像迷宫 要去发现才行。对了，疫情期间还送了一些消毒片洗手液，蛮实用的。,君悦双床客房
H18,2020-08-18,最近每次出差都住这家酒店，办理入住在22楼，酒店的床睡得很舒服，只可惜每次下班晚，没发抽时间去游泳????，但是能美美滴睡上一觉也是很棒的！,君悦大床客房
H18,2020-08-18,非常好的一次体验，出差订了这间酒店，离公司比较近，晚上check in的时间有点晚，前台小哥哥给我升级了行政套房，很赞！,君悦大床客房
H18,2020-08-18,不错 环境干净整洁卫生 服务态度很好...............................,君悦双床客房
H18,2020-08-19,很不错，价格不高，地理位置非常好！方便,君悦大床客房
H18,2020-08-19,第3次住，早餐特别丰富，环境舒服，就在华城广场楼下散步直接看小蛮腰，风景一流！值得5星！,君悦大床客房
H18,2020-08-19,非常好！！！,君悦大床客房
H18,2020-08-20,酒店位置优越,广州塔景房
H18,2020-08-20,位置非常好,君悦双床客房
H18,2020-08-20,房间设施略显老旧，卫生有死角，不过房间视景很不错，可以看到小蛮腰。建议选择此房型的用户在开房或下单时直接要求尽量给开高楼层的房间，至少避开平台层。,广州塔景房
H18,2020-08-20,服务好，早餐不错，泳池里的按摩池不错,君悦大床客房
H18,2020-08-20,作为凯悦的会员我挺遗憾，本以为**还会舒服点，但真的很遗憾，位置还可以，但总台放在22楼很不习惯，房间里干湿不分区，味道也不太好，装修的风格和配置也落后了，这个价格这个品牌，这样的软件硬件邮有点落差，下次一定不会选这里。,君悦园景大床房
H18,2020-08-20,酒店年代有些老，虽然有早餐，但是想着一般也没去吃！位置不错。其它方面就算一般吧。,君悦大床客房
H18,2020-08-20,位置很好，市中心，小蛮腰附近。去哪都方便几分钟车程。价位是附近五星最便宜的。简直太划算了！连住7夜。以后朋友来广州玩，推荐！,君悦双床客房
H18,2020-08-20,地点适中非常好，服务态度很好，环境以及设施很好。餐厅都非常棒，只是双床房的床有点小，这是唯一的美中不足,君悦双床客房
H18,2020-08-20,酒店体验感很好。来广州旅游7天，选了很多家五星酒店，感觉大同小异。后来本地朋友帮忙选的这个，说这个位置最好！果然，就在小蛮腰附近，这个价位住小蛮腰附近简直太值了！！地下停车场很好找，房间双面景观。本来定的5晚，果断续住。下次来广州还住这！！,君悦大床客房
H18,2020-08-21,地理位置好,君悦大床客房
H18,2020-08-21,服务卫生都很好,君悦大床客房
H18,2020-08-21,好，性价比超高！,君悦大床客房
H18,2020-08-21,吃的超好，价格超划算,君悦大床客房
H18,2020-08-21,极为丰盛的早餐，健身房也很不错，高层看广州，位置方便，推荐,君悦大床客房
H18,2020-08-21,同学聚会选择了这里，隔音不错的酒店，厕所非常大理周围逛的地方也很多。,君悦大床客房
H18,2020-08-21,房间小，有点旧,君悦双床客房
H18,2020-08-21,泳池有点小了。,君悦大床客房
H18,2020-08-21,一直住这里。,君悦大床客房
H18,2020-08-21,很喜欢的一家酒店,嘉宾轩大床房
H18,2020-08-22,还不错 出差首选 还不错 出差首选 还不错 出差首选 还不错 出差首选 还不错 出差首选 还不错 出差首选,嘉宾轩大床房
H18,2020-08-23,公司出差预定，地理位置优越，前台接待服务很好，房间舒适，大气，早餐很丰富，味道很好，很满意，退房后申请发票很快,君悦大床客房
H18,2020-08-23,前台效率很低，服务态度不好，感觉一直有被怠慢。办个入住用了快一个小时才好，办理的过程中也一直在忙别的事情，经常把我们扔到一边，忙完其他事情又回来继续办入住，断断续续大半个小时才入住房间,广州塔景房
H18,2020-08-23,感觉很舒服。推荐。下次来会住。位置很不错,君悦双床客房
H18,2020-08-23,疫情期间 消毒做的特别到位酒店就是旧了点 卫生还是弄的特别好的 工作人员都很热情有任何问题都还是很愿意帮助的,广州塔景房
H18,2020-08-24,环境不错，很安静。,君悦大床客房
H18,2020-08-24,环境不错，很安静。,君悦大床客房
H18,2020-08-24,早餐可以的，就是双人房的床太小了。,君悦双床客房
H18,2020-08-24,特别表扬客户经理陈勃廷，服务热情周到，还送了小甜点,君悦大床客房
H18,2020-08-24,服务还不错,君悦双床客房
H18,2020-08-24,有早餐，很不错,君悦大床客房
H18,2020-08-24,?? ??? ?? ??? ?? ?? ?? ??? ??? ??? ?? ????. ??? ???? ?? ?? ?? ??? ??? ??? ?? ?? ?? ????. ? ??? ??? ??? ????. ?????? ??? ?????? ?? ??? ?? 10? ??? ????? ?? ???? ????,君悦双床客房
H18,2020-08-25,酒店位置好,君悦双床客房
H18,2020-08-25,还蛮好的 优惠的价格住到**很开心……,君悦园景大床房
H18,2020-08-25,酒店设计不错 就是年数久了 有点旧 其他整体感觉不错 唯一就是进进出出都要先上后下略显麻烦,君悦双床客房
H18,2020-08-25,客人反映还不错,君悦大床客房
H18,2020-08-25,首先说设施吧，环境干净且观景点不错，服务态度好电话沟通解决问题快，浴缸的设计感添加体验感很好，早餐品种丰富，口味也很合适。来广州感受市中心的美景都很合宜。床舒适睡眠佳。不会吵闹整体感觉不错。,君悦大床客房
H18,2020-08-26,交通非常方便，周围都是金融机构，非常适合出差办事居住，酒店配套齐全，床很舒服，早餐很丰富。晚上景观无敌了,君悦大床客房
H18,2020-08-26,这次入住**酒店两个晚上 很喜欢 入住当晚时间比较晚了就在西餐厅简单吃点 送来的开胃面包非常好吃 我心里已经给这个酒店很好的评分了 入住体验也很棒 枕头 床垫 浴室用品 都很合意 前台问我需要牙具吗？我说不需要 这样的管理细节值得点赞 酒店早餐不用说 也是超赞 下次来广州 还会入住**,君悦大床客房
H18,2020-08-26,酒店大门和22楼前台很高级的感觉 可是跟房间不配 房间布局很差 设施很旧 连开关灯的按键都很旧很难按 总体一般 不值这个价,君悦套房
H18,2020-08-26,床太小，前台办事慢,君悦双床客房
H18,2020-08-27,**品质一流，早餐当时品种不算多，但是有特色的蒸笼，味道是不错的，房型设计比较偏海边度假类，可以有景观。同楼层嘉宾轩可以看到小蛮腰，还不错,君悦大床客房
