酒店名称,评论日期,评论内容,入住房型
H18,2020-01-01,一如既往的好，很方便,君悦园景大床房
H18,2020-01-01,珠江新城核心位置，周边很方便，而且晚上饭后可以散步，有点点中央公园的意思,君悦大床客房
H18,2020-01-02,中心地带，还可以吧,君悦园景大床房
H18,2020-01-03,客房：低楼层客房因为旧，霉味很重。整晚都咳嗽。后来和前台反馈之后给我换到楼上，房间应该是重新翻新的，没有那种霉味。户型由于床背板后面是玻璃淋浴阁，所以很潮湿容易发霉。,君悦大床客房
H18,2020-01-03,酒店位置很好出行非常方便周边商场很多,君悦园景大床房
H18,2020-01-03,房间隔音不好。外面的车声听得清清楚楚。，像睡在了马路上。,君悦大床客房
H18,2020-01-04,环境好，服务也还行,君悦大床客房
H18,2020-01-04,早餐不错，品种丰富。适合一家老小游玩居住。位置好，去花城广场很近，花城汇就在旁边。有停车场，公共交通也方便。,君悦大床客房
H18,2020-01-04,位置挺好，去花城广场很近，花城汇就在旁边。有停车场，公共交通也方便。早餐不错，品种丰富。适合一家老小游玩居住。,君悦大床客房
H18,2020-01-04,碰上灯光节，所以外面的声浪一波一波进来房间。不过挺有气氛的。位置挺好，去花城广场很近。有停车场，公共交通也方便。,君悦大床客房
H18,2020-01-04,环境服务一般，浴室不大方便,君悦大床客房
H18,2020-01-04,交通便利，离地铁站也不远，有免费停车。房间卫生和床品干净，设施齐备。在珠江新城，附近用餐，游逛，购物都很方便。,君悦大床客房
H18,2020-01-04,设施不错 服务周到.,君悦大床客房
H18,2020-01-04,酒店位置好，房间一般,君悦大床客房
H18,2020-01-04,好好好好好,君悦大床客房
H18,2020-01-04,出差过来广州，朋友在珠江新城，自然选了附近的酒店…首先，地处广州最繁华地段，方便。并且安全性足够了，check in在22层，房间在下面楼层，但进出酒店得从房间回到22层换了电梯下到一楼。健身房在24层，6点半到晩上10点坐一直开放，跑步机24小时可以甲，赞！标准大床旁卫生1日干湿两用分开到完全不在一个区域…房间没很大，但釆光好，大窗…床算舒服…没有usb接口，没很方便,君悦大床客房
H18,2020-01-04,在珠江新城中心地带，去花城汇很近。用餐，游逛，购物都很方便。离地铁站也不远，停车当然也是免费的。房间卫生干净，设施齐备。,君悦园景大床房
H18,2020-01-05,非常不错，环境好,君悦大床客房
H18,2020-01-05,非常不错啊,君悦双床客房
H18,2020-01-05,早餐是广州最好一间酒店，交通便利，洒店景色宜人，方便到广州地标花城广场，在晚上看到广州夜景灯光及广州塔雄建筑,广州塔景房
H18,2020-01-05,酒店服务还不错，环境也很好，附近离k11很近，步行过去就可以，太古汇也很近，地铁很方便！,君悦园景大床房
H18,2020-01-05,服务态度很好??,君悦大床客房
H18,2020-01-05,总体不错??就是带大孩子住不方便，大床尺寸1.8米宽，要是2米宽就好了,广州塔景房
H18,2020-01-06,还可以，床很软,君悦大床客房
H18,2020-01-06,珠江新城的中心，位置绝佳，交通便利，,君悦大床客房
H18,2020-01-06,早餐比较丰富，酒店交通非常方便。,广州塔景房
H18,2020-01-07,位置非常不错,君悦大床客房
H18,2020-01-08,五星水准还是有的但设施确实老旧了。,君悦大床客房
H18,2020-01-08,酒店卫生干净，整体不错,君悦大床客房
H18,2020-01-11,非常不错的宾馆,君悦大床客房
H18,2020-01-11,入住时前台问我抽烟吗？我说抽烟和不抽烟的房间都可以，只要景观好一点就行。结果给我一间景观很差的，马路对面一栋楼就什么也看不见了，到晚上更惨，原来对面大楼是大幅的灯光广告！只好关上窗帘，全封闭了！,君悦大床客房
H18,2020-01-11,每次入住都很愉快的酒店,君悦大床客房
H18,2020-01-12,房间太小了,君悦大床客房
H18,2020-01-12,啥都好，就是这浴室太迷你了，然后厕所洗脸盆淋浴室??都分开，而且太太迷你了,君悦大床客房
H18,2020-01-13,位置好，就在花城大道旁，楼下就是知名夜店晚装，离大剧院、K11都很近。房间视野开阔，设备也挺好，电视能移动，可以躺着看电视。,君悦大床客房
H18,2020-01-14,总体不错的,君悦园景双床房
H18,2020-01-16,花城广场中心地带交通方便住房舒适,君悦双床客房
H18,2020-01-16,酒店房間設計特別，空間挺大，床褥很舒適。燈光比一般酒店明亮。沙發也挺舒服。沒用早餐不能評論。唯一缺點是大堂在頂樓但房間在下面，每次出門都要先上頂樓在往下，費時間。,君悦大床客房
H18,2020-01-17,酒店环境优美，交通便利，客服人员态度好，早餐种类很丰富，味道也很不错，整体入住体验很好，非常满意，值得推荐！,君悦大床客房
H18,2020-01-18,干净整洁，楼下靠近公园，很适合散步。,君悦大床客房
H18,2020-01-19,还不错挺好的,君悦大床客房
H18,2020-01-19,环境不错，换电梯稍有不便，服务还好，整体还可以,君悦园景大床房
H18,2020-01-21,环境很好很干净，早餐也不错，占据珠江新城，繁华，夜景也不错，酒店总体感觉很舒服，服务很好，入住效率也很高,君悦大床客房
H18,2020-01-23,服务好，当天很晚入住，前台服务员也很贴心。,君悦双床客房
H18,2020-01-24,高档酒店 设计高端豪华 值得推荐,君悦大床客房
H18,2020-01-24,难道你是密密实实没什么事,君悦大床客房
H18,2020-01-26,位置不错，旁边花城有很多小食,君悦大床客房
H18,2020-01-31,环境很好很干净，窗外的景色很美。冲浪池能冲去一天的疲劳。房间有设计感,君悦园景大床房
H18,2020-02-02,错的酒店,君悦大床客房
H18,2020-02-03,方便出行。,君悦双床客房
H18,2020-02-05,环境不错，卫生条件好。交通方便。,君悦园景大床房
H18,2020-02-05,好好好好好,君悦双床客房
H18,2020-02-05,好好好好好,君悦大床客房
H18,2020-02-08,房间布局挺奇特。。。价格挺高，基本持平W酒店，更倾向于W.,广州塔景房
H18,2020-02-09,大年夜入住，房间不大，没什么景，到小蛮腰去到很方便，周边吃的也很方便。下次去广州的话可能还会考虑,君悦园景双床房
H18,2020-02-10,房间都还好，主要是在中心区离公司近。不过电梯换乘就比较麻烦一点。大堂在22楼，check in 了还在坐另外一个电梯去到酒店房间,君悦大床客房
H18,2020-02-18,非常不错！我很喜欢，也很满意！各方面都不错，，，,君悦大床客房
H18,2020-02-27,位置优越，出入方便快捷，非常适合带孩子出游入住。早餐丰富营养，品种多………内设停车场！下次一定会再去,君悦双床客房
H18,2020-02-28,这家店很差，卫生，服务，都很差。,君悦豪华套房
H18,2020-03-07,位置特好，楼下就是花城广场，很舒服,君悦大床客房
H18,2020-03-07,还行。一般。唯一的就是地理位置优越，出去就是花城广场。,君悦大床客房
H18,2020-03-08,没有挑剔的地方 在广州的珠江新城周围全是商业区吃吃买买方便到不行 酒店可以看到小蛮腰夜景也不错 出行很方便 服务很好 因为疫情期间早餐是送到房间的非常贴心 就是房间比较搞笑像迷宫 希望插座可以改善一下,广州塔景房
H18,2020-03-12,酒店设施一般 但是位置好,广州塔景房
H18,2020-03-14,大堂服务态度冷淡。,君悦大床客房
H18,2020-03-20,因为疫情原因，早餐是服务员送到门口的，服务很好，午餐和晚餐也可以打电话预订，都是送到房间门口。服务员热情周到，打印了材料，也给送到房间门口，赞一个。,君悦大床客房
H18,2020-03-20,酒店太旧了，对不起哪个价格！,君悦大床客房
H18,2020-03-20,连续住了9天，退房当天因为司机要三点来接所以想说延迟到2点退房！不让………说今天很多人预定套房…………呵呵！以后不会再住这家酒店了！,君悦套房
H18,2020-03-20,结账时遭遇诸多不顺，且服务意识极差，不会再入住,君悦园景大床房
H18,2020-03-25,非常好，吃的好，住的好，下次还来，地点也好,君悦大床客房
H18,2020-03-28,特别好特别好,行政套房
H18,2020-03-30,很不错的酒店，交通方便，酒店设施也挺好的。,君悦大床客房
H18,2020-04-01,非常不错的酒店,君悦大床客房
H18,2020-04-04,**的品质毋庸置疑，安静、卫生，住的很舒服。床品也不错。疫情期间，要在线办公，家里无法安静工作，就和老公开了酒店，办公不受打扰。,君悦大床客房
H18,2020-04-06,位置极佳！,君悦双床客房
H18,2020-04-12,这次唯一的不好是早餐不能有太多选择！,君悦大床客房
H18,2020-04-12,一间十分温馨舒适的酒店,君悦大床客房
H18,2020-04-12,很不错??????????。,广州塔景房
H18,2020-04-14,住酒店基本不评价，这次实在是”五星级从未有过的体验”。 只能说，对酒店设施没要求的可以住，设施配套实在是太陈旧了……除了地段，视野尚可，其他就……此处省略……,君悦套房
H18,2020-04-15,还蛮不错的,君悦园景大床房
H18,2020-04-15,酒店设施一般，应该是国内旗下品牌比较差的。前台服务一般，几乎谈不上服务，甚至比香港的还差。以后应该不会考虑再次入住了！,君悦大床客房
H18,2020-04-16,挺干净的，满意,君悦双床客房
H18,2020-04-16,挺干净，满意,君悦大床客房
H18,2020-04-17,可能是期望太高，体验感觉在五星酒店中算是比较差。希望有所改变。,君悦大床客房
H18,2020-04-19,连住了六天，很舒适,广州塔景房
H18,2020-04-21,房间设施有些老化，维护欠佳；商务大床房布局不太合理，像迷宫，不知道为什么要设计那么多门；房间插座很少，要找，很不合理；广州酒店开始不提供洗漱用品，前台提供给我的洗漱包是经济型酒店一样的品质，胡须刀非常廉价；疫情期间自助餐完全不是自助，这个倒可以理解，但西式早餐品质很差，吃起来像三线城市的西餐厅出品；淋浴间出水水量不够；酒店地理位置很好，下楼就是花城广场，这是一个加分项，但酒店停车场老破旧，拉低酒店档次。此次体验整体略失望。,君悦大床客房
H18,2020-04-22,酒店的装修风格太旧，布局也很奇怪。,君悦大床客房
H18,2020-04-24,酒店在珠江新城，环境很好，出差很适合,君悦套房
H18,2020-04-24,酒店位置很不错，环境很棒，床业舒服,君悦大床客房
H18,2020-04-24,睡了一晚上腰很痛，床的体验非常不好，早上去餐厅吃饭，出的套餐，如果是这样是不是提前告知一下比较好，体验一般，早知道订其它酒店了,君悦大床客房
H18,2020-04-25,不错不错，房间还是可以de,君悦大床客房
H18,2020-04-26,性价比高，值得一试。,君悦大床客房
H18,2020-04-26,服务好，环境不错，消毒做得很到位,广州塔景房
H18,2020-04-26,服务达标，位置方便，性价比高,广州塔景房
H18,2020-04-26,疫情期间性价比高。,君悦套房
H18,2020-04-26,酒店位置佳。,君悦套房
H18,2020-04-28,很好！服務还是那般好！,君悦大床客房
H18,2020-04-29,地段好看广州塔,君悦大床客房
H18,2020-04-30,与价格不符合,君悦大床客房
H18,2020-04-30,不错，很高大上,广州塔景房
H18,2020-05-01,这家酒店位置特别好，交通方便，离商场近，在新中轴。服务员的态度也特别好，很nice。不过这家店的设施有点旧了。最让我受不了的是我整个晚上睡前，以及每次醒来的时候，都能闻到下水道的臭味！！！！！！！这让我觉得很糟糕！要不是昨晚入住得太晚，是在太累了，我是一定要换房间的！,君悦大床客房
H18,2020-05-01,位置还不错,嘉宾轩园景客房
H18,2020-05-01,每次出差的首选 性价比高 环境高大上 早餐挺多种类的 客服人员挺热情细心的 房间干净整洁 交通便利 强烈推荐,君悦大床客房
H18,2020-05-02,真的一般般,君悦大床客房
H18,2020-05-04,早餐送上门 服务周到,君悦大床客房
H18,2020-05-04,可以考虑的选择之一…,君悦双床客房
H18,2020-05-04,入住前台办理时几乎没有笑容，从填写到入住整整30分钟，想着疫情期间能理解，不过再入住柏悦后发现不是疫情原因，的确是前台接待有问题。爱理不理，需要调吸烟楼层时和更加体现吸烟有罪的感觉。下午三点多办理入住，房间虽已打扫干净，但却让人等候检查方可入住。体验感急差,君悦园景大床房
H18,2020-05-05,舒服方便快捷,君悦大床客房
H18,2020-05-05,位置好，出来就是小蛮腰,君悦大床客房
H18,2020-05-06,入住时给我升级了园景房，房间比较大，双面落地窗，一边看中轴线花城广场，一边看珠江新城绿化带，非常满意！床一如既往舒适，装修很有设计感。房间包两份早餐，可惜疫情期间不是以往的自助餐，而是中式西式两种选择的套餐总体来说还是很好的！,君悦大床客房
H18,2020-05-08,房间里就能看到塔景。这个位置这个景观，**真的性价比太高了，不愧是我的首选酒店。虽然每年都会来广州旅行，但是夜景真心百看不厌。,广州塔景房
H18,2020-05-12,不知道是不是因为开放浴室设计，房间无比潮湿，一推门湿气扑面而来，睡觉时枕头散发着阵阵衣服没有晒干的馊味，恶心至极！也就是晚上应酬晚了懒得折腾，不然一定换酒店！难以置信这是**的房间，以后不会再住。建议入住前问清楚是否开放式的浴室，如果是建议三思！,君悦大床客房
H18,2020-05-12,上下楼有点不方便,君悦双床客房
H18,2020-05-13,服务贴心，交通位置便利，配套设施齐全，环境挺好的，防疫措施到位，家庭旅游度假住这里非常合适，下次来还定这里。,君悦大床客房
H18,2020-05-14,早餐很棒，交通便利，环境优美！,君悦园景双床房
H18,2020-05-14,逼格高了点，大堂在22楼，客房在22楼以下，从客房去哪里都要先到22楼换电梯，不方便,君悦大床客房
H18,2020-05-14,很好，一如既往的好，好位置，好服务，好便利，好餐饮。花城广场就在楼下，春夏秋冬广场环绕，地铁就在楼下，生活餐饮交通各种便利。,君悦大床客房
H18,2020-05-15,感觉一般般,广州塔景房
H18,2020-05-15,开业时间挺久但是总体保养还是可以的,君悦园景大床房
H18,2020-05-16,非常满意下次照常来,君悦大床客房
H18,2020-05-17,继续努力哦,君悦双床客房
H18,2020-05-18,位置好，下楼可以散步,君悦园景大床房
H18,2020-05-18,不错 每次来广州都住这里,君悦双床客房
H18,2020-05-18,环境很安静很舒服，没有嘈杂声，服务到位，干净！而且地段相当不错，市中心，去哪里都方便，还会再来的。,君悦大床客房
H18,2020-05-18,习惯性出差住的地方,君悦大床客房
H18,2020-05-19,性价比非常高,君悦大床客房
H18,2020-05-19,晚上和客户吃饭，喝的太晚，回家又太远。于是看看公司附近有没有什么酒店可以住一晚的。看到**的价格合适，毫不犹豫就订了。到店已经到凌晨2点多，前台还是热情的接待。房间其实保养的还挺不错的，就是格局设计有点摸不着头脑，住过这么多酒店，没有见过这样的布局。床挺舒服的，就是浴缸比较小，没有办法很好的伸展。第二天挺期待早餐的，因为**的凯菲厅是广州最好的自助餐厅之一，但是由于疫情期间，自助餐取消了，变成点单的方式，中式、西式自行选择。味道是不错的，但是没有自助稍有遗憾。**，总体还是很不错的！,君悦大床客房
H18,2020-05-19,设施一般化…,君悦双床客房
H18,2020-05-21,酒店拒绝开具增值税专用发票！ 无论是根据什么文件，这都是违法税法的！ 强烈举报！,君悦园景大床房
H18,2020-05-23,不错的 房间布局很特别。。。。。 喜欢的人会很喜欢 前台服务员态度都很好。。。。。。开业那么久 维护的不错,君悦大床客房
H18,2020-05-23,不错的 房间布局很特别。。。。。 喜欢的人会很喜欢 前台服务员态度都很好。。。。。。开业那么久 维护的还不错,君悦大床客房
H18,2020-05-24,在附近居酒屋吃完飯懶得回家本來想住瑰丽最后選擇了君悅万分差的体验：房間旧异味重、主要不是梅雨天房間的床被都有点潮早上起床穿衣服、衣服也是有点潮湿的 对君悅的好感加上有特價首选君悅拜託如果是這樣的特價房不要再放出來、坏了酒店品牌.…,君悦大床客房
H18,2020-05-24,位置很好 早餐丰盛,君悦大床客房
H18,2020-05-25,怎么说呢，这次疫情期间来的很不爽。第一吸烟房很糟糕，上次住的非烟房，很棒。当然这是自己选的，无可厚非了，本来烟味就大，再加上自己抽烟，给熏到了。但是你不能空调不行啊，对不对，热的冒汗，我的天啊。第二要了空气净化器，洗刷用品和两条充电线，还行都给了。但是充电线硬是告诉我，数量太少了，为了满足其他客户的需要，只能给我一根。可是这线才多少钱？你即便是各种接口的每间房各配一根，也花不了多少钱吧，毕竟你是五星，毕竟你是**啊，毕竟我要的时候已经晚上十一点了。算了，自己没带怎么好意思怪你们呢。第三房间老旧不说了，吸烟房嘛，被烟味腐蚀老旧了可以理解的，但是房间里的咖啡机呢？一瓶可乐收我30，我能理解，但是咖啡机呢？被香烟腐蚀没了？当然，早餐一如既往的好，这个即便是点餐，也让人愉悦。以后大概是不敢住你家的吸烟房了，待遇太不相同了。,君悦大床客房
H18,2020-05-25,服务好位置不错,君悦大床客房
H18,2020-05-26,服务和管理都很好，但是可能是老酒店的，设施比较旧了。,君悦双床客房
H18,2020-05-26,早餐比以前差多了,广州塔景房
H18,2020-05-26,看点评是08年开的，但看得出管理到位，各方面也维护得不错，而且设计不错，在当年应该是顶级设计了。唯一想说的是房间布局，有点像迷宫。,君悦大床客房
H18,2020-05-26,珠江新城，很方便,君悦园景大床房
H18,2020-05-27,疫情期间，办理入住登记很慢。房间设计感不错，但是感觉镜子太多，通道有点复杂。灯光设计还可以优化，开关不太好用，按几次都控制不了，可能是用的时间久了。早餐在餐厅，但是没有自助餐，这样还不如送到房间来。,君悦双床客房
H18,2020-05-28,好好好好好,君悦双床客房
H18,2020-05-29,酒店硬件非常好 房间也很舒服 不尽如人意的地方在于 临街的低楼层房型早晨很早就有点吵 酒店的早餐 中式西式都是套餐 品种少到无力吐槽 其他地方早就恢复自取了,君悦园景大床房
H18,2020-05-29,早餐好吃 服务一般,君悦双床客房
H18,2020-05-30,性价比不错,君悦大床客房
H18,2020-05-30,环境不错的,广州塔景房
H18,2020-05-30,珠江新城中心位置 出行非常便利 酒店设施完善 可惜疫情期间早餐不是很丰富,君悦大床客房
H18,2020-05-30,服务还是不错的，最开始给的房间视野很差，前台给我换了我想要的方向。但是缺点是没有可开窗，入住一晚上，被冷气吹了，第二天早晨开始咳嗽，估计是中央空调的冷气有细菌。离店当天是年三十上午，下午回到成都之后，咳嗽一直不见好转，看了三家医院，差不多治了40天才好。因为是疫情期间的出行，所以还上了新冠病毒检测线，前后医药费花了两千多一点。,君悦双床客房
H18,2020-05-31,帮客户定的酒店，应该还不错,君悦园景大床房
H18,2020-05-31,很好很方便的一家酒店,君悦大床客房
H18,2020-05-31,房间不错，早餐稍微有点不方便，疫情期间也能理解，服务很好,嘉宾轩双床房
H18,2020-06-01,床上跟睡在水里一样，被子多久没晾晒过了,君悦园景大床房
H18,2020-06-01,设施比较老了，木地板踩下去嘎吱作响，预留的苹果借口还是太古时代的东西。服务响应速度不错，态度也比较热情。,豪华套房
H18,2020-06-01,**附近有mall，购物吃饭都很方便基础房型的楼层较低，这次酒店给了个朝小蛮腰的房型，景观非常不错，下次还是愿意来**住,君悦大床客房
H18,2020-06-01,住了体验非常不错，当晚决定多住一天。来给女朋友办纪念日弄了很多气球，给房间打扫卫生阿姨添麻烦啦推荐，下次还会来,君悦大床客房
H18,2020-06-02,不得不说酒店的位置真的非常好，就位于珠江新城的正中间，所以从这边去很多地方都很方便，无论是打车还是坐地铁都是挺棒的。但是就是因为位于了城市的正中心，出行的时候感觉人会有些多，好在每一次到来的时候，前厅都有工作人员的指引，无论是出去还是回来都非常的方便,君悦大床客房
H18,2020-06-02,跟着朋友一起出差，来到这边入住了这个酒店位置没有的说房间里面的设备也挺好的，只是价格有些略贵了一些。但是一分价格一分服务这边的地段绝对也就值得这个价格。,君悦大床客房
H18,2020-06-02,一如既往的好，服务不错。,君悦双床客房
H18,2020-06-02,服务很好周到，位置也好,君悦双床客房
H18,2020-06-02,酒店的大堂位于整座大楼的22楼，如果想要来到这里的话，一定要从1楼坐电梯上来才可以。相对来说大堂并不是特别的大，但是整个工作人员的工作还是非常有序的，并没有出现入住室的排队拥挤的情况。,君悦大床客房
H18,2020-06-03,早餐不错，比较丰富！市中心出行方便！………………………………………………………………………很好！nnn,君悦大床客房
H18,2020-06-03,应该还不错吧,君悦大床客房
H18,2020-06-03,就是酒店太冷了。夏天也没必要开那么冷，不是每个人进去都西装领带的。小孩第一天都因为酒店和外面温差太大感冒了。,君悦大床客房
H18,2020-06-04,前台**态度恶劣，熟视无睹排队客人。酒店处理态度依然袒护员工，针对客人。,君悦园景大床房
H18,2020-06-04,珠江新城CBD，房间不错,君悦双床客房
H18,2020-06-05,早餐很精致，位置很好很便利。,君悦双床客房
H18,2020-06-06,酒店位置可以，房间结构有点奇怪,君悦大床客房
H18,2020-06-06,早餐好，位置好，客房服务一般，房间设施老旧,君悦大床客房
H18,2020-06-06,位置好，餐饮好.房间设施老旧,君悦大床客房
H18,2020-06-06,房间厕所天花漏水，告知前台，没有回复。餐饮不错，特别是早餐和周末自助餐。房间设施老旧，客房服务一般。,君悦大床客房
H18,2020-06-06,好好好好好,君悦大床客房
H18,2020-06-07,设施维护不到位 位置很好,君悦双床客房
H18,2020-06-07,经常出差却第一次住那么差的五星级酒店，所以决定写出来，房间不干净，洗脸盆居然还有脏东西，门卡居然N次刷不开房门，心情极差，前台入住全程冷冰冰黑脸让我一边去填资料，完全感受不到微笑服务精神，所以必须差评,君悦大床客房
H18,2020-06-07,感觉一般一般啊,君悦园景大床房
H18,2020-06-08,环境还不错,君悦大床客房
H18,2020-06-08,楼下便是花城广场，东塔西塔小蛮腰近在咫尺，夜景粲灿绚丽无敌漂亮！自助早餐品种丰富，卖相口味俱佳，超好的住宿体验！,君悦双床客房
H18,2020-06-08,CBD核心，就在花城广场，购物和餐饮可选择非常多。疫情期间早餐改为套餐，提供中西两款选择，搭配和味道都不错。房间干净，有地下车库，停车方便。,君悦大床客房
H18,2020-06-08,房间内硬件需要提升,君悦大床客房
H18,2020-06-11,酒店位置很好，出行方便。但不知道是天气原因还是其他，房间有一股潮湿的味道。其他都很好。,君悦园景大床房
H18,2020-06-11,小蛮腰景房太棒了，性价比极高，服务很好，泳池也不错,广州塔景房
H18,2020-06-11,方便，安静，舒适,君悦大床客房
H18,2020-06-12,住的很不错 很喜欢,君悦大床客房
H18,2020-06-12,挺不错的，环境安静，服务专业。位置也方便，不过要避开上下班高峰，那里是CBD，上下班高峰塞车是大概率事件,广州塔景房
H18,2020-06-13,酒店环境不错。前台服务员人力不足以面对客人。,君悦大床客房
H18,2020-06-13,酒店有点老了，卫生还算干净,君悦大床客房
H18,2020-06-13,房间小了点，布置很一般,广州塔景房
H18,2020-06-14,位置还是不错的，服务也挺好，只是算老酒店了，设施有点老旧,君悦大床客房
H18,2020-06-15,环境很好，房间很大，早餐很棒,君悦双床客房
H18,2020-06-15,老酒店了，设施比较老了，整体还不错,君悦大床客房
