酒店名称,评论日期,评论内容,入住房型
H18,2020-06-15,服务很好，酒店装修细节优秀，自助餐不能自取由厨师代劳也比较卫生，总体满意,君悦大床客房
H18,2020-06-15,酒店位置不错，这次还帮我升级了嘉宾轩房间。早餐一般般，品种不多。但退房速度有点无语，整个过程用了20分钟。,君悦大床客房
H18,2020-06-16,还不错的酒店,君悦大床客房
H18,2020-06-18,酒店不错，环境不错！,君悦园景大床房
H18,2020-06-18,富力地产的产业，不错，服务好,君悦园景双床房
H18,2020-06-18,疫情期间入住，人不多，前台很好，看我们带了孩子就给升了嘉宾轩。房间算是比较大的，配置也比较新，朝向花园，很安静。,君悦大床客房
H18,2020-06-19,很好，环境优美，超值！,君悦大床客房
H18,2020-06-19,高档酒店，跟有味道,君悦大床客房
H18,2020-06-19,酒店位置非常好。,君悦双床客房
H18,2020-06-19,朋友很满意，六星标准，超好！,君悦大床客房
H18,2020-06-19,非常好，给换了花园景观房，服务异常好，一定再来,君悦大床客房
H18,2020-06-20,非常好的酒店，干净，用品高档，早餐丰富，交通便利，近大公园和各项重点设施，和商业中心。非常适合商务住。,君悦大床客房
H18,2020-06-20,不错很好用,君悦园景双床房
H18,2020-06-21,环境不错，很好,君悦大床客房
H18,2020-06-21,位置不错，设施太旧,广州塔景房
H18,2020-06-21,不错，私密性非常好，酒店服务人员也很热情。,君悦大床客房
H18,2020-06-21,不错挺好的！,君悦大床客房
H18,2020-06-22,环境不错，可以看到广州塔,君悦大床客房
H18,2020-06-22,早餐真的很棒哦,君悦大床客房
H18,2020-06-22,环境夜景都很好的,君悦大床客房
H18,2020-06-22,差到难以理解，这是我少数拉黑的酒店。实名，不匿名。,君悦大床客房
H18,2020-06-22,除了床小了一点，1.5m的，其他的都很棒，早餐自助，室内游泳池。就在花城广场边上，去哪都方便,君悦大床客房
H18,2020-06-22,早餐恢复自助了，服务态度很好，防疫措施到位安心,君悦大床客房
H18,2020-06-22,很不错的享受！纯五星级的服务。非常适合商务出差。交通方便。,君悦双床客房
H18,2020-06-22,酒店位置挺方便,君悦大床客房
H18,2020-06-22,特别不错啊,君悦双床客房
H18,2020-06-22,环境好，服务到位，就是房间稍微小了点，但出行方便,君悦大床客房
H18,2020-06-23,前台小姐姐服务态度超级好，还送了宝贝小玩具,君悦双床客房
H18,2020-06-23,环境不错 性价比高,广州塔景房
H18,2020-06-24,酒店非常好，升级到了嘉宾轩楼层，地理位置优越，有路直通到花城广场,君悦大床客房
H18,2020-06-24,非常好，下次再来,君悦大床客房
H18,2020-06-25,酒店服务极差，根本就配不上5星标准。是我住过最差的5星酒店，叫了个外卖，外卖送到酒店，让服务员送下都不送，非要我下楼去拿，头一次碰到。,君悦大床客房
H18,2020-06-25,环境很好，位置很好，去广州出差这家酒店属于性价比很高的。下回还会再定这个酒店。,君悦大床客房
H18,2020-06-25,下次再來的,君悦大床客房
H18,2020-06-25,早餐如传说一样，豪华，非常好，窗外风景是很好的，中途换了房间，某些房间旧了，霉味十分重，换过之后既很好了。,君悦大床客房
H18,2020-06-26,交通便利，服务周到,君悦大床客房
H18,2020-06-26,酒店位置优越，交通便利,君悦大床客房
H18,2020-06-26,Good!,君悦大床客房
H18,2020-06-26,高端大气上档次,君悦大床客房
H18,2020-06-27,很久没有住这家**酒店了，作为开业十多年的老酒店，设施设备保养的不错，服务也不错，早餐虽然受疫情影响，但整体还是保持在一定的水准。深圳**真该好好学学,君悦大床客房
H18,2020-06-27,非常棒的早餐,君悦大床客房
H18,2020-06-27,都很好 除了设施维护的一般,君悦大床客房
H18,2020-06-27,房间干净整洁床很大很软，自助早餐也很丰盛很满意的一次入住体验。疫情期间入住还送了洗手液跟消毒巾很贴心。前台小哥哥还很帅哦！,君悦大床客房
H18,2020-06-27,酒店有点旧了，但是另一方面价格也低于周边其他五星酒店，还是不错的。前台服务好，比较热情。中午想延迟退房到十二点半，主动延到一点并问是否足够，需要的话两点也行。虽然一件小事，态度就令人观感一下子好了。房间里面设施设计明显是上一个十年的，充电插座设计的位置不合理，也没有USB插口，早餐就普通吧，好像偏中式的东西多，不吃粥面点心的话，西式的品种略微挑战了，目测总体来说还是本地周边举家来入住消费的多，尤其是周末节假日… 地点、性价比都不错。,君悦大床客房
H18,2020-06-27,好还好还好,君悦大床客房
H18,2020-06-28,感觉非常好,行政套房
H18,2020-06-28,在珠江新城5星酒店套房这个价真的非常便宜了，**餐饮也是真心不错,君悦套房
H18,2020-06-28,不不不不错,君悦园景双床房
H18,2020-06-28,还好还好哈,君悦园景双床房
H18,2020-06-29,床够大，看到花城广场的美景。早餐服务专业，出品好。特别是蒸虾胶一流，虾新鲜弹牙皮又薄。免费停车场，但要在前台扫码确认。,广州塔景房
H18,2020-06-30,舒适便利够档次,君悦大床客房
H18,2020-07-01,办理入住时，要客人加入酒店会员。早餐品种较少，口味一般。房间内由于装修时间较长，设施有些陈旧。入住时候刷了两天预售，第二天中午告知，我住房间已经卖出去了，让换双床房。我又没退房，就逼着换房，这样的服务我从来没有遇到过，气的我大中午退房，换酒店。,君悦大床客房
H18,2020-07-01,前台的服务人员非常好，早餐也比较丰盛，但是你们酒店房间说明的小册子，中文目录印在反面，对本国人民的不太友好。希望能做的更好。,君悦大床客房
H18,2020-07-01,交通便利，环境优美，服务态度好,君悦大床客房
H18,2020-07-02,早餐很不错，尤其白粥配鸭蛋，羊角包都很不错。健身房也很好。就是前台效率太低。,君悦大床客房
H18,2020-07-03,酒店位置优越，附近食肆非常多！,君悦大床客房
H18,2020-07-03,早餐很好，疫情期间的对我们的防护措施做得也很好，房间的物品很高级,君悦大床客房
H18,2020-07-03,地段好，自助餐超好,君悦大床客房
H18,2020-07-03,住的非常舒服,君悦大床客房
H18,2020-07-03,还不错吧……,君悦大床客房
H18,2020-07-04,酒店整体感觉一如既往的好，早餐自助餐是最爱,君悦大床客房
H18,2020-07-04,设计不科学。22楼才是前台。停车场要到一楼换电梯到22楼。房间楼层要转到22楼再换电梯下一楼。太麻烦了。房间设计格局太乱，面积小还分区太小，不喜欢。早餐还行但品种少。,君悦园景双床房
H18,2020-07-04,不愧是**，服务超级好，地段也是没的说，出差首选,君悦双床客房
H18,2020-07-04,环境优美……,君悦大床客房
H18,2020-07-04,物美价廉！,君悦大床客房
H18,2020-07-05,"Sisi Chen 很热心，帮我介绍**的App,很不错",广州塔景房
H18,2020-07-05,还不错，就是枕头有点不舒服,君悦大床客房
H18,2020-07-05,疫情期间性价比很高,君悦大床客房
H18,2020-07-05,代订，客户说设备一般,君悦大床客房
H18,2020-07-05,五星级酒店。差不多也就是这样子。,君悦大床客房
H18,2020-07-05,应该还可以再差一点: 设施可以再烂一点；啥是服务？算了 ........,广州塔景房
H18,2020-07-05,酒店设施很好.服务态度好.早餐真不错,君悦大床客房
H18,2020-07-05,非常美好的旅程！无论环境和房间住宿体验和服务都不愧凯悦旗下品牌，凯悦也是我出差旅行酒店的首选！地理位置也绝佳！正商务中心，免费升级景观房，晚上窗外高楼星光密布，犹如云端很美！,君悦双床客房
H18,2020-07-06,**的服务没话说，因为近期家里装修，只能住酒店，酒店的同事像家人一样照顾，太感谢啦！,君悦大床客房
H18,2020-07-06,**酒店的品质一如既往的好,君悦大床客房
H18,2020-07-06,位置好，泳池还可以，也比较适合出游选择。,君悦双床客房
H18,2020-07-06,每次来基本上都是选**，位置好，早餐种类也比较多，性价比还是不错的。,君悦大床客房
H18,2020-07-06,今年第二次来广州还是选择了** 上一次来还是一月份 住的是塔景房 这次定的是个园景 前台小姐姐人很好 给我免费升级到了塔景 **的品质不用多说啦 环境地理位置都绝佳 而且离办公的地方很近 走路就到了 早餐很丰盛 比上个月去北京住的国贸酒店好吃哈哈哈哈哈,君悦园景双床房
H18,2020-07-06,不错，服务很好,君悦大床客房
H18,2020-07-06,room condition is very good and location is very convenient. but the quality of rooms service is not good and breakfast is as well.,君悦园景双床房
H18,2020-07-06,近期会经常住酒店，每一次都选**，真心因为服务好，酒店的同事了解我的情况后，特意帮忙升级行政房，非常感谢！会再次入住的！,君悦大床客房
H18,2020-07-07,交通方便，在珠江新城商圈。早餐也不饿，房间面积不算小，分了很多区域，所以空间不是很大，加床时候可以的，但会比较窄。适合带孩子的，周边吃的很多，出行也方便。,君悦大床客房
H18,2020-07-08,房间味道较重。大厅在22楼，不是很方便,君悦大床客房
H18,2020-07-08,酒店很好，舒适，服务态度好，视野也好。,君悦大床客房
H18,2020-07-08,酒店虽然年头久，服务管理很不错。,君悦大床客房
H18,2020-07-09,自助餐非常好，,君悦大床客房
H18,2020-07-09,早餐非常好，位置也不错，有地下停车场，逛街也方便，在花城广场边上，夜景非常漂亮。,君悦大床客房
H18,2020-07-10,酒店位置很方便 就是有点旧了 而且双床房的床实在太小了,君悦双床客房
H18,2020-07-10,环境好，服务好,君悦双床客房
H18,2020-07-10,环境很好，住的蛮舒服的，早餐也不错,君悦大床客房
H18,2020-07-10,已经连续几次入住了,君悦大床客房
H18,2020-07-11,位置非常好，就在花城广场，楼下就有好几个酒吧餐吧，宵夜非常方便，前台的小姐姐人非常好，给了无敌景观房，还会再次入住。,君悦大床客房
H18,2020-07-11,帮我升级了个套房，非常棒！服务也很到位！床很舒服，房间环境不错??周边也很便捷，楼上的凯菲厅自助餐出品不错！,君悦大床客房
H18,2020-07-11,环境服务很好,君悦双床客房
H18,2020-07-11,早餐很棒 床很舒服！,君悦大床客房
H18,2020-07-11,??. ?. ?? ???,君悦大床客房
H18,2020-07-12,设施齐全，服务好。,君悦大床客房
H18,2020-07-12,前台服务很贴心,君悦大床客房
H18,2020-07-12,很不错的酒店，下次还住,君悦大床客房
H18,2020-07-12,地点很好，房间不错,君悦大床客房
H18,2020-07-13,酒店环境卫生一流，客房优雅干净卫生，酒店全体员工礼貌待客，彬彬有礼，早餐干净卫生，色香味俱全，值得表扬。,君悦大床客房
H18,2020-07-13,性价比还行,君悦大床客房
H18,2020-07-13,Sisi Chen 服务态度很好很细心 下次一定还会再来！,君悦园景大床房
H18,2020-07-13,房间很好。,君悦大床客房
H18,2020-07-14,还行吧，看在价钱的份上，就都可以原谅了……房间有异味，换了一次……早餐还可以，吉祥物也挺可爱的，下次再来吧,君悦双床客房
H18,2020-07-14,算還可以吧,广州塔景房
H18,2020-07-15,一如既往的好，就是房间像迷宫。,君悦双床客房
H18,2020-07-15,楼下就是花城广场，可以跑步,君悦双床客房
H18,2020-07-15,最近每次去都住这里。可能睡得比较踏实吧。酒店环境卫生都很好。,君悦大床客房
H18,2020-07-15,亁浸 早餐可口,君悦大床客房
H18,2020-07-15,非常满意，非常好,君悦大床客房
H18,2020-07-15,续住了两天,君悦大床客房
H18,2020-07-15,续住了两天,君悦大床客房
H18,2020-07-15,每次都住这,君悦大床客房
H18,2020-07-15,每次都住这里,君悦大床客房
H18,2020-07-15,每次过来都住这里,君悦大床客房
H18,2020-07-16,酒店设施不错,君悦大床客房
H18,2020-07-16,酒店设施不错,君悦大床客房
H18,2020-07-16,位置好，方便,君悦大床客房
H18,2020-07-16,酒店的指示牌不明显，酒店的床很小。,君悦双床客房
H18,2020-07-16,早餐不错，婴儿车有点旧！位置不错,君悦大床客房
H18,2020-07-16,不清楚如何,君悦大床客房
H18,2020-07-17,位置不错，早餐不错,广州塔景房
H18,2020-07-17,退房的时候真的服了，12点到前台退房，前台拿走房卡说可以了押金会退回去，结果下午2点了押金还没退，打电话问了前台说房间显示还没退房，真的服了这是什么前台，还五星级呢，其他五星还不用押金呢,君悦大床客房
H18,2020-07-17,早餐很好吃,君悦大床客房
H18,2020-07-18,真心一般，性价比太低,广州塔景房
H18,2020-07-19,位置方便 经常入住 早餐丰富 酒店安静干净 最佳选择,君悦大床客房
H18,2020-07-19,刚到酒店，感觉这幢楼不像是五星级的酒店，但入住后无不体现五星级的水准：丰富的早餐，热情的服务，人性化的客房设计等等。值得推荐！,君悦双床客房
H18,2020-07-19,Sisi Chen同学服务超好，非常贴心！,君悦大床客房
H18,2020-07-19,环境不错！,君悦双床客房
H18,2020-07-19,各项配套好,君悦大床客房
H18,2020-07-20,早餐很丰富,君悦双床客房
H18,2020-07-20,之前端午住了几天，很不错哦，吃的东西也不错。好评。,广州塔景房
H18,2020-07-20,位置好，停车方便,君悦园景双床房
H18,2020-07-20,酒店位置不错，就是房间布局有点迷幻,广州塔景房
H18,2020-07-20,酒店位置很好,君悦园景大床房
H18,2020-07-20,还好吧还好还好 还好还好还好还好还好还好还好还好还好还好还好还好还好还还还好还好还还还还没不好还好还好,君悦大床客房
H18,2020-07-21,酒店比较高档，服务态度很不错，早餐丰富,君悦双床客房
H18,2020-07-21,早餐很不错，环境设施也很好,君悦园景双床房
H18,2020-07-21,非常满意的入住,君悦双床客房
H18,2020-07-21,这次**的体验，比起之前略差了。首先，四点半去办理入住，居然跟我朋友的另外2个房间都要等。然后还安排了一间还在油漆的房间。之前住过这个**我是觉得很棒的。这次我感觉到略失望。不过小哥哥服务还是很好，最后给我们升级了行政套房还送了一瓶红酒。整体来说还是开心的,君悦双床客房
H18,2020-07-23,就是早餐可以的，其他设备都陈旧了,君悦大床客房
H18,2020-07-23,商务出差，找住的时候纠结了挺久，觉得**有点旧了，后来还是相信大牌，设施是有点旧，但是服务非常棒，免费升级了，早餐好非常棒，选择没错。,君悦大床客房
H18,2020-07-23,各方面都挺不错的,君悦大床客房
H18,2020-07-23,早餐很丰盛,君悦双床客房
H18,2020-07-24,服务很好，位置也不错，下次会继续住。,君悦大床客房
H18,2020-07-24,酒店不错房间大 早餐也丰富 就是床小了点,君悦大床客房
H18,2020-07-24,早餐太多东西吃，我二大二小去酒店还免费加了床给我，,广州塔景房
H18,2020-07-24,不错，景观好，散个步就能看到广州塔,君悦大床客房
H18,2020-07-24,性价比超高,君悦双床客房
H18,2020-07-24,酒店早餐丰富，位置没的说，绝对中心，设施丰富！,君悦园景双床房
H18,2020-07-25,酒店设施旧了，性价比可以…,君悦大床客房
H18,2020-07-25,早餐很不错，可以观景广州塔。,君悦大床客房
H18,2020-07-25,珠江新城核心区域，方便逛花城广场??,君悦大床客房
H18,2020-07-25,环境好，设施新,君悦园景大床房
H18,2020-07-25,环境好，设施新,君悦园景大床房
H18,2020-07-26,地段非常好，出行方便，房间不错，卫生间很大，尤其洗手台环绕设计很贴心及实用，早餐也很丰盛，以后来还是会选择**。,君悦大床客房
H18,2020-07-26,房间很大，风景也不错，早餐很丰富，出行也很方便，毕竟是珠江新城黄金地段，非常满意，已经住过几次了，包括不远处的柏悦，都非常好。,君悦双床客房
H18,2020-07-26,果然**还是广州心目中综合最佳。自助早餐出名不用说，这次入住前品尝的抹茶下午茶set（甜而不腻），行政楼层的房间新翻修床品舒服，happy hour酒类饮品丰富，过了难忘的一晚。希望能保持，下次还会选择**。,君悦大床客房
H18,2020-07-26,酒店的服务挺好的，值班经理挺认真负责的，但是刚刚装修的味道实在有点大，建议对相关楼层做好防护。,君悦大床客房
H18,2020-07-26,酒店早餐很丰富很好吃，然后位置很好很核心。硬件方面，浴缸设计有点奇怪，房间容易潮湿。服务做得很好。然后游泳池关闭得太早了，没机会去体验，遗憾。,君悦大床客房
H18,2020-07-26,好好好好好,君悦大床客房
H18,2020-07-27,位置不错，房间够大,君悦大床客房
H18,2020-07-27,环境好，服务好！,君悦大床客房
H18,2020-07-27,位置好，房间大!,君悦大床客房
H18,2020-07-27,酒店服务卫生环境都很好,君悦大床客房
H18,2020-07-27,酒店太旧了，硬件设施跟不上，冲凉??漏水，浴缸边缘发黄，电视机有点过时，房间感觉没有吸尘，整体感觉有点怪怪的不舒服！亮点是：酒店位于花城广场旁边；免费停车；早餐非常、非常的好，比（北京）皇府井，（广州、北京）四季，（广州）丽思卡尔顿都好，品种繁多，食材新鲜，味道好，。,广州塔景房
H18,2020-07-27,早餐不错，方便格局很奇怪，设施不好，时间长了,君悦大床客房
H18,2020-07-27,都挺好的，就是早餐说是很好，但是没太多能吃的,君悦双床客房
H18,2020-07-28,交通便捷、干净舒适、服务周到。,君悦园景大床房
H18,2020-07-28,酒店新，干净，房间景观很好,君悦大床客房
H18,2020-07-28,酒店服务好，办理入住手续快，房间干净，设备新，景观优美,君悦双床客房
H18,2020-07-28,环境很好，服务也好，就是电梯换来换去太麻烦,君悦双床客房
H18,2020-07-28,很好很好的,君悦双床客房
H18,2020-07-29,还可以，就是价格稍微高,广州塔景房
H18,2020-07-29,珠江新城里面的豪华酒店,广州塔景房
H18,2020-07-29,方便，环境好，早餐一般,君悦大床客房
H18,2020-07-29,优点：黄金地段，可以看到小蛮腰，但是要升级房型，早餐个人觉得虽然品种不多，但是品质较高。缺点：所有房型几乎都一样吧，格局不合理，尤其是浴缸四方形的，腿伸不了，厕所超级小，可是洗脸区又很大。真的很想吐槽下这设计师。,君悦大床客房
H18,2020-07-29,最棒的就是早餐，五星级酒店中，早餐中最有地方特色的,君悦大床客房
H18,2020-07-30,每次都住这里，很好的。,君悦双床客房
H18,2020-07-30,房间设施一应俱全,君悦双床客房
H18,2020-07-30,装修开始显旧了。床的上方有横梁，感觉很不舒服，睡也没睡安稳。早餐还是不错的，中西两类可选，看着份量不大但是款式多，吃完非常饱，味道也好。,君悦大床客房
H18,2020-07-30,这样不错的哟。,君悦大床客房
H18,2020-07-30,嗯，好很好睡了。,君悦大床客房
H18,2020-07-30,这样的挺好。,君悦双床客房
H18,2020-07-30,很好，很满意。,君悦大床客房
H18,2020-07-30,嗯，好很满意。,君悦大床客房
H18,2020-07-30,很好很满意,君悦大床客房
H18,2020-07-30,非常愉快体验,君悦双床客房
H18,2020-07-30,早餐不错！,君悦大床客房
H18,2020-07-30,满意哟，满意哟！,君悦双床客房
H18,2020-07-31,房间设施比较老旧，但给了一间角上的房间，两面墙都是床，这点很赞。,君悦大床客房
H18,2020-07-31,酒店非常舒服。就是前台办理入住时间太久，然后在酒店里点个外卖，差点弄丢了。希望酒店的前台加强这方面的管理。,君悦大床客房
H18,2020-07-31,酒店地理位置很好，消毒措施完善，入住的时候发一个小袋子，有消毒湿巾。客房干净整洁，只是装修稍微有点旧。早餐丰富，很不错,君悦大床客房
H18,2020-07-31,酒店唯一不方便的就是先上到22楼大堂，在下到客房。服务挺好的，地理位置好，早餐丰富味道好，房间干净整洁,君悦双床客房
H18,2020-07-31,性价比高，位置优越,君悦大床客房
H18,2020-07-31,餐饮一如既往的好，但房间真的太旧了，泳池水比较深不适合小朋友,君悦双床客房
H18,2020-07-31,在这里体会了客户至上；体会了没有最好，只有更好；体会了服务热情。期待越来越好，期待下次一如既往感受美好时光。,君悦大床客房
H18,2020-07-31,下午5点还有很多房间没有收拾干净，很多客户在等，体验不愉快,广州塔景房
H18,2020-07-31,挺不错的啊,君悦大床客房
H18,2020-08-01,酒店很舒服，环境也很好，还给我们升级了房型！总之就是很棒很棒的体验，服务也很到位，以后还会考虑再来哒！,君悦大床客房
H18,2020-08-01,已经写过一次了就不多说了整体挺好的，谢谢,君悦大床客房
H18,2020-08-01,整体都很不错中西结合的早餐丰富多样……房间布局确实有点不适应，但也算一种别具一格的设计吧床很舒服！景观非常棒！唯一不太习惯的就是上下楼电梯比较容易搞混坐错误时间……,君悦园景大床房
H18,2020-08-02,服务特别贴心,君悦大床客房
H18,2020-08-02,近景点，周边购物方便,君悦双床客房
H18,2020-08-02,酒店住的很舒服 早餐也丰富 塔景房的布局实在太棒了 而且离电梯口也近,广州塔景房
H18,2020-08-02,酒店的位置很方便，周边有商场和美食广场，景色也很美,广州塔景房
H18,2020-08-02,有室内停车场,君悦大床客房
H18,2020-08-02,非常舒适的环境,君悦大床客房
H18,2020-08-02,很好很方便,君悦大床客房
H18,2020-08-02,早餐很丰富！,君悦双床客房
H18,2020-08-03,舒服 非常好,君悦大床客房
H18,2020-08-03,地点很好，靠近商场，小蛮腰,君悦双床客房
H18,2020-08-03,很好，手表落下了，之后才去取的。,君悦双床客房
H18,2020-08-03,酒店很舒适,君悦双床客房
H18,2020-08-03,环境优美，餐饮美食,君悦大床客房
H18,2020-08-03,设施保养的不错，虽然久了，但总体很好。早餐丰富，秩序很好。位置也很好,君悦大床客房
H18,2020-08-03,非常推荐！1.地段方便，花城汇东侧。广东省博物馆，图书馆距离2公里以内，夜游珠江，小蛮腰也很方便，步行即可到达。到机场，3号线就在楼下马路对面，步行300米以内。2.价格优势，周边5星林立，但1200不到可以有带早餐的行政房还是很有优势的。房间内有胶囊咖啡机并赠送三颗胶囊咖啡，对于离不开咖啡的人来说实在贴心！3.服务人性化，小盆友早餐不是以身高来判断，是12周岁以下免费，这个标准国内酒店不多。特别要感谢前台办入住时的眼镜小哥哥（没问名字），因为目前的防疫要求，办入住时会烦琐很多，老公有些不耐烦，但眼镜小哥哥还是非常有耐心的解释引导办理步骤，而且解释的非常清楚，点赞??！,嘉宾轩双床房
H18,2020-08-03,早歺好吃，位置方便,君悦园景大床房
H18,2020-08-04,酒店走廊很压抑、陈旧感，室内有霉味，新装修的房间设计、设施更像快捷酒店，太拉低**品牌,君悦大床客房
H18,2020-08-04,把我吓到了，晚上准备睡觉，关灯以后跳闸了。找来了师傅修了以后，还是跳闸。搞了只能换个房，大半夜穿着裤衩换房换楼层。挺折腾,君悦大床客房
H18,2020-08-05,位置好！早餐很好,君悦大床客房
H18,2020-08-05,五星级酒店。大堂在22层。第一次想到一层走错了。,君悦园景大床房
H18,2020-08-05,有点旧的酒店，虽然是五星酒店，广州的服务态度果然没有深圳好，垃圾桶都是坏的，其他不少类似细节没有去拍照。,广州塔景房
H18,2020-08-05,干净整洁舒适,君悦大床客房
H18,2020-08-05,位置不错！,君悦套房
H18,2020-08-06,绝佳地理位置,君悦园景双床房
H18,2020-08-06,**，也就这样了，没有惊喜,君悦大床客房
H18,2020-08-06,我自己第二次住，这次招待朋友还是住这好了。最让人喜出望外的疫情改变这么多，入住的时候前台服务超级好，大堂梁经理服务周到，送了口罩和洗手液，防疫工作到位。礼宾小伙子很热情，送到了房间。房间的卫生完美了，还贴心的标示了取消6小件，毛巾还是单独消毒打包。设备很好，还有空气清新剂是最爱了。退房的时候还是前台小妹子留下了深刻的印象，帮忙安排车，介绍路线，真是太麻烦她们了。餐厅没去，感觉应该还不错吧，总之非常棒！,君悦大床客房
