酒店名称,评论日期,评论内容,入住房型
H25,2020-01-01,很滿意 也很容易找到,高级大床房
H25,2020-01-01,高層景觀不錯，房間清潔，只是外牆玻璃窗早上發出 霹靂啪嘞聲響，影響睡眠，可能是冷縮熱脹關係吧，玻璃窗質素需要調整。,高级大床房
H25,2020-01-01,深圳**酒店是华强北片区历史比较长的一家高端酒店，也是深圳市政府公务接待指定酒店，位置、服务、设施一直保持得很好，早餐丰富，停车方便，是出差度假的首选。酒店副楼的凤凰楼酒店菜品也是一流，特别是早茶，非常棒！,高级大床房
H25,2020-01-01,非常的好好服务,豪华客房
H25,2020-01-01,交通方便，,高级大床房
H25,2020-01-01,性价比很高，位置好,高级大床房
H25,2020-01-01,服务很到位,高级大床房
H25,2020-01-01,服务很到位,高级双床房
H25,2020-01-02,老五星酒店预期不能太高-只要性价比高 交通方便 房间还算大 游泳池 桑拿房都具备就值得住了，这酒店旁边还有两家“五星餐厅”-凤凰楼和春满园，主楼二楼还有珑玥会私房菜和日本餐，很可以了。我再次住了两天竟然没出去过酒店，凤凰楼珑玥会日本餐成为我们的饭堂，游泳池桑拿房成为我的休息室，关键是价格很吸引-五星级酒店新年特惠才不到400元，还想咋滴？,高级大床房
H25,2020-01-02,之前的评价一直置顶，性价比高，交通方便，游泳池桑拿房很棒。再次入住除了性价比高和游泳池桑拿之外，地铁口很近也是考虑因素。加上能从二楼直接去凤凰楼吃饭-造成入住两天竟然没出去过酒店大门??主楼二楼还多出了一个私房菜-珑玥会，女老板大概贪图我的“美色”主动送一瓶葡萄酒给我迎接2020年，哈哈??,高级双床房
H25,2020-01-02,很好！！！！,豪华客房
H25,2020-01-02,早餐早餐不实惠,高级大床房
H25,2020-01-02,临近地铁口出行方便,豪华客房
H25,2020-01-02,交通便利，位置优越！地铁3号、7号线就在酒店下方。服务好，性价比高！,高级大床房
H25,2020-01-02,位置好，性价比很高！,高级大床房
H25,2020-01-02,没什么好挑剔的，相当不错啦,高级大床房
H25,2020-01-02,经常住、老牌五星、经济实惠！,高级大床房
H25,2020-01-02,性价比不错,高级大床房
H25,2020-01-03,网上订的房，主楼大床房不到四百块。看到酒店大楼，一度怀疑自己眼花看错了价格。住得很舒服，真是物超所值,高级大床房
H25,2020-01-03,非常贴心？服务好常棒,高级大床房
H25,2020-01-04,老牌酒店了，位置非常好。。价钱是在做活动时订的。很划算。里面设施很陈旧。浴缸非常小。用的东西比较普通。,高级双床房
H25,2020-01-04,酒店位置好，服务也可以，就是老酒店了设施一般，隔音不好，隔壁房间声音听的很清楚,高级双床房
H25,2020-01-04,交通方便，楼下就是华新地铁口。对面华强北商圈有茂业购物中心，九层美食城各种吃的都有，吃饭也很方便，商务出差首选。,高级大床房
H25,2020-01-04,老牌五星、华强北商圈、经济很实惠！,高级大床房
H25,2020-01-04,老牌五星、很不错啦、经济又很实惠！,高级大床房
H25,2020-01-04,距离地铁站近，直接楼下就是。,高级大床房
H25,2020-01-04,除了设施不是很新外，其他都不错,高级大床房
H25,2020-01-04,不错，位置很好,高级大床房
H25,2020-01-05,房间细节不错,豪华行政房
H25,2020-01-05,非常推薦??,高级大床房
H25,2020-01-05,本年度第三次入住，位置好，方便,高级双床房
H25,2020-01-05,提前一天取消订单，被告知不能取消，扣了房费，没有入住。,高级大床房
H25,2020-01-06,非常好的酒店，推薦,高级大床房
H25,2020-01-06,还不错的选择,行政客房(全新装修)
H25,2020-01-06,两周之内来住了两次，最近性价比很高啊，可以抢到价格很合适的房间，又是老牌子五星级；位置也是非常市中心，去机场、南山、罗湖都很方便，关键是健身房泳池关门的时间也晚，到24点，恒温泳池，完了还能干蒸一下不错??,高级双床房
H25,2020-01-06,离步行街很近，购物十分方便,高级双床房
H25,2020-01-06,设备比较老旧。但是其他各方面还是很不错的,高级双床房
H25,2020-01-06,很好，下次过来还订这，交通非常方便，周边吃的也很多,高级双床房
H25,2020-01-06,还挺不错，虽然有一定年月，只是房间灯光有点暗，空调机有点吵，最后风量调最小就ok了，如果夏天一定睡不着..,高级大床房
H25,2020-01-06,酒店比较老旧了，干净卫生,高级双床房
H25,2020-01-06,位置很方便，服务很周到！,高级大床房
H25,2020-01-07,我很满意这酒店,高级大床房
H25,2020-01-07,好，有停车场,高级双床房
H25,2020-01-07,整体非常不错??,高级大床房
H25,2020-01-07,早餐不知道，没加床，没带小孩，位置可以，我没开车。早餐不知道，没加床，没带小孩，位置可以，我没开车。,高级双床房
H25,2020-01-07,朋友来给他订的，位置很好，隔壁的凤凰楼也同样好评。,高级大床房
H25,2020-01-07,又来住这家酒店了，性价比还是很高，也许正好是周一吧抢到了最划算的房间，其中还帮忙调整了一个单间，欢迎水果也不错??完全足够早上的热量；很喜欢四楼的泳池还有干蒸，还没几分钟就已经大汗淋漓特别通透,高级双床房
H25,2020-01-07,酒店位置超级棒。房间地毯打扫起来很难做到很干净。略老旧。,高级大床房
H25,2020-01-08,楼下有3号和7号地铁线，出行很方便，酒店历史悠久，但环境和卫生都不错，工作人员服务态度好,高级双床房
H25,2020-01-08,非常不错当然酒店，对面就是华强北，然后吸烟的人请注意，此酒店是全部为无烟房！,高级大床房
H25,2020-01-08,无论从酒店地址、员工服务和房间设施及舒适度上，**酒店都给我留下了很好的印象。因此，每次到深圳出差我都愿意到这里住。,高级大床房
H25,2020-01-09,还可以，就是没早餐,高级双床房
H25,2020-01-09,早餐很丰富，房间，算是五星级酒店不错的。,豪华行政房
H25,2020-01-09,因喜欢到处游玩，还是比较在意酒店的服务，由于个人身体原因需要多喝水，酒店每天送了两大瓶景田矿泉水，很温馨象家一样！借此平台谢谢！,高级大床房
H25,2020-01-09,共住了7晚，一个老牌五星大堂电梯都不错。特别说说设施，因订房时评价上说设施老旧，还非常担心，但入住后觉得特别是卫生间、房间没有任何异味，服务也很好，酒店的位置也很好，在华强北商圈，个人觉得很好，下次来深圳还会选这家,高级大床房
H25,2020-01-09,舒适宽敞明亮,高级大床房
H25,2020-01-09,服务态度非常好。,高级双床房
H25,2020-01-10,中规中矩的老品牌,高级大床房
H25,2020-01-10,位置不错，其他尚可,高级大床房
H25,2020-01-10,酒店位置非常好，楼下就是地铁站，附近很多东西吃，室内恒温游泳池也很漂亮，冬天也能游泳，有停车场！,高级大床房
H25,2020-01-10,好好好好好,高级大床房
H25,2020-01-10,酒店地理位置优越，就在华强北的华新地铁站上盖，交通方便。酒店虽然是老酒店，但是设施尚算可以，入住送水果。性价比算非常高。,高级大床房
H25,2020-01-10,很好的 服务周到 有插曲也解决了 会有水果送 老牌酒店 房间很大 住了很多次,高级大床房
H25,2020-01-10,再次入住 房间很大 老牌五星,高级大床房
H25,2020-01-11,还可以接受,高级双床房
H25,2020-01-11,还不错 交通还不错,高级大床房
H25,2020-01-11,就是房间灯光暗了点，其他都非常好,高级双床房
H25,2020-01-11,住过几次了，非常满意，这是一间性价比很高的酒店。,高级双床房
H25,2020-01-12,非常好，已经住过很多次了，每次来都选择这家酒店，交通便利，有名的华强北就在附近，吃喝玩乐非常方便，非常好的好的选择！,高级双床房
H25,2020-01-13,托福考试酒店,高级双床房
H25,2020-01-13,酒店地點很便利易找，附近很多商場及各式食肆。房間整潔，只是洗手間有點陳舊，但尚可接受。而不知道為什麼窗戶那邊有聲音，像是金屬冷縮熱脹發出的，有點美中不足。,高级大床房
H25,2020-01-13,位置很好，这么多年品质一直都保证得挺好,高级双床房
H25,2020-01-13,很好，水果好，泳池好。位置好，房间大。,高级大床房
H25,2020-01-14,楼层高度太低了,高级双床房
H25,2020-01-14,总体感觉还好,高级大床房
H25,2020-01-14,服务很不错,高级大床房
H25,2020-01-14,有些旧了的酒店，但性价比还是很不错的,高级大床房
H25,2020-01-14,酒店停车场很大，出行很方便,高级双床房
H25,2020-01-14,性价比超高的酒店,高级大床房
H25,2020-01-15,很好的选择,豪华行政房
H25,2020-01-15,位置优越，地铁口近在咫尺，打车也方便，周边美食配套齐全，泳池不错。忘了住过多少次。性价比还是比较高的。,高级大床房
H25,2020-01-15,老牌的正宗五星级，各方面设施均到位，也符合入住的需求，地处华强北，离地铁非常近。早餐去了行政楼层，不怎么热闹和好吃，还是大堂推荐些,高级大床房
H25,2020-01-15,不知道住了多少次了，交通方便，地铁近在咫尺，打车也好打。周边的美食配套齐全，泳池也不错。还是比较喜欢吧,高级双床房
H25,2020-01-15,酒店大堂豪华，前台服务一般，房间装修一般，空调还是南方一般酒店的中央空调，单模式。不满意插电口，床边无法充电。,高级大床房
H25,2020-01-16,免费停车 服务很好,高级双床房
H25,2020-01-16,就在地铁站出口，非常方便。房间很大，窗户很大，泳池很好。值得再次入住，下次来深圳，有机会会再次选择。,高级大床房
H25,2020-01-16,交通方便，卫生服务很好！吃饭方便，隔壁风凰酒楼食品超赞??????。亲戚每次回深圳特别交代必订圣庭苑酒店！,高级双床房
H25,2020-01-16,交通方便，卫生服务很好！吃饭方便，隔壁风凰酒楼食品超赞??????。亲戚每次回深圳特别交代必订圣庭苑酒店！,高级双床房
H25,2020-01-16,交通方便，卫生服务很好！吃饭方便，隔壁风凰楼酒楼食品超赞??????。亲戚每次回深圳特别交代必订圣庭苑酒店！,高级双床房
H25,2020-01-16,交通方便，卫生服务很好！吃饭方便，隔壁风凰楼酒楼食品超赞??????。亲戚每次回深圳特别交代必订圣庭苑酒店！,高级双床房
H25,2020-01-16,交通方便，卫生服务很好！吃饭方便，隔壁风凰楼酒楼食品超赞??????。亲戚每次回深圳特别交代必订圣庭苑酒店！,高级双床房
H25,2020-01-17,一如既往地干净卫生,高级大床房
H25,2020-01-17,酒店很好，位置也很不错周边很方便,高级大床房
H25,2020-01-18,房型很合适,豪华客房
H25,2020-01-18,停车场非常大,豪华客房
H25,2020-01-18,酒店員服務態度非常好！酒店房間太暗，設施比較舊。,高级大床房
H25,2020-01-18,性价比较高，周边酒店都很贵,高级双床房
H25,2020-01-18,交通方便，商圈附近，有好吃的，睡得安静，值得推荐????。亲戚每次回深指定订圣庭苑酒店！,高级双床房
H25,2020-01-19,方便，价格实惠,高级双床房
H25,2020-01-19,服务能更人性化吗,高级大床房
H25,2020-01-19,干净卫生，方便，性价比高,高级双床房
H25,2020-01-20,环境还不错,高级大床房
H25,2020-01-20,楼上楼下，挺不错,高级大床房
H25,2020-01-20,很适合商务出差,高级大床房
H25,2020-01-20,酒店开了有些年头，客房面积不大，但是很干净、舒适、自然，性价比高，服务态度好！特别是主楼礼宾部黎世锋经理，大副 刘嘉凌，做事细心、认真，负责，干脆利落！待人热情，值得信赖,高级大床房
H25,2020-01-20,酒店很不错！干净卫生，服务也好！地铁站出来就是，位置优越。还送了水果！下次还会入住！赞！,标准大床房
H25,2020-01-20,位置非常好，酒店装修有点久，适合华强北办事,高级大床房
H25,2020-01-20,昨晚入店较晚，前台接待女生笑容满面，服务态度极好，免费帮我升级了房间，非常感谢,标准大床房
H25,2020-01-21,比之前几次去服务差好多,高级大床房
H25,2020-01-22,性价比高，交通方便,高级大床房
H25,2020-01-22,地点非常好,高级大床房
H25,2020-01-22,要重新装修了,高级大床房
H25,2020-01-22,设施有点老,高级大床房
H25,2020-01-22,还好，不错,高级双床房
H25,2020-01-22,好好好好好,高级双床房
H25,2020-01-23,老5星级酒店，性价比蛮好，紧邻华强北。,高级双床房
H25,2020-01-23,非常好的行程,高级双床房
H25,2020-01-23,实在是一般,高级双床房
H25,2020-01-24,很好 非常好,高级大床房
H25,2020-01-25,与以往的体验真的不一样，连住三晚也没主动给我升级房间，说好的最后一天可以给换个房间，还是我主动询问才帮我换的，不问估计也就没有了。酒店设施明显陈旧。晚上回酒店，甚至还被大堂服务员拦着要查身份证！房卡都出示你看了，你就不能自己去核实下？而且态度不友善，核实完甚至连声道歉都没有！,高级双床房
H25,2020-01-26,设施有些陈旧。其它都可以,高级大床房
H25,2020-01-26,环境不错，卫生很干净,高级双床房
H25,2020-01-26,環境地理位置不錯,高级大床房
H25,2020-01-27,干净卫生服务好，交通便利，停车很方便，在华强北应该是性价比很高的酒店了,高级双床房
H25,2020-01-27,服务态度很好，酒店干净卫生，觉得是华强北性价比最高的酒店。,高级双床房
H25,2020-01-27,非常不错的酒店，性价比很高，虽然是老酒店，但干净卫生服务很好，停车和交通都很方便,高级双床房
H25,2020-01-27,服务态度非常好，干净卫生，周边吃饭娱乐购物非常方便，交通很方便，知道推荐,高级双床房
H25,2020-01-27,很不错的五星级酒店，周边吃饭购物都很方便，交通便利，性价比很高,高级双床房
H25,2020-01-27,回深圳在华强北办事，选择了**酒店，老牌五星级酒店，设施有点老旧，但干净卫生服务非常好，周边吃东西交通非常方便，性价比很高,高级双床房
H25,2020-01-27,性价比非常好??值得推荐,高级大床房
H25,2020-01-27,酒店有点就床很硬，设施有点就,高级大床房
H25,2020-01-28,酒店稍旧 但胜在位置、服务上 ，推荐！,高级大床房
H25,2020-01-28,早餐没有丰富的营养种类,行政客房(全新装修)
H25,2020-01-30,价格与品质不匹配,高级双床房
H25,2020-01-30,环境不错，下次还可以再入住？,高级大床房
H25,2020-01-31,酒店不错，位置很好。适合商务出行，游泳池也不错，推荐入住。,高级大床房
H25,2020-01-31,十一月出差到深圳，找到这个价廉物美、交通很方便的酒店。出门就是地铁，旁边就是华强商业中心，酒店旁边有两家比较有名的茶餐厅，酒店的早餐也不错。感谢前台给我升级了房间。,高级大床房
H25,2020-01-31,当地知名、品质酒店，推荐??,标准大床房
H25,2020-02-01,红红火火好,豪华行政房
H25,2020-02-01,周围很方便，出差必选,高级大床房
H25,2020-02-01,酒店空调效果有点差，总体来说还不错,豪华客房
H25,2020-02-02,设施很人性化，网络高速信号好，窗外风景好。有特别的开床服务，房间小摆件的设计也很有特色。性价比不错，下次还要入住,高级双床房
H25,2020-02-02,环境位置都不错，比较满意,高级大床房
H25,2020-02-02,非常好的酒店，经常光顾,高级双床房
H25,2020-02-02,距离地铁站非常近，出行方便,豪华客房
H25,2020-02-02,喜欢酒店的健身房和游泳池,高级大床房
H25,2020-02-04,非常不错的酒店,豪华行政房
H25,2020-02-05,给朋友定的，还可以吧,高级双床房
H25,2020-02-05,挺好的，老牌五星了,高级大床房
H25,2020-02-09,非常一般!,高级大床房
H25,2020-02-11,性价比挺高的，酒店设施挺干净，也蛮卫生的。,高级双床房
H25,2020-02-15,酒店干净，设施齐全，服务好,标准大床房
H25,2020-02-20,位置很方便,高级大床房
H25,2020-02-20,环境很干净,高级大床房
H25,2020-02-20,性价比不错,高级大床房
H25,2020-02-20,性价比不错,高级大床房
H25,2020-02-22,离地铁站很近，交通方便，环境舒适,高级大床房
H25,2020-02-22,就位置好，其他一个字差！,高级双床房
H25,2020-02-22,优秀的企业,高级双床房
H25,2020-02-24,比较老的酒店，位置还可以,豪华客房
H25,2020-02-24,位置好，近地铁。,高级大床房
H25,2020-02-27,一家老牌酒店,高级大床房
H25,2020-02-29,老牌五星酒店、物美价廉,高级大床房
H25,2020-02-29,常来，很满意,标准大床房
H25,2020-03-03,交通便利、商业配套齐全、闹中取静！,高级大床房
H25,2020-03-05,比较老，但服务还不错。,豪华客房
H25,2020-03-06,常预定此房间,豪华客房
H25,2020-03-07,疫情期间价钱跟往常差不多，人是真的少，很安静,行政客房(全新装修)
H25,2020-03-09,压金三天还没退,高级双床房
H25,2020-03-11,升级了套房，满意,豪华行政房
H25,2020-03-15,疫情期间入住，总体不错??,高级大床房
H25,2020-03-15,好的我们住的不错,高级双床房
H25,2020-03-17,位置不用说就在华强北，停车方便，周边餐饮很多！,行政套房(全新装修)
H25,2020-03-17,因疫情原因，早餐一般，只有少量固定套餐选择，送餐至房间。餐厅未开放,行政套房(全新装修)
H25,2020-03-18,性价比很高，很好,豪华客房
H25,2020-03-18,性价比很高,豪华客房
H25,2020-03-21,酒店这个价位当中，服务态度环境都很好,高级大床房
H25,2020-03-22,地段还可以。酒店装修有老化，整体服务不错。,豪华客房
H25,2020-03-23,位置优越，交通便利,高级双床房
H25,2020-03-24,前台小黄非常棒！,高级大床房
H25,2020-03-27,经常住。挺安静。疫情期间好少人,豪华客房
H25,2020-03-27,位置不好找，导航都绕半天，比较陈旧，老星级酒店，房间特别低矮,高级双床房
H25,2020-03-28,离地铁很近，出行方便,高级大床房
H25,2020-03-29,非常好 老牌五星,高级双床房
H25,2020-03-30,工作需要经常住，还可以吧,豪华客房
H25,2020-03-30,很好，以后还来住！,高级双床房
H25,2020-04-02,总体还不错,高级大床房
H25,2020-04-03,酒店环境很好，服务态度很好,高级大床房
H25,2020-04-04,挺方便的哈！可能是疫情原因吧，酒店房间可选择空间有限。,行政套房(全新装修)
H25,2020-04-04,预订的行政套房，感觉还是挺不错的，就是卧室稍微小了一点！可能疫情原因导致很多房间没有开放，可选择空间太小，环境不错，也方便找！,行政套房(全新装修)
H25,2020-04-05,前台胡诗杰和黄馨连服务特别好，,高级大床房
H25,2020-04-06,很不错！值得推荐,高级大床房
H25,2020-04-08,疫情期间，这次酒店赠送了防护套装，里面有口罩、湿纸巾、消毒酒精、免洗洗手液，不得不说酒店很大气，也不枉我常来常住,高级大床房
H25,2020-04-08,因工作关系，3月份住过好几次，值得推荐,高级大床房
H25,2020-04-08,经常住，老字号酒店了，各方面都不错,高级大床房
H25,2020-04-10,环境很棒，酒店干净，安静！早餐很好吃，地理位置优越，挨着华强北,高级双床房
H25,2020-04-10,房间还可以，就是有点旧了,高级大床房
H25,2020-04-12,跟平时差不多，感觉住客多起来了,高级大床房
H25,2020-04-14,非常喜欢的酒店，特别是旁边那个凤凰楼酒店东西好吃,高级双床房
H25,2020-04-14,交通十分方便，房间宽敞,高级双床房
H25,2020-04-15,老牌五星，设施陈旧了一些，也能理解，房间卫生整体较好，房间没有那种老旧酒店的霉味或难闻气味，但是卫生细节还是有自暴自弃的感觉，比如卫生间浴缸边上，门吸附近有一摊黑渍，应该可以清洗掉的，但是很显眼的留在了那里，恶心人！,高级双床房
H25,2020-04-15,听老板娘的话会发财,豪华客房
H25,2020-04-17,老牌五星，不服务就是最大的服务,高级大床房
H25,2020-04-18,没有早餐，有水果送，还可以,高级大床房
H25,2020-04-19,非常不错的一家店。进门送口罩还有兔洗液。,高级大床房
H25,2020-04-19,好像没什么好写的,豪华客房
H25,2020-04-22,交通便利、性价比超高！,高级大床房
H25,2020-04-22,非常棒的体验，酒店还贴心准备了防疫套装，楼下就是地铁站,高级双床房
H25,2020-04-25,还可以吧，老五星，在华强北这个地段500多也就能住这个水平的了，还送了两个口罩+消毒液+免洗手凝胶，虽然在深圳北站还给了深圳人民，但还是很贴心哒,高级大床房
H25,2020-04-26,位置好，停车方便,行政套房
H25,2020-04-26,位置不错，就在华强北！,行政套房
H25,2020-04-26,服务不错，位置方便。给做了升级和送了水果,高级大床房
H25,2020-04-26,还可以吧，人开始多起来了,豪华客房
H25,2020-04-28,老五星，挺好，经常住,高级大床房
H25,2020-04-29,环境好，条件好,高级大床房
H25,2020-04-29,价格很划算，房间很干净,豪华行政房
H25,2020-04-30,洗手间太小了，其他还行,高级大床房
H25,2020-04-30,位置很不错,高级大床房
H25,2020-05-03,性价比很高的酒店哦，物超所值，交通很便利，早餐种类非常丰盛，房间里面很干净，住的非常放心，值得推荐哦,高级大床房
H25,2020-05-04,环境清净，空气新鲜！老板娘亲和！,高级大床房
H25,2020-05-04,非常棒，在华强北，方便！,高级双床房
H25,2020-05-04,代人预定的，领导反馈不错，下次还可以订,高级大床房
H25,2020-05-04,早餐比较少,高级大床房
H25,2020-05-04,疫情期间早餐比较少,高级大床房
H25,2020-05-06,跟平时差不多，早餐还行,行政客房
H25,2020-05-10,酒店环境设施都不错，房间内舒适。,高级双床房
H25,2020-05-10,老牌五星酒店，环境地段服务都不错，设施略微陈旧，隔壁的凤凰楼喝茶很好,高级大床房
H25,2020-05-11,非常好非常好,高级大床房
H25,2020-05-11,性价比超高，酒店附近美食超多。,高级双床房
H25,2020-05-11,我没有要早餐,高级双床房
H25,2020-05-11,中心位置！不错,豪华客房
H25,2020-05-13,酒店交通便捷，客房干净舒适。,高级双床房
H25,2020-05-13,环境不错，服务很好。,高级大床房
H25,2020-05-15,非常的酒店。,高级双床房
H25,2020-05-15,整体感觉还不错，但是感觉装修和设备有点旧了。,高级大床房
H25,2020-05-16,设施比较陈旧，没有配套的服务。,高级大床房
H25,2020-05-16,到深圳的最佳選擇，地點方便,高级大床房
H25,2020-05-16,這里一楼的自助餐是我住过的酒店里最好的,高级大床房
H25,2020-05-18,比较老的酒店 设施一般 地理位置方便 建议住主楼高层房间 但是窗户有打不开的情况,高级大床房
H25,2020-05-18,可以 可以,高级大床房
H25,2020-05-19,都挺好的。,高级大床房
H25,2020-05-19,非常可以的,高级大床房
H25,2020-05-22,就这样吧。,高级双床房
H25,2020-05-22,早餐的方式不错,高级大床房
H25,2020-05-23,酒店很好，每次去深圳都订在这。,高级大床房
H25,2020-05-23,酒店有点老了，地段不错,高级双床房
H25,2020-05-23,地理位置好，服务好,标准大床房
H25,2020-05-23,非常好的酒店,高级双床房
H25,2020-05-23,住着舒服，方便。,高级大床房
H25,2020-05-26,前台服务员胡诗杰服务特别好，特别周到悉细心,高级双床房
H25,2020-05-26,前台接待胡诗杰服务特别好,高级双床房
H25,2020-05-26,行政房还是比普通房会好很多,豪华行政房
H25,2020-05-27,蛮好的，不错,高级双床房
H25,2020-05-30,位置和停车不错,高级大床房
H25,2020-05-30,性价比很高,高级大床房
H25,2020-05-31,帮朋友订的，反映很好很不错,高级双床房
H25,2020-06-01,一如既往的好,高级大床房
H25,2020-06-01,挺舒服的呀,高级大床房
H25,2020-06-01,位置出门方便。,高级大床房
H25,2020-06-02,虽然凌晨才到，前台很友好，就住一晚上，第二天早上就离店办事了，对入住满意,高级双床房
H25,2020-06-02,设施不是太新，没有USB插口,高级大床房
H25,2020-06-02,酒店设施设备很老了，服务也跟不上，挂牌5星，实际上还比不上一般的连锁酒店,标准大床房
H25,2020-06-02,设施不是太新,高级大床房
H25,2020-06-03,位置好，出行方便,行政套房
H25,2020-06-03,地理位置还行 走路去华强北,高级大床房
H25,2020-06-03,还可以，就是门口在修有点不方便,高级大床房
H25,2020-06-03,还可以，服务不错,高级大床房
H25,2020-06-03,今天感觉一般,豪华客房
H25,2020-06-04,还不错的酒店 只是有点悠久的历史,高级大床房
H25,2020-06-04,是出差旅游比较好的选择,高级大床房
H25,2020-06-04,酒店各方面非常满意！,高级大床房
