酒店名称,评论日期,评论内容,入住房型
H29,2020-07-10,第二次入住**酒店三元里店 好像是新开的 很干净很好 服务特别好 一进来有好喝的白香果免费喝，每天可以送一个口罩前台都有 服务真的没话说，会员每天都有甜品送到房间 最主要一点是点了外卖不用下去拿 工作人员会送到你房间 特别的好 果断办了会员 优惠很多 可以自己咨询一下,雅致双床房
H29,2020-07-10,小茹好评多多,雅致大床房
H29,2020-07-10,很不错，设计好，服务好，干净卫生,高级大床房
H29,2020-07-10,床舒适服务很好,雅致大床房
H29,2020-07-10,房间不错，服务很好，推荐,雅致双床房
H29,2020-07-10,小茹，清馨，清紫服务态度很好??环境很好??房间很好??住过最舒服的酒店??很棒,高级大床房
H29,2020-07-10,小如清梓服务很好，房间很干净，不错,几木阳光大床房
H29,2020-07-10,态度非常好，位置呢，因为靠近路边，所以晚上可能会一点吵，然后停车场是免费的，但是是停在另外一栋楼楼下，这个酒店就是没有停车场的，不过酒店会帮给钱。此外，如果是出差的小伙伴要注意一下，这家店应该是属于**的加盟店，所以开票的抬头不是**，可能报销会比较麻烦！总的感觉就这些,高级大床房
H29,2020-07-10,一直住**，因为特别喜欢它家的风格。不过这次出行觉得服务一般。入住的时候前台也不知道发生了什么，一大坨人围在前面，处理了好久。也不会分一个前台给后面的散客先办理。点了外卖还要自己下去拿，美其名曰尊重客户。前两天的怎么就送了？？下去拿外卖又说没登记刷脸，要回公司拿身份证登记，后来又说机具有问题，不是没登记。我同事已经在跑回去拿身份证的路上了。。下班了8，9点饥肠辘辘，一来一回一个小时到10点，本来就累，真的搞人心态。作为金卡客户，这次体验真的一点都不好，虽然是很小的细节，但是以往的**都做的很好，希望以后能越做越完善吧，真正做到家的感觉。,几木大床房
H29,2020-07-10,新的酒店，卫生不错，服务也很好，休闲看书的地方很不错，选的书都很好！??,雅致大床房
H29,2020-07-10,位置好，方便，小茹服务态度很好,雅致大床房
H29,2020-07-11,早餐比较丰富，周边交通方便，服务人员态度都非常热情。有洗衣房，和健身房。美中不足，空调声音大了一些。,雅致大床房
H29,2020-07-11,酒店服务很好，当时自己弄错了，造成重复预订，店家也给进行了处理，很人性化的服务，给店家和服务人员点赞，,雅致大床房
H29,2020-07-11,非常好，下次还会住这里,雅致大床房
H29,2020-07-11,整天环境不错,雅致大床房
H29,2020-07-11,各位职员都做的挺好的清梓,高级大床房
H29,2020-07-11,?从办理入住到退房，服务一直在线，点个赞????客房打扫的工作人员都会微笑跟我打招呼，有种宾至如归的感觉。?床很舒服，枕头也是。一晚下来没有觉得哪里不舒服，感觉很舒适?积分兑换的早餐，不用额外加钱加早餐，非常好。**酒店，性价比很高的酒店，值得再次选择你家。,雅致大床房
H29,2020-07-12,不错，真不错。,几木大床房
H29,2020-07-12,清馨，好评，舒服,雅致大床房
H29,2020-07-12,总体来说还不错，服务态度很好，环境也挺好的,雅致大床房
H29,2020-07-12,忘记拍照片了，环境真的好，主要是干净，卫生。带着孩子住的很舒适，前台的美女人美服务态度也好。早餐很丰盛，味道很好。很少写评价的我不由自主的想给这家酒店一个好评。真心地推荐。,高级双床房
H29,2020-07-12,我住过最差的**！管理、服务都极其差！！,几木大床房
H29,2020-07-12,好好好服务好，电梯那个小姑娘服务员服务好,高级大床房
H29,2020-07-12,真的很喜欢的酒店，值得大家关注，极力推荐给大家！,雅致双床房
H29,2020-07-12,好好好好好，早餐好,高级大床房
H29,2020-07-12,好好好好好,高级大床房
H29,2020-07-13,房间干净，早餐也不错，,雅致双床房
H29,2020-07-13,酒店非常好。干净而且安静。工作人员清馨非常好，耐心。负责。,几木大床房
H29,2020-07-13,很好，新开的很干净,雅致大床房
H29,2020-07-13,房间很干净，床和枕头超舒服，下次过来还住这，隔音效果也超好，晚上还送了宵夜,雅致大床房
H29,2020-07-13,服务还有卫生都很棒，不错??,几木阳光大床房
H29,2020-07-13,床 挺舒服的。不会睡不好,雅致双床房
H29,2020-07-14,很好的体验,雅致大床房
H29,2020-07-14,各方面都很好,高级双床房
H29,2020-07-14,各方面都很好！,雅致双床房
H29,2020-07-14,很不错，再来还会选,几木大床房
H29,2020-07-14,很不错，再来还会选，早餐很丰富,雅致大床房
H29,2020-07-14,干净，早餐有广东特色早茶，虾饺不错哦。免费洗衣房、健身房全天开。防疫工作很到位，放心。前台清馨姑娘热情漂亮。距离三元里地铁站大约1.5公里，步行20分钟。打车，公交都方便。酒店周围美食很多，不用打听，看看排队就知道。,雅致大床房
H29,2020-07-15,配套设施都蛮好，没有吃早餐也不知道具体怎么样，服务人员都很热情，算是三元里大道性价比很高的酒店啦。,雅致大床房
H29,2020-07-15,酒店是新装修的，服务好，有赠饮，体验不错,高级大床房
H29,2020-07-15,服务非常满意，清馨服务态度特别好,雅致大床房
H29,2020-07-15,前台接待非常热情，房间干净整洁，床垫与枕头的感觉特别好。酒店对面就是一家美味的广式餐厅，下次还会选择**！,雅致大床房
H29,2020-07-15,不错啊 地理位置好,雅致大床房
H29,2020-07-16,早餐丰盛，床睡着舒服,高级大床房
H29,2020-07-16,早餐非常棒，酒店设施非常新，工作人员热情哈哈。地理位置也不错，边上就有便利店，买东西非常方便。 三楼有健身房可以跑步????,雅致大床房
H29,2020-07-16,早餐不错喔。酒店设施也非常新，但是没有异味。挺好的，楼下就有便利店，对面就有好多吃饭的地方，位置还可以。 三楼可以健身,高级大床房
H29,2020-07-17,非常好，房间超级干净，服务也好，早点也好吃下次入住还选亚多，交通便利，周围吃的，商场都有打车去机场也近,雅致双床房
H29,2020-07-17,很舒服，很干净,高级大床房
H29,2020-07-17,酒店很干净，很舒服,高级大床房
H29,2020-07-18,房间很新很干净,几木双床房
H29,2020-07-18,环境干净整洁,雅致双床房
H29,2020-07-19,这个**很多细节做的很好。确实不错值得推荐,高级大床房
H29,2020-07-21,小茹好评好评,雅致大床房
H29,2020-07-21,超级赞?????? 非常舒服的床，一躺下就睡香了！特别喜欢洗手液和沐浴露的香味！ 前台的服务非常殷勤，感觉比六星酒店还人性化！ 附近好吃的也很多！ 强烈推荐！,高级双床房
H29,2020-07-22,早餐很多品种，很丰盛,高级大床房
H29,2020-07-22,交通便利，服务不错,雅致大床房
H29,2020-07-22,服务好，房间干净，防疫卫生管控好，前台备了好多一次性酒精棉我都顺手带走很多,高级大床房
H29,2020-07-23,交通便利，酒店很干净,高级大床房
H29,2020-07-23,服务非常好,雅致双床房
H29,2020-07-23,服务非常好,雅致大床房
H29,2020-07-23,好好好好好,高级大床房
H29,2020-07-24,房间满意服务很好的点赞清灵。,高级双床房
H29,2020-07-25,清馨服务很好，不错的,高级双床房
H29,2020-07-26,前台小姐姐清馨很热情，服务很好哟，还办了会员卡，挺好的。,雅致大床房
H29,2020-07-26,早餐很好吃。服务特别好。清灵服务很喜欢哦,高级大床房
H29,2020-07-26,确实非常好,高级双床房
H29,2020-07-26,很干净。住着也舒服,高级大床房
H29,2020-07-27,干净，安全，舒适！,雅致双床房
H29,2020-07-27,酒店真不错，干净，安静，还不贵，下次还会再来，在酒店还拉下东西了，热心的服务人员清灵给我寄回来了,高级双床房
H29,2020-07-27,接待客户，，，，**酒店还是不错的选择，，，，，，干净卫生，，，，，，，，，，，，，，，，，，，，，，,雅致大床房
H29,2020-07-28,很好！下次还会光顾,高级双床房
H29,2020-07-29,舒服干净卫生，打扫卫生也很及时，给我免费升级了房，房间发舒服，前台清馨服务态度好，早餐起不来吃，听着很好吃，好遗憾，下次来再吃！位置不错,雅致大床房
H29,2020-07-29,很好！下次还会光顾,高级双床房
H29,2020-07-29,很干净，服务很好，**一直做的不错,几木大床房
H29,2020-07-29,清灵、清馨是两位好姑娘！,高级大床房
H29,2020-07-29,酒店服务非常棒，房间很新，卫生也很干净，房间属于轻奢风，我喜欢的风格。前台服务员也特别棒，每次我点外卖，他们都帮忙拿上来，服务太好了……还有，我想延迟退房，前台美女清馨还特地上我房间为我服务，真的太贴心，如果下次来广州，一定会再次入住的！,高级大床房
H29,2020-07-29,前台服务的小姐姐很热情，小哥哥也很有耐心。谢谢！,高级大床房
H29,2020-07-29,来这住了4天，早餐是自助，很不错，出差很方便，住的舒服，下次来还是住这里,几木大床房
H29,2020-07-29,出差到这，很干净，离地铁站20分钟，旁边很多烤肉店，服务很到位，前台清馨很好，服务态度好，下次还要住,几木双床房
H29,2020-07-30,是新开张的酒店，地段繁华，附近吃饭也很方便，小姐姐服务态度也很赞，唯一不好的是快递要下楼自取，下次还回光顾,高级大床房
H29,2020-07-30,我把衣服忘记在酒店了，多亏了清灵给我安排寄回给我，谢谢他,雅致双床房
H29,2020-07-30,地方好，环境早餐很不错,几木阳光大床房
H29,2020-07-30,早餐非常丰盛，前台服务优秀，尤其清灵姑娘值得表扬,雅致大床房
H29,2020-07-30,精致舒服。卫生,雅致大床房
H29,2020-07-30,服务很好，很贴心，给清灵点赞,高级大床房
H29,2020-07-30,挺好的………,几木阳光大床房
H29,2020-07-31,服务好、环境好,雅致双床房
H29,2020-08-01,很棒呀一如既往的好,雅致大床房
H29,2020-08-01,很好的体验,雅致大床房
H29,2020-08-01,早餐好，服务好，门口就有吃的，隔壁街还有八合里,几木双床房
H29,2020-08-02,很棒哦，很舒服，工作人员清馨非常负责任，感谢哦,高级大床房
H29,2020-08-02,整体很温馨,高级大床房
H29,2020-08-02,早餐好多选择,高级大床房
H29,2020-08-04,新酒店！服务很好！环境也不错,雅致双床房
H29,2020-08-04,新酒店，很干净。,雅致双床房
H29,2020-08-04,满意很干净,雅致大床房
H29,2020-08-04,小茹好评了,雅致大床房
H29,2020-08-04,不错！环境还行,雅致双床房
H29,2020-08-04,**的工作人员服务态度真的没话说，进门出门都给准备水，孩子需要做作业还帮忙打印，下雨会递给你伞，甚至伞被借完了，工作人员会拿私人的伞给我，还有很多细节都特别暖心！早餐种类不像五星酒店那么多，但是种类也蛮丰盛，作为早餐足够了！尤其是甜品，都特别好吃！酒店床品一如既往的舒适！卫生也很不错！以后会继续选择**！,高级双床房
H29,2020-08-04,帮爸妈订的，他们很满意酒店的设施和服务，但是说酒店周边环境很乱哈哈哈。早餐丰富，卫生做的很好，还有欢迎水果，都很妥帖，推荐哈。,高级大床房
H29,2020-08-04,早餐很丰盛，每次出差在外**是首选,雅致大床房
H29,2020-08-04,新酒店！不错下次还来,高级双床房
H29,2020-08-05,小茹服务很好,高级大床房
H29,2020-08-05,早餐很丰富，很不错！,高级大床房
H29,2020-08-05,服务态度好,高级大床房
H29,2020-08-05,**很让人满意，一定加油,高级大床房
H29,2020-08-05,非常非常非常好，前台小哥哥小姐姐都非常的热情，是我住过体验感最好的酒店,高级大床房
H29,2020-08-07,挺好的。前台的服务不错。,雅致大床房
H29,2020-08-07,酒店设施齐全，前台服务员礼貌周到，早餐特丰盛，房间干净卫生，没有异味，这点我特满意，下次还会住这里,雅致大床房
H29,2020-08-07,酒店的环境很好，很舒适！酒店的工作人员小茹服务很热情周到，非常感谢！,高级大床房
H29,2020-08-07,清馨清沐服务很好,高级大床房
H29,2020-08-07,早餐很丰富，让旅客一早就有好心情，门口小姐姐还会亲切问询早餐是否合口味，并会有心记录。前台办理入住登记的帅哥很暖心，看到后续等待的客户会递上特调解暑的饮料，还会介绍**酒店的设施情况。（特别赞一句，我因为公差急需打印几张标书，多亏前台帮忙，让我不至于费心在去外面找打印店）,高级大床房
H29,2020-08-08,很好，很方便，早餐也很好,高级大床房
H29,2020-08-09,小茹好评很好,高级大床房
H29,2020-08-09,强力推荐，以后都会入住,雅致双床房
H29,2020-08-10,早餐很好，旁边有很多吃饭的地方.打车很方便，离地铁口稍远，大概一两公里的样子.楼下就是一个东北烤肉店，味道非常好.,高级大床房
H29,2020-08-10,非常棒的一个酒店,雅致大床房
H29,2020-08-10,广州这家店特别棒 服务热情 房间干净卫生 下次来还会住,高级大床房
H29,2020-08-11,早餐很不错，粤式早茶，,高级双床房
H29,2020-08-11,整体环境OK，晚到了前台办理入住手续还是很快，房间挺干净的，卫生间也很好，干湿分离，还有洗手台，枕头很舒服，适合睡觉??,高级大床房
H29,2020-08-11,酒店很新，所在层必须用卡，安全,高级双床房
H29,2020-08-11,下次还要定这里，前台服务很好，非常推荐的一家酒店,高级双床房
H29,2020-08-12,跟朋友出来玩的，酒店很新，卫生打扫的也很干净，前台的清沐妹妹服务也很周到，早餐很丰盛，种类丰富，很不错的体验，有机会再来，一定再住这里,高级双床房
H29,2020-08-13,环境相当棒，服务也很好，有书吧，茶，安全方面也好，早餐也很棒，总之就是不错了，对他的概括就是小而精，不过有一个服务员的热情好假，总体很不错，建议入住,雅致大床房
H29,2020-08-13,干净卫生无异味,高级大床房
H29,2020-08-13,酒店环境舒适,雅致大床房
H29,2020-08-13,离机场近，酒店非常干净卫生，前台服务人员清椰特别认真负责高效,高级双床房
H29,2020-08-14,酒店很干净，服务态度很好，很不错的体验,雅致大床房
H29,2020-08-14,酒店服务好,高级双床房
H29,2020-08-14,总体还是很不错的,雅致大床房
H29,2020-08-15,环境设施卫生都不错清馨,雅致大床房
H29,2020-08-15,有了前一天在深圳的教训，一到广州，住进**酒店，感觉非常舒适。环境，卫生，硬件设施等都非常过硬。特别是酒店的服务，真是周到。前台清馨姑娘，更是无微不至，值得表扬。客房服务也是非常细致。本身不是会员，还是把退房时间帮我延长到下午二点，真是太人性化了。晚上还送来二杯糖水。甚是不错，值得推荐。,高级大床房
H29,2020-08-15,停车场隔条马路,高级双床房
H29,2020-08-16,房间舒适、服务细致 为：清灵、清耶、清秋点,雅致大床房
H29,2020-08-16,酒店环境卫生很干净，位置也很好，出行很方便，早餐也很好。适合带孩子。有免费停车场（在马路对面，不是很远）,高级大床房
H29,2020-08-17,新装修的酒店，环境很好，房间不是很大，同等价位里算是很不错的，停车场在马路对面，酒店提供免费停车券。,高级大床房
H29,2020-08-17,这个价位住过最差的酒店，没有之一。各方面配套非常差。,高级大床房
H29,2020-08-18,房间干净整洁干净小茹服务态度很好,高级双床房
H29,2020-08-18,小茹服务态度很好??早餐好吃,雅致双床房
H29,2020-08-18,房间卫生的，小茹服务态度很好,高级双床房
H29,2020-08-18,环境卫生和服务都挺好。,雅致大床房
H29,2020-08-18,最满意的一家**酒店，尤其是早餐，相当丰富，而且很热情，,高级双床房
H29,2020-08-18,不错不错啊,高级大床房
H29,2020-08-18,这家宾馆的卫生还是比较不错的，这家宾馆的交通也是非常方便的，周围便利店也有，周围吃饭的地方也有，比较方便,几木双床房
H29,2020-08-18,酒店整體很好，離地鐵站很近，出行很方便，早餐種類豐富，味道好，有可愛的兒童餐具，小朋友非常喜歡，不捨的走，老人家特別愛吃這家的湯粉，也有我愛吃的沙拉，咖啡牛奶豆漿都有，味道好，早餐時間充足，週末時間到11點，即時多睡一會也可以吃到早餐，順帶午餐一起吃了，哈哈哈哈，服務超級熱情，入住有奉上茶水，服務員還會幫忙拿行李，送到電梯，超級熱情，有小朋友牙刷，小朋友拖鞋，免費升級了房間，入住體驗超級棒，性價比超高，物有所值，價格實惠，酒店房間衛生乾淨整潔，入住很放心，房間打掃一塵不染，住的很舒服，房間裡面咖啡茶都是免費的，酒店洗漱用品很棒，很喜歡，新開的酒店，整體設施完善，酒店房間隔音很好，很安靜，休息的超級舒服，退房還很貼心的幫忙叫了車，酒店服務員給我們每人一瓶水帶著備用，很完美的入住體驗，以後還會來入住，差旅首選酒店，讚，服務好，衛生乾淨，有免費停車場，免費洗衣房，免費健身房，很喜歡亞朵酒店，出行方便，讚，會推薦朋友入住！,高级大床房
H29,2020-08-18,小茹服务态度很好??房间干净整洁干净了,高级大床房
H29,2020-08-18,好好好好好,高级大床房
H29,2020-08-19,赞得没得说，环境，卫生，服务简直一流,高级大床房
H29,2020-08-19,给老板订的酒店，事后过了好久补发票，依然很热情,高级大床房
H29,2020-08-19,又一次来了，久违的清灵又见面了哈哈哈，房间隔音非常好，服务热情，还送了水果,高级大床房
H29,2020-08-19,先说酒店外部环境：酒店在白云区，周边吃饭很方便，公交车站区去哪也方便。还有便利店。附近有韩国料理街，烧烤比较多，到了广州第一餐吃的就是烧烤，还挺好吃的。再说酒店内部：说是2020新开业的倒是没觉得有那么新，不知道是不是重新装修了。会提供儿童牙具和拖鞋。对了，得吐槽一下儿童牙刷对于2岁的宝宝来说太大了。。。服务更不用说了，**的服务人员都很热情，刚办入住就给到了杯他们自己做的奶茶，对于我这个奶茶续命的人简直都被惊艳到，味道也超好。然后再值得提的就是酒店的早餐非常丰富，有广州当地特色的茶点，居然有我最爱吃的鸡爪子，哈哈。每天早上吃饱饱的中午都不用再吃饭了。而且去过几个城市的**，每个**早餐都会有当地的特色，做的也好吃还有就是酒店的自助洗衣房，健身房，这个价位真的超值了。对了，还有阅读区：以后出门旅行再也不用带着绘本出门了，**好多儿童绘本，晚上睡觉可以给宝宝们讲。真的比希尔顿欢朋的细节做的更好了。会继续支持**！,高级大床房
H29,2020-08-19,第二次来住了，感觉挺好的，谢谢清灵,雅致大床房
H29,2020-08-21,服务好，床舒适,雅致大床房
H29,2020-08-21,好、卫生干净，房间安静，服务好，赞,高级双床房
H29,2020-08-21,这家酒店的服务真的是好，从前台到餐厅服务员再到清洁工作人员，都很好。最让我惊喜的是，入住当天是我的生日，自己给忘了，晚上回酒店就收到鲜花??太开心了，在入睡前，酒店工作人员--清馨小姐姐给我送来了甜品，本来不想吃的，因为很怕长胖，但是吃了一口后就停不下来了，两三口就都干光了，太美味啦！很感谢这些工作人员的认真、用心和真诚，我觉得作为一家四星级酒店，但在服务和态度上做到了五星酒店的水平，真的是太赞了??也可以反映出酒店的管理也是相当不错的，好啦，这是发自真心的点评，再接再厉，加油加油??,雅致大床房
H29,2020-08-22,干净卫生位置好,高级大床房
H29,2020-08-22,酒店挺新的，不错，服务也不错,雅致双床房
H29,2020-08-24,来广州必住的酒店,雅致双床房
H29,2020-08-24,来广州必住酒店,高级双床房
H29,2020-08-24,所有都很好,高级大床房
H29,2020-08-24,前台服务人员清馨、清沐，服务态度特别好，非常热情??，每次来广州必住酒店，全部??,高级双床房
H29,2020-08-24,服务态度很好，前台服务员非常热情，来广州必住酒店！,雅致大床房
H29,2020-08-24,住过佛山的**，**的酒店普遍都还是新的，装修简洁大方，客服还是很周到的,高级大床房
H29,2020-08-24,前台服务人员清馨、清沐特别热情，每次来广州必住酒店，全部??的,高级双床房
H29,2020-08-24,前台服务人员清馨、清沐特别热情，每次来广州必住酒店，全部??的,高级大床房
H29,2020-08-24,一切都??的,雅致双床房
H29,2020-08-25,这次出行选了** 体验感太好了环境卫生都特别好，客房大姐服务态度很好真心推荐，清馨清沐儿特别好,几木双床房
H29,2020-08-25,非常贴心，就担心我们哪里不舒服,高级双床房
H29,2020-08-25,服务很好，我很满意，还很贴心,高级大床房
H29,2020-08-25,早餐什么都不错是附近比较好的酒店,高级大床房
H29,2020-08-25,秒加会员！,雅致大床房
H29,2020-08-26,小哥哥小姐姐们服务非常贴心，我们的行李比较多，小哥哥主动帮我们解决，并贴心送上车，很感动，不知道住哪里选**没错哈哈,高级大床房
H29,2020-08-26,清馨小姐姐服务好,雅致双床房
H29,2020-08-26,酒店卫生很好，服务很到位，刚好碰到七夕，收到酒店的花花，比心??，退房时，前台清馨还贴心的送上矿泉水。很舒服的一次体验,几木阳光大床房
H29,2020-08-27,酒店比较新，设施都很不错。环境卫生不错,高级大床房
H29,2020-08-27,很满意，酒店位置很好，装修比较新。设施都很齐全，卫生也很ok。早餐种类味道都还可以。最重要的是前台美女清灵人很nice，总之是很满意的一次住宿体验。,高级大床房
H29,2020-08-27,不錯有下次,雅致双床房
H29,2020-08-27,挺不錯的選擇,雅致大床房
