酒店名称,评论日期,评论内容,入住房型
H38,2020-06-27,早餐不错吃，非常适合亲子游,豪华山景双床房
H38,2020-06-27,跟三星酒店样,豪华海景双床房
H38,2020-06-27,好几年的端午都是在这个酒店沙滩人少泳池开放的时间比较久带娃出游挺好的,豪华山景大床房
H38,2020-06-27,景色非常好 小朋友玩的也好,豪华山景双床房
H38,2020-06-28,位置不错，避开了人流最密集的地区，私密度不错。,豪华海景大床房
H38,2020-06-28,酒店沙滩水超干净，房间一般般，还行吧,豪华山景大床房
H38,2020-06-28,，被Lost呀,豪华山景双床房
H38,2020-06-28,设施有一点旧了,豪华海景双床房
H38,2020-06-28,订了房间说没有了安排了别墅区的同等价位房间给我，下午两点到酒店，工作人员安排到五点才能入住。结果去到那边一看，环境相当恶劣，要不是和家人一起来都不敢住，味道极其大，可见很久没人住了。找了前台换回原来的房间，热水不够热。退房要求十二点不能延后，我是前一天五点才入住的、而且是酒店方安排不妥导致我白等三个小时，结果申请延后一个小时都不给。累觉不爱，1722一间房间的体验就是这样，不值得。,豪华山景双床房
H38,2020-06-28,酒店比较旧了，卫生一般，沙滩沙子很粗，不适合散步；餐厅口味OK，建议重新装修或增加主题活动可增加人气,豪华海景大床房
H38,2020-06-28,酒店比较旧了,豪华山景双床房
H38,2020-06-28,环境，泳池，早餐等都很好,豪华山景双床房
H38,2020-06-28,正如其他住客所说设施比较残旧，但烂船都有三根钉，5星该有的还是有的，前台还免费升级了房间,豪华山景大床房
H38,2020-06-28,海边还是不错的，早餐一般，吃包就行。有停车场，房间一般，卫生还可以，不知道能加床不，适合带孩子去玩。,豪华山景双床房
H38,2020-06-29,环境清幽 干净整洁,豪华山景大床房
H38,2020-06-29,很好 很适合度假 有马尔代夫的感觉,豪华山景大床房
H38,2020-06-29,酒店设施有点旧了，但作为国际五星酒店服务还是很到位的。免费停车私家沙滩，不用扎堆去人多的地方，很休闲。沙滩的沙子有点粗，踩着不是很舒服。,豪华山景双床房
H38,2020-06-30,早餐可以有停车场，房内发现几只蟑螂希望改善一下卫生,豪华海景双床房
H38,2020-06-30,优势：很适合亲子游，订的海景房，酒店免费升级大阳台视野很好，房间卫生清洁干净，洗漱用品准备充足全新，2米床2大1小刚好够睡。改进：床铺有点软睡的不习惯，阳台的浴缸维护不到位有破损（不过也用不上），早上起来不知道什么原因阳台是湿的，初步猜测是上一层的露天浴缸排水排下来的，阳台的围栏有破损应修护和贴安全标志，带小孩的要注意安全勿靠近攀爬。 酒店休闲娱乐设备很充足，就算遇到下雨天气也不用担心，可惜行程有点赶来不及体验，，3天2夜时间会充裕些，相对于同等价位的酒店来说性价比挺高的，整体来说还是很不错的，因为是错峰出游，车流量小，入住率不高，沙滩人也不多，价格也比较合理，下次还会回订！,豪华海景大床房
H38,2020-06-30,看那么多评论说没有服务，原来是真的，毫无服务可言，假的五星级，海景房对面看到好大条烟囱，沙滩的确是沙粗，儿童设施里面一阵的不知道什么样的臭味。房间床单也是臭的，让换了。,豪华山景大床房
H38,2020-06-30,房间设施很一般，卫生也搞得不干净，床的背景墙灰尘，蜘蛛网都有，房间还有异味，很久没住人没通风的那种异味，住过最差的**。,豪华山景大床房
H38,2020-06-30,酒店是有十年的历史。有点陈旧。我们去到偶遇结婚。,豪华山景双床房
H38,2020-06-30,早餐丰盛，我们住的房型不能加床，浴缸是坏的。年代久远了，一开门霉味扑鼻而来。端午节涨价到1600多，实在不值得，撤退了,豪华山景双床房
H38,2020-07-01,环境不错，因为靠海的原因可能有一股潮湿的气息，酒店服务比较到位，但工作日餐厅没有晚餐，总体来说是一次不错的体验。,豪华山景双床房
H38,2020-07-01,这间**酒店是我有史以来住得最差的一间，酒店空调又不够，傍晚居然还有停水这么一出，去完海边游水回来居然没水洗澡！五星级的酒店居然停水？房间也很旧，湿气非常重，信号超级差！我简直刷新了我的三观，办理入住时服务也不怎么样！一问三不知！呵呵！反正不会有第二次！,豪华山景大床房
H38,2020-07-01,酒店的环境卫生都很好，服务也一流，这一次出门是为了游水，超级喜欢酒店外面的海滩，海水干净，而且人少,豪华山景大床房
H38,2020-07-02,客观评论，很让人失望的一家五星级。首先，房间很陈旧，床单都不干净，灯是坏的，遥控器是坏的，电视是特别小又没什么频道的。其次，早餐也很差，没啥吃的，特别是竟然没有菜…没有菜，没有菜！最后，我们二点多到，直到排队三点才给我们安排了一个房间，还有另外一个房间一直打扫中，打扫好了给我们打电话，但是一直等到5点，我主动打了三次电话才拿到房卡…真的是不敢恭维…不会再住！,豪华山景大床房
H38,2020-07-02,超级适合带着家人去的酒店，尤其是小孩子首先酒店位置就在海边，且有独自的沙滩；其次，酒店有露天泳池、市内泳池；再次，酒店住宿条件也很不错，含早的话，早餐是自助；最后，酒店还有其他娱乐设施，小朋友的游乐室（免费）、麻将室（收费）…综上，如果想带一家人来海边玩，这家酒店绝对推荐！！！补充：适合有车一族，因为酒店里主路有一段距离，所以开车最便捷,豪华山景大床房
H38,2020-07-03,吃完中午饭出发的。去到就有房间。去到前台Jim很热情。服务也很好。酒店隐秘性不错。下次去巽寮湾还会订这里。,豪华山景大床房
H38,2020-07-04,舒服 经常去玩,豪华山景大床房
H38,2020-07-04,室内游泳池和沙滩边的游泳池水质不错，离沙滩远点的游泳池就砂石多就些，脚板底易受伤。早餐一般般，选择不多，但是吃饱也够。下午酒店没有开张下午茶，游泳后肚子饿也没有地方坐坐吃点东西休闲下，总体只能算过得去,豪华山景双床房
H38,2020-07-05,酒店环境比较幽静。可能去的时候人少，停车位也足够。早餐一般般。酒店服务人员比较少？连个指路的人都木有…去了之后山景换海景，打了三个电话才有人上来带我们看房换房。私人沙滩的沙不细腻，小石头很多，硌脚，建议穿沙滩鞋！！！泳池不大，还好人不多，不然就下饺子了。总而言之，体验感一般，性价比不是特别高。,豪华山景双床房
H38,2020-07-05,挺好的 不错,豪华山景大床房
H38,2020-07-05,卫生还可以，配套可以，早餐可以。就是有些旧了？,豪华海景大床房
H38,2020-07-05,年份太久了，设施陈旧,豪华海景大床房
H38,2020-07-05,住过的最差的度假酒店，见过的最差的私家沙滩，真搞不懂这酒店为什么还开着，有损**的公众形象。,豪华海景双床房
H38,2020-07-05,环境优美，室内外游泳池很多,豪华山景双床房
H38,2020-07-06,早餐很丰盛，有停车的地方，位置比较幽静、设施比较陈旧酒店很大，有自己的海滩，海滩边有野趣的大石头、风景很美当然尤其天气好时，拍照很好服务理念比较欠缺但确实性价比比较高，晚上很安静没有烟花叨扰，房间也很大，总体满意。,豪华山景大床房
H38,2020-07-06,这是一家比较老的酒店，设施比较差，比如洗手间门关不上，浴缸不能蓄水，去沙滩的楼梯台阶之间有巨大的缝隙。但仅是设施差，并不会让我有冲动给评个最低分，而是服务水平差到忍无可忍所以才来评价。像登记入住以后要将近两个小时才能入住这种只是小问题。而把餐厅用来打底做食物冰鲜的碎冰渣提供给客人食用这种行为，真的是不可饶恕，因为不是自己吃的所以就随便给客人吃，让我联想到了之前有酒店用毛巾打扫厕所并擦拭杯子的行为，同样属于道德败坏不是么？之前在这家酒店碰到过上一个客人使用过的杯子没有清洗替换的事件，因为当时服务人员有和我道歉所以并没有追究。但这次不但没有道歉，当打电话想和客房主管反应的时候，也没有得到任何反馈，所以决定一定要揭露出来让大家看一下。今后不会再住这家酒店，其他的**也要慎重考虑。,豪华山景双床房
H38,2020-07-07,早餐品种多，口味好。酒店环境非常好。很高档，泳池沙滩娱乐设施完善。游泳很方便，自己的沙滩，也没有外人。很满意的一次住宿。下次还会来。非常满意。,豪华山景大床房
H38,2020-07-07,服务态度不错，房间也算舒适,豪华山景双床房
H38,2020-07-08,虽然设施陈旧一些，但五星酒店卫生还是比网红酒店或者公寓好的,豪华山景大床房
H38,2020-07-08,很不错，很温馨，很浪漫的。。。,豪华山景双床房
H38,2020-07-09,中规中矩，酒店店龄高设施较为陈旧,豪华山景双床房
H38,2020-07-09,房间还行吧就是沙滩有点脏，早餐一般，房间??是坏的找客房服务都找不到,豪华海景双床房
H38,2020-07-10,不错，服务很不错，环境挺好，餐食很赞,豪华山景大床房
H38,2020-07-11,真的不错！！,豪华山景双床房
H38,2020-07-11,出游真不错！,豪华山景双床房
H38,2020-07-11,衣柜密密麻麻都是白蚁，门卡还打不开，空调还坏了，不制冷，从下午三点入住，一直等到10点，期间杀白蚁，修锁，修空调。不断的有师傅进出。超差的体验，再不会来了。服务员态度非常不好，说园林房没人住，便宜。所以啥都坏，这是啥意思？,豪华山景双床房
H38,2020-07-11,**的平均水平吧，可能疫情原因，有泳池和温泉池没开，海景可以，只是周围施工很多，海水有点脏。,豪华山景大床房
H38,2020-07-11,安哥我爱你,豪华山景大床房
H38,2020-07-12,起初定的是110平方的套房，订单的时候2100，之后却打电话告诉我没房了，问是否换或者补差价。我看了下，平台还是有房的，只不过涨到了2500多。后来定了80多方的房，房价2000（原来我下单的时候才1800）设施老旧，被子都是脏的，真的很恶心啊，都这样了能不能换新的？打电话要多一床被子居然被告知一个房间只配一床，给多了个毛毯。自助早餐服务员很少，很多桌子没人收拾没地方坐饮水的杯子也没有了，不及时补充，不会再去了，真的不像5星。酒店位置还不错风景也还可以。,精致套房
H38,2020-07-12,环境不错的酒店,豪华山景双床房
H38,2020-07-12,设施偏旧总体还可以,豪华山景大床房
H38,2020-07-12,酒店有年载了，园内景色还行，酒店早餐也不错，但房内设施太陈旧了，很多设备都是锈迹斑斑。所谓的豪华海景大床房，一到晚上就是漆黑一片，享受不到海景房的感受??付着五星级的费用，住着三星级的感觉??,豪华海景大床房
H38,2020-07-12,酒店卫生堪忧，看图片这最基础的卫生都搞不好，卫生间有股狐臭味可能是上一个客人留下来的，房间很大霉味，外部环境还不错，沙滩很小很差，沙子很粗膈脚，唯一的好处就是人少，总体感觉一般，对不起**这个招牌。,豪华山景双床房
H38,2020-07-12,**算是这附近最好的酒店了。就发现这么一家国际五星。酒店设施有点老，但给安排的海景房位置很不错，景色特美，适合带孩子来玩，停车场位置也很多。入住免费停车，早餐可真不怎么样，达不到国五的早餐标准，餐食品种少，做的也不好吃，想着吃个白煮蛋吧，起码营养够了，结果剥皮是连皮带肉都剥下来了。蛋白也很难吃，像是煮前用盐水泡过，但又不是咸鸡蛋，总之口感很不好。建议酒店能改善。,豪华海景双床房
H38,2020-07-13,酒店位置很好，有私人海滩，室内室外游泳池，娱乐设施齐全，房间面积也大，酒店内很漂亮，满意！值得前往！,豪华山景大床房
H38,2020-07-13,比以前差多了。,豪华山景双床房
H38,2020-07-13,酒店位置十分好，建议驾车前往。酒店很大，设施齐全，房间面积也很大，满意,豪华山景双床房
H38,2020-07-13,早餐也就差不多是那样子，酒店很大，环境很好。就是房内设施有些老旧了，跟不上五星标。其它整体还好，也是可以去体验一下的！,豪华山景双床房
H38,2020-07-13,酒店有点年份了，不过有个自己的沙滩，人不多,豪华海景双床房
H38,2020-07-14,很不错的酒店，虽然设施有点老，但房型大，干净，性价比高。这次两大三小玩得很开心，酒店餐食烧烤吧298套餐很新鲜，外卖海鲜也新鲜可口，玩沙游泳，攀爬都很满意，适合亲子出游。,豪华山景双床房
H38,2020-07-14,服务差了一点,豪华海景大床房
H38,2020-07-14,酒店有点旧,豪华海景双床房
H38,2020-07-14,度假好酒店，孩子喜欢。,豪华山景双床房
H38,2020-07-14,太老了，有道里还有臭味，到了翻新的时候了,豪华山景双床房
H38,2020-07-15,住过的最好的房间，看海很nice,豪华山景大床房
H38,2020-07-16,安静独立的沙滩，喜欢。早餐的赞一个。,豪华山景大床房
H38,2020-07-16,总体还不错，算4星吧,豪华山景大床房
H38,2020-07-16,酒店有自己的海滩，环境很好，房间可以看海，走出海滩很近。酒店的海滩很好。自助早餐不错，有免费停车场。,豪华山景双床房
H38,2020-07-16,早餐不错，酒店自己的套餐有送自助晚餐。适合自驾，不想在酒店吃饭，都需要开车出门。整个景区人挺少，估计跟一瓶，人很少。,豪华山景双床房
H38,2020-07-16,酒店不错，时间也比较久了，上一次去是10年前。如果带小孩，可以在哪里呆上一整天。估计由于疫情原因，人挺少。,豪华山景大床房
H38,2020-07-16,早餐品类不多，卫生条件相比别处**较差。海水还算比较清。,豪华山景双床房
H38,2020-07-17,还挺好的，人不多，舒服。沙滩没有阳江好，哈哈,豪华海景双床房
H38,2020-07-17,早餐种类味道都中规中矩，疫情期间人不多，晚餐的自助都没有了。酒店有自己的海滩，打扫得很干净，赞一个。酒店有直达三角洲岛的船，200块钱租一艘小船，能坐12个人。游泳池室内室外都有，还有儿童泳池。泳池边和海滩一直有救生员，工作认真负责，再赞一个。很适合带小孩来度假。,豪华山景双床房
H38,2020-07-17,度假酒店，环境优美，有室内泳池室外泳池小孩非常喜欢。早餐中规中矩，都是豪华酒店规格。健身房有点小。车位比较紧张，位置比较偏，没有车的话吃东西不太方便。房间有阳台，可以在阳台欣赏景色。,豪华海景大床房
H38,2020-07-18,很好很好很好,豪华山景大床房
H38,2020-07-18,挺好的拉哈哈哈,豪华山景大床房
H38,2020-07-18,酒店位置靠海，沙滩,豪华山景大床房
H38,2020-07-18,适合带孩子,豪华山景大床房
H38,2020-07-18,挺好的，年前去的，人少，环境不错。,豪华山景双床房
H38,2020-07-19,酒店很新，私家沙滩很干净。早餐很丰富，吃完早餐后去海边游游泳，晒晒太阳，很是惬意。晚上可以泡泡澡，前台有一次性的泡澡袋售卖，非常方便。周末度假好去处，不错的选择。,豪华山景大床房
H38,2020-07-19,住过的最差的五星级酒店，应该只是**的标志让房价这么贵，设施一般，用品一般，半夜要加被子都没有。海景房离海太远了，酒店杂草丛生，地面都是灰灰的。沙滩很小，儿童区下午不开放了，服务员明显偏少。下次还是去住隔壁的嘉华。,豪华海景双床房
H38,2020-07-19,服务应该要提升，配送东西太慢。其他还好。,豪华海景大床房
H38,2020-07-19,住海景房五楼，感觉还可以酒店服务员很亲切，酒店对比檀悦的话，感觉檀悦适合带孩子去玩巽寮湾的沙滩不要期待太多，沙子都是粗粗的酒店可以美团送餐，这点很不错！,豪华海景双床房
H38,2020-07-19,泳池方面：有专门的儿童泳池，孩子玩的很开心。也有室内泳池。室外成人池有几处没有开放。孩子玩肯定够了。儿童设施，除了泳池，还有室外攀爬架，商场里那种，可以挂安全索的，但收费，100元一次。还有室内儿童俱乐部，适合三岁以下孩子。景色无敌、海很美，草坪很美，室外环境很美。酒店设施真心一般，年久没什么维护，房间设施旧，床垫不太舒服。早餐选择种类少，出品真心不像五星级酒店，装修落后。服务员忙不过来。一句话，景色很美，自然环境和儿童泳池很好，但酒店太旧，服务跟不上。,豪华山景大床房
H38,2020-07-20,带小孩子玩两天还是不错的。,豪华海景大床房
H38,2020-07-20,酒店比较旧了，服务挺好的,豪华山景双床房
H38,2020-07-20,见过垃圾酒店，没见过如果差劲的星级酒店，而且还是**，无论是从硬件还是软件服务，都能让人感觉这个品牌的傲慢。图片分别是洗手盆和电视，诸位细品。,豪华山景双床房
H38,2020-07-20,虽然对设施老旧有心理预期，但走廊、房间霉味比较重，床品质量差、床褥潮湿、霉味重，沙发上的脏污痕迹比较重，没敢去坐。有损**的品牌。外部环境可以，中餐厅干净卫生、味道也可以，懒得开车出去、在这里连续吃了两天。海边的长桥晚上夕阳很美，沙滩很小，但胜在人少、水质干净透彻，随便带孩子玩玩沙子、水，也还可以。,豪华山景双床房
H38,2020-07-21,早餐很丰富不错,豪华山景大床房
H38,2020-07-21,太旧了，房间设施都坏了,豪华山景大床房
H38,2020-07-21,设施老旧，该俢修了,豪华山景大床房
H38,2020-07-21,这家酒店有一些历史了，走廊感觉有点旧，灯光偏暗了，房间整体还算可以，和市区的**还是有区别的，不过卫生间足够大，床品也还算干净舒适，大环境还是不错的，适合带孩子过来、疫情关系泳池没开放，有点遗憾没能去泳池游泳,豪华山景双床房
H38,2020-07-21,酒店有点旧了，房间内设施都比较老。院里的很多设施都不开放了，状态也不是很好。自助早餐中规中矩，但是159显得略贵。酒店自带有海滩，还是挺适合休闲娱乐的。位置比较偏，自己不开车的话会不太方便。,豪华海景大床房
H38,2020-07-21,酒店环境、位置都不错，但设施确实太陈旧了，尤其是空调设备，噪音大，制冷效果也不好，让人切夜难眠，还有前台的服务效率出奇的低，办入住时等了半小时，办退房也等了二十分钟，而且都是在前面只有不超过客人在排队的前提下，这次应该是我入住这么多次以来体验最差的一次了,豪华海景双床房
H38,2020-07-22,輕鬆聆聽海浪聲。欣賞夕陽。,豪华海景双床房
H38,2020-07-22,酒店配置是五星的，大堂设计风格都比较有特色，海滨酒店风格明显，就是有些年头，设施和房间都看得出来年纪啦。,豪华山景双床房
H38,2020-07-22,第二次入住，带着孩子父母。环境不再过多评论，很适合带孩子。但服务，就真的很差劲。预订的时候备注了要婴儿床，入住的时候又提了一次，结果带孩子玩了一圈回来婴儿床仍然没有到位，左催右催总算是送来了，告知我们只有床，没有任何婴儿床品。与酒店交涉，得到的结果是半小时后没有任何答复，又再次追问过去，又过了十几分钟才有值班经理来处理，说给我们一个成年人被子和成人枕头。然鹅，这时候一岁半的孩子已经睡着了。,豪华山景大床房
H38,2020-07-23,酒店环境舒适绿化葱笼，早餐一般，泳池救生员时刻在岗态度友善值得一赞，美中不足去海边太陡跷,豪华海景双床房
H38,2020-07-23,非常适合家庭乐,豪华海景双床房
H38,2020-07-23,很好，环境清静，周边食饭也方便,豪华海景大床房
H38,2020-07-23,服务态度很差！1000块钱的酒店环境也很差，里面的东西也不好！沙滩和游泳池晚上都不能游泳的！差评！,豪华海景双床房
H38,2020-07-23,设施比较破旧,豪华山景双床房
H38,2020-07-23,很多非常好,豪华海景双床房
H38,2020-07-25,早餐种类选择不多但是味道挺不错的。工作人员的服务比较热情，会耐心解答疑问，办理入住和退房也很快。泳池水质较好，早上比较多人一点。周边环境和房间环境较为安静，只是隔音有点差,豪华海景大床房
H38,2020-07-27,房间大，干净，人气很旺。早餐很丰富,豪华山景双床房
H38,2020-07-27,酒店很安静，有自家沙滩，室外室内都有泳池，也有健身房，感觉很棒，下次还来，也推介给朋友，很不错，泳池水很干净，体验很好。,豪华山景双床房
H38,2020-07-27,工作人员的培训不到位，服务意识不好，没有5星酒店体验，设施很旧。,豪华山景双床房
H38,2020-07-28,一间已经荒凉了的五星级酒店，没人管理，到处都找不到人，沙滩脏脏，沙子脏，一看就是没人管理，泳池也荒凉的样子，早餐没东西吃，食材不新鲜，但价格非常昂贵，价格就是五星级酒店，入住的设施全是陈旧，无人管理的酒店，一进去的大堂都是黑乎乎的，总之，就是一家荒凉的酒店，不值得入住,豪华山景双床房
H38,2020-07-29,看到很多差评，其实不是很想订的，但是在巽寮湾的五星酒店里只有这个酒店才有私人沙滩，所以最后还是订这儿了。是因为期待没有那么大所以反而觉得好吗？？哈哈！反正我和老公，还有孩子都挺满意的。虽然已经有些年头的设施有点旧，但是打扰的很干净，入住退房很顺利，服务到位。最主要的还是地理位置吧！因为单独一个酒店在那个沙滩面临，所以周边环境很安静，整天能看到的景色真的很美。日出，蓝天空，云彩，日落……可以忘记城市的喧噪。可能是因为前一天住了富力湾的希尔顿，那儿人太多各个方面没满意，所以更是觉得这儿挺不错的。,豪华山景大床房
H38,2020-07-29,环境很好。很久的老酒店了，需要更新设施,豪华山景双床房
H38,2020-07-29,房间卫生堪忧，龟速退房,豪华山景双床房
H38,2020-07-30,酒店的环境非常好，外面就是大海，在海边吹吹风挺好的。有一点不太满意，最后一天早晨要赶火车，走的早，没有来得及去吃早餐，想打包带点路上吃，前台不情不愿的给了两个破的餐盒，只能装几个包子，想打点儿粥都不行。里边的小姑娘服务员想给我带点牛奶，跟前台要餐盒，人家就是不给。这点不太满意，毕竟早餐我是交了钱的。,豪华海景双床房
H38,2020-07-30,我这么多年，酒店0投诉，这次不得不有感而发：1、酒店卫生实在太差，地板是滑溜溜的；洗澡后水会透过玻璃漏到坐厕位置；枕头被褥几乎可以肯定没换过；空调一股发霉味道，太多，不能一一列举；2、因遗漏了证件在前台，离开后多次联系总机客服，工号04218（不知真假）态度实在太差，连续追问才问到04218工号，不知为何**有这种素质的客服，感觉这几年**一直在走下坡，无论装修、服务、基本设施、人员素质，好像连一个7天、如家都不如。各种搪塞、拖延，以后估计不会再选择国内的**。,豪华海景双床房
H38,2020-07-30,环境好，中餐厅也不贵。,豪华海景双床房
H38,2020-07-31,还有很多游乐没开,豪华海景双床房
H38,2020-07-31,酒店豪华舒适，吃住不用操心,豪华山景双床房
H38,2020-07-31,良。,豪华山景双床房
H38,2020-07-31,很好！早餐丰富，游泳池也很好！空气好！下次还来！带家人朋友来度假，还不错的！周边吃饭很有地方特色！值得分享,豪华山景双床房
H38,2020-07-31,我很好！早餐丰富，游泳池也很好！空气好！下次还来！带家人朋友来度假，还不错的！周边吃饭很有地方特色！值得分享,豪华山景双床房
H38,2020-07-31,很好！早餐丰富，游泳池也很好！空气好！下次还来！带家人朋友来度假，还不错的！周边吃饭很有地方特色！值得分享,豪华海景双床房
H38,2020-07-31,高端酒店的气息犹存，但房间装修还是老化了，与**品牌以及1480一晚的豪华海景房价还是存在些许差距，请酒店方重视，如果价格在1000左右我觉得相符，毕竟酒店已经10年了。,豪华海景双床房
H38,2020-08-01,很好(??)很好(??)几乎完美,豪华山景大床房
H38,2020-08-02,早餐可以，比较安静,豪华山景大床房
