酒店名称,评论日期,评论内容,入住房型
H38,2020-08-02,有点旧，有私家海滩,豪华山景双床房
H38,2020-08-02,酒店位置很好，有私家海滩,豪华山景双床房
H38,2020-08-02,很好，宝宝很喜欢,豪华山景双床房
H38,2020-08-03,位置不错！设施有点陈旧了，游乐场拓展收费贵，100元一次，其他还可以。如果有时间还会再去！房间还是很不错了。,豪华山景大床房
H38,2020-08-03,房间太老旧，散发出来霉味。外部环境挺好，如果不讲求吃住那就可以。,豪华山景双床房
H38,2020-08-04,早餐丰富，停车方便,豪华海景双床房
H38,2020-08-04,酒店好破旧！根本不符合5星酒店的标准。进到房间一股霉味。要求换房后味道还是会有。窗帘脏兮兮的。床褥可能用的时间久了有点塌。特别不舒服。房间内过设施过时。没什么好说的。这酒店就一个字：破！十分不建议大家入住！,豪华海景双床房
H38,2020-08-04,早餐很好，环境不错??， 有点下雨浪太大，所以没有下海，小区有室内游泳池，????，也有室外游泳池，还有儿童乐园,豪华山景双床房
H38,2020-08-05,房间很大 很舒服 海挺美,豪华山景双床房
H38,2020-08-05,环境不错适合度假，房间老旧，海滩惨不忍睹,豪华山景双床房
H38,2020-08-06,早餐一般，服务一般。,豪华山景双床房
H38,2020-08-07,毕竟是老牌,豪华山景大床房
H38,2020-08-08,设置太过于陈旧，洗脸台下不了，锈迹明显,豪华海景大床房
H38,2020-08-08,早餐还可以，有停车位。,豪华山景双床房
H38,2020-08-09,环境还可以就是装修老旧了,豪华山景大床房
H38,2020-08-09,酒店房间设施旧了……，体验没别的**好！疫情导致萧条了,豪华山景双床房
H38,2020-08-09,酒店比较久了。房间水龙头坏的，没有浴袍，别的房间有，是差别对待吗？办理入住等了半天，退房也等了半天。早餐品种一般，带着七岁的儿子，加了钱，娱乐设备除了健身房，其他没开门。没有地下停车场，都是地面，车晒得要死。一句话，让我记住，下次不订这间酒店。,豪华山景大床房
H38,2020-08-10,设施已经老旧一些,豪华山景双床房
H38,2020-08-10,环境不错，设施老旧，还行吧,豪华海景双床房
H38,2020-08-10,环境一流的，值,豪华山景双床房
H38,2020-08-10,环境不错，设施陈旧！,豪华海景双床房
H38,2020-08-10,客户很满意，继续努力！,豪华海景大床房
H38,2020-08-10,环境不错，设施有点旧，其它还行,豪华山景双床房
H38,2020-08-10,酒店设施太简陋了，根本达不到一个五星的标准，也就一个三星而已。周围环境不错，海滩还算干净。室外游泳池也只开放一个，可以玩的不多。,豪华山景双床房
H38,2020-08-10,几个如弹丸般大小的泳池是硬伤，唯一能水中游乐的场所还要收费100元，第二晚果断换到了旁边的嘉华酒店,豪华海景双床房
H38,2020-08-10,酒店位置不错，沙滩也美，就是有点旧，服务水平也落后了,豪华山景双床房
H38,2020-08-11,有自己的沙滩，非常安静,豪华山景双床房
H38,2020-08-11,老牌酒店，各方面都过得去。,豪华海景双床房
H38,2020-08-11,隔离房间客人太吵，影响休息，投诉三次酒店处理不成功，投诉第四次才换房，己是零时1点多，严重影响我的休息时间,豪华山景大床房
H38,2020-08-11,物不所值，差,豪华山景双床房
H38,2020-08-11,酒店比较老，花园一半没开，环境不错！,豪华山景双床房
H38,2020-08-12,真的很不错，推荐,豪华山景大床房
H38,2020-08-13,早餐的质量还是不错的。酒店的自然环境还是不错的，沙滩还可以就是沙子有点粗。但是就是硬件已经比较陈旧，如果能够番新一下，还是不错的。,豪华山景双床房
H38,2020-08-13,酒店已经开业差不多12年了，但是设施还保持的不错！早餐自助餐中规中矩吧！基本中西口味的餐点都有了！另外如果订海景房，建议一定要求订1号楼、而且最好是7楼，那边的海景更棒！,豪华山景双床房
H38,2020-08-13,太老了，晚上空调吵的无法入睡，服务态度很好！但是硬件太差，全差评！,豪华山景大床房
H38,2020-08-13,一家四口一起来住了2晚最合适。室内外泳池，儿童天地应有尽有。合适带小孩出行的家庭，挺舒服。,豪华海景双床房
H38,2020-08-13,人不多，挺舒服的，就是自助早餐的出品比较差,豪华山景双床房
H38,2020-08-14,酒店设施旧了些，不过很整洁卫生，餐厅选择少，食物品种也很少。儿童玩水泳池不错。,豪华山景双床房
H38,2020-08-14,挺不错的。有三亚的感觉,豪华山景双床房
H38,2020-08-14,优点：1.海景房风景很好，非常美。2.房间宽敞，有个大阳台。3.服务员谈不上很热情，但很礼貌。4.酒店环境不错，适合散步。缺点：1.房间设施明显老化，淋浴头的后盖掉了，淋浴间玻璃门塑胶封条上下脱落，导致关不上门，水会撒出去，加上洗手间的地板本身无防滑设计，撒上水以后很容易滑倒，非常非常危险。房间内有一个灯泡是坏的，窗帘也脱线了。2.早餐可以用寒酸来形容了，找不到好吃的，每天基本都一样，无非是把培根换成鸡翅（唯一的肉类，而且跟肯德基的奥尔良烤翅味道一模一样，一大早上吃肯德基，很有想法的厨师）中餐厅很小，菜式很少。西餐厅没吃，感觉也不怎么样，顺带一提，餐厅的沙发都塌了……3.酒店的床睡得浑身发痒。肥皂贼滑，洗都洗不掉。4.沙滩一般般，硬，硌脚。5.位置很糟糕，买东西要开车到镇上，不开车根本出不了酒店。总体来说还行吧，但是餐饮真的是劝退，尤其是那早餐，大厨感觉是kfc出身。,豪华山景大床房
H38,2020-08-14,本来看了好多差评都犹豫要不要订了，老公说大品牌，他一直信任**，就订了。果然没让人失望，房间大，整洁，有私家沙滩，泳池，人不多，一家人玩得超爽。对了，采粤轩的菜品真是赞极了。这就是星级酒店的大环境大配套。满意。已经约了一大家人下次来。,豪华山景大床房
H38,2020-08-14,早餐还可以吧，整体风格不错,豪华山景双床房
H38,2020-08-15,环境舒服??,豪华山景双床房
H38,2020-08-15,差，游水池小的可怜,豪华海景大床房
H38,2020-08-15,朋友推荐说这里比较清静才选择带孩子来，订了两晚海景套房，感觉不怎么值，除了**这个牌子，设施真心不敢恭维。早餐一般，味道还行，只是158一位菜品就这点也不做过多评价。不知是不是周末原因，退房处没人问津，门口两辆大巴堵的死死的，一辆自己的接送车又把另一边堵掉，工作人员也不过问。简直毁掉了我对**这个所谓五星级酒店的一切好感。后期再来不会再选择这了。,行政套房
H38,2020-08-15,设施：有点旧，浴室挂花洒的地方坏了，厕所排水和抽风较差，晚上洗完澡，第二天厕所地面依然湿漉漉的。卫生：还过得去。早餐：五星价位，三星水平。首先说价格，我定的房间含两早餐，分别问了前台和餐厅，答复是加一位158元，住客没有优惠。事实上公众号的早餐优惠价是100元。经我质问，最后按100元收，但感受真的不好！其次说水平，品种少且差。鲜奶是兑水的，酸奶倒一个大盆里，需要的自己拿碗用勺子装。两个咖啡机，一个显示缺水，一个显示需清洗。煎蛋是提前煎一堆放那，拿的时候是冷的。总共9个热菜盆，分别是炒面、炒饭、芋头、番薯、花生、叉烧包、糯米鸡，这已经占了7个位置，剩下两个位置忘记是什么，连青菜都没有，这么算其实就是没热菜。现煮面条那里只有青菜，连个丸子搭配都没有。这水平跟三星的差不多。,豪华山景双床房
H38,2020-08-16,楼层给的不够高，海景不是很好，但是除此之外其他的都很不错，干净宽敞，海边的灯塔挺有特色,豪华海景双床房
H38,2020-08-16,酒店旧！服务一贯的好！暑假期间周末满住！,豪华山景双床房
H38,2020-08-16,作为**来说，这家酒店很一般，订的是海景房，房间小（卫生间大），设施陈旧，温泉不开，泳池只开放了儿童池和室内池，特别糟糕的是，来巽寮湾是来看海玩沙的啊，可酒店自带的沙滩，那不是沙子，是沙砾是小石子，粗的可以做脚底按摩，浪一来，只剩下裸露的地面，连三角岛码头的野生沙滩都比不上……所以，我花钱来这里干啥的？泡你家这个园里的0.5米深的儿童泳池的吗？简直了！,豪华海景双床房
H38,2020-08-16,设施陈旧不堪，房间门很难开，房间走廊像2000年代那时候的昏暗，浴缸老化叫人上来修才能用，服务态度不好，去游泳池的时候告知要带泳帽才能下去但我们没泳帽，游泳池距离商店购买泳帽有点远后来就无游了。但是那个工作人员在那里笑给人态度非常之不友好，酒店有个地方非常恐怖就是酒店自己的天后宫夜晚我们两个人过去行一下结果回到房间睡不着发噩梦，太恐怖啦，环境还是不错的靠海边，但服务和设施真的需要提高下不然对不起这个价格,豪华山景大床房
H38,2020-08-17,早餐不错，停车还算方便，适合带孩子。到店免费升级了海景套房。海滩人不算多，还比较满意。环境比较安静。,豪华海景双床房
H38,2020-08-17,巽寮湾这个地方我这辈子不会再来了，广州出发单程6个小时，堵的一塌糊涂。完全丧失任何度假的好心情。周边混乱不堪，跟去了菲律宾一样。沙滩的沙子黄豆那么大，酒店对望出去还几个大烟囱。酒店一般般，收费可是不便宜，1600一间起步，比起很多度假酒店差太远了。,豪华山景大床房
H38,2020-08-17,真的挺伤心的，一间国际连锁酒店居然变成这样，大家千万千万三思,豪华山景大床房
H38,2020-08-17,不错，玩得很开心,豪华海景大床房
H38,2020-08-18,服务超级爆,豪华山景双床房
H38,2020-08-18,有些设施比如垃圾桶年久失修,豪华海景双床房
H38,2020-08-18,服务和设施都比之前差多了，实在没有五星,豪华山景双床房
H38,2020-08-18,翻看我上一个评论吧,豪华海景双床房
H38,2020-08-18,第一天淋浴房积水，第二天遇到奇葩清洁卫生阿姨，立刻投诉，还好值班经理非常有礼貌，处理的非常OK！房子、设施老旧，地理位置带孩子来玩还是很不错的,豪华山景大床房
H38,2020-08-18,设施老旧，电视都是以前很小的那种，应该是最差的**了,豪华海景双床房
H38,2020-08-18,环境不错，沙滩沙子很细。,豪华山景大床房
H38,2020-08-19,五星级酒店 舒服 周到,豪华海景大床房
H38,2020-08-19,服务员态度热情，房间干净整洁。,豪华山景大床房
H38,2020-08-20,几年前去过很好的所以这次在选择他们但是很多设施都老化了。,豪华山景双床房
H38,2020-08-21,非常好，环境优美设施齐全，本来住双月湾，人多环境嘈杂，就看了个寂寞的海，酒店什么设施都没有台风一来，只能躲房间里！果断移至巽寮湾**，大爱！可惜只呆一天，下次再来。,豪华山景双床房
H38,2020-08-21,没有想象中好,豪华山景双床房
H38,2020-08-22,早餐还不错，房间很好不会潮湿。适合带孩子出游，有私家海滩，有室内室外多个不同用途的游泳池，有观海长廊。,豪华山景双床房
H38,2020-08-22,非常 滿意,豪华海景双床房
H38,2020-08-22,早餐绝对丰富,豪华山景大床房
H38,2020-08-22,和国内外同类相比，设施服务完备，但仍有改善空间,豪华山景双床房
H38,2020-08-22,用的艺龙酒店定的，比我朋友提前在携程订的还要便宜100多块，艺龙不错不错。酒店服务一般，设施家具配套老旧，提前来大姨妈了，也没有前台小卖部可以买到卫生巾，真的很恼火，还好同行小伙伴有带。酒店里有一个沙滩就还不错，乘海艇过去对面的三角洲岛了，来回接送费用是200，门票是一人1 00。总的体验一般般。,豪华海景大床房
H38,2020-08-23,周边环境优美。,豪华山景大床房
H38,2020-08-23,非常不错的,豪华山景大床房
H38,2020-08-23,巽寮湾的沙子比较粗，酒店硬件设备还可以毕竟也是**，其它的也没去体验。前台接待小哥哥小蔡挺好,豪华山景双床房
H38,2020-08-23,酒店比较大气，游泳池不错，门锁比较难开,豪华海景双床房
H38,2020-08-23,真的是我住过的**最差的一家，应该是时间太久的缘故，设施太破旧了，服务也很一般，我住过无数次各种五星级酒店，这的确是最差的一家，以后绝不会再入住。关键是价格还特别贵，周六入住那晚海景房居然1900多，真的太不值这个价格。,豪华海景双床房
H38,2020-08-24,觉得都还行吧！不错,豪华山景双床房
H38,2020-08-25,冲着**品牌去的，话说是五星，但房间简陋之极，给三星还嫌多，真是大失所望！自助早餐也是一言难尽！唯一优点就是有沙滩！,豪华山景双床房
H38,2020-08-25,非常糟糕的体验，三点多到的，等房间等到五点十五分，退房时我问可以两点退房吗？总机服务员回答的是“”你有听过谁告诉你可以两点退房吗，差评,豪华山景双床房
H38,2020-08-26,停车住客免费，床太小，带孩子不方便，房间有点小，除了有浴缸，没什么卖点，床品一般，但是干净的，早餐可以的，种类齐全，如果要付正价就不值了，有私人沙滩，沙比较粗糙，有室内外泳池和儿童娱乐休闲设施，没有试用，好像要钱的。酒店有个码头，黄昏很美，钓友可以自备工具钓鱼，酒店有提供的但收费。,豪华海景双床房
H38,2020-08-26,绝对没有辜负**这个品牌，舒适静逸，前台态度超好！有室外无边际泳池和室内恒温游泳池，从房间出来走出一楼电梯就是无敌园景，走几步就有新修的栈道适合拍照。酒店早餐品种不多，但味道挺好的。但房内设施太陈旧了，很多设备都是锈迹斑斑。场地开阔停车也很方便，只要有机会是必须要再次过来的！另外厕所的冲水按钮有点坏，按下冲水后不会复位一直在冲水挺浪费的。,豪华山景双床房
H38,2020-08-26,适合带孩子，安静，舒适，私家海滩。,豪华山景双床房
H38,2020-08-26,早餐太差了，服务跟不上。,豪华山景大床房
H38,2020-08-27,环境一般。,豪华海景双床房
H38,2020-08-27,设施非常完善,豪华海景大床房
H38,2020-08-27,环境优美，私人沙滩，私人游泳池！,豪华山景双床房
