景区名称,评论日期,评论内容,序号
A39,2016-10-29,值得一去，森林覆盖率很高，有些闷热,56098
A39,2016-10-19,自然环境特别好，无污染，原生态,56099
A39,2016-07-11,就在**景区旁边，不算十分大，但刺激滑道，造浪池等都有，小孩很喜欢去那里玩。个人觉得那个30米高的水滑道比较刺激好玩。,56100
A39,2016-09-15,交通不是很方便，人很多，特别是节假日,56101
A39,2016-05-02,是个值得一去的好地方，特别带小孩来！,56102
A39,2016-10-10,位置比较选，公园很大，开车需要很长的时间,56103
A39,2016-10-05,森林氧吧，门票贵了，设施一般般,56104
A39,2016-10-08,娱乐项目少，价格高，水浅，泳区小,56105
A39,2016-09-11,绿化不错，空气挺好的！就是交通要改善，在茂名市打出租车挺困难的！,56106
A39,2016-09-10,环境不错，适合过来走走散散步！,56107
A39,2016-08-31,人很多，适合一家人散散步，聊聊天的,56108
A39,2016-09-09,高大上的**公园真不错的样子好好,56109
A39,2016-08-19,门票便宜，有有植物园和动物园，动物园的品种比较多，还有动物标本博物馆,56110
A39,2016-07-31,晚饭后上去，空气很好，灯光不是很够，坡度很陡，估计白天上更好,56111
A39,2016-01-09,这个地方真的值得去躺，门票自己去买20元，你可以去旅行社购买，去国旅购买才13元。以**公园的可玩性，比很多著名景区好玩，空气和景色相当不错。里面玩的地方大人小孩都有。一家大小要玩一天才能把景点玩遍。 以正门进，一般往右边走，从儿童乐园玩起。里面的设施值得大人小孩去玩。,56112
A39,2015-12-11,勇敢者之路，还不错，里面的花草树木也好……………,56113
A39,2016-08-07,一般吧，去过3次了，茂名地区也就这样子了,56114
A39,2016-08-07,带小朋友去玩很开心，一直不肯走，就是项目太少了,56115
A39,2016-07-06,好玩，开心，涨知识。呵呵哒字不够,56116
A39,2016-06-22,可以区玩玩喔，带上老婆孩子一起去,56117
A39,2016-03-21,三十元的门票有走不完的公园，好值啊！还有动物看，也有机动游戏玩！我们在门口租了一辆电瓶车，边开边看，孩子很喜欢！,56118
A39,2016-05-02,**景区风景优美，景观靓丽，卫生环境好，珍贵稀动植物多，管理到位，服务好。,56119
A39,2016-06-15,本来门票才二十，加动物表演三十，干嘛要订一次那么麻烦呢,56120
A39,2016-06-09,很有内容的公园，儿子超喜欢来！,56121
A39,2016-06-13,十几元钱很直了，以后会还去的！,56122
A39,2016-01-08,里面的景点还是挺值得一去的，学校团队比拼去那里比赛，很多好玩的，很开心。,56123
A39,2016-01-28,公园环境优美，景色怡人，卫生好，空气清新，有着很多各种各样罕有珍贵国家保护级的动物与植物供人们欣赏。,56124
A39,2016-03-16,有的玩有动物有娱乐，非常适合一家大小前去游玩的好地方,56125
A39,2016-05-03,景色优美，门票实惠，环境卫生管理好，游戏项目较多，罕有植物多种供欣赏，动物类种类繁多，令人满意。,56126
A39,2015-08-26,很好玩，那的动物非常可爱，还有各种各样的美食，非常丰富，风景十分优美，人山人海的，特别是那勇敢之路，超好玩，那熊猫萌萌哒的，可惜没有海豚，，，但我相信**公园一定会发达的，一定还会看见许多稀罕的动物。。给**公园一个赞吧希望更多游客去到那。。么么哒！,56127
A39,2015-10-21,去哪儿门票果然比较优惠，有点后悔了。**公园很不错，各种植物很多，面积挺大的，还有各种动物，正好是周末去，游客比较多，很是热闹。如果大家喜欢安静些的话最好是避开周末和旺季，很不错的景点，门票也不算贵，值得来一趟,56128
A39,2016-04-24,挺有意思的咯，里面有点大，走得有点累。。,56129
A39,2016-02-27,还不错。。可以一去。。风景是可以的。。,56130
A39,2016-02-25,风景很好 空气清新  小朋友很喜欢看动物  还有跑跑卡丁车,56131
A39,2016-03-28,好玩，东西好多，太好玩了，下次一定要再来玩才行,56132
A39,2016-04-13,总体来讲一般般，当然无法和一线城市动物园来比。,56133
A39,2016-02-10,不错，风景好，又大又好玩，喜欢,56134
A39,2016-04-08,不错 小孩都喜欢 停车场不太好 其他的都不错,56135
A39,2016-03-25,和几个孩子去**公园玩，孩子们都很开心板了！大家都玩得乐不思蜀，不肯回家了！,56136
A39,2016-03-15,门票平宜，散步，休闲，看动物，,56137
A39,2016-01-29,带上小朋友确实有趣，是夏天值得一游的好地方，人虽然多但风景依然美丽,56138
A39,2016-02-01,这里不错，空气清新，环境优美。,56139
A39,2016-03-20,好好好好好好好好好好好好好好好,56140
A39,2016-03-12,经过全新的升级后，里面的环境的确比以前好很多,56141
A39,2016-03-04,景色不错，但动物少了点，服务一般。,56142
A39,2016-03-07,带孩子去玩比较不错，不过不要节假日去。,56143
A39,2016-03-03,小孩子的最爱，有表演看，可以租电瓶车游园，拓展运动最喜欢,56144
A39,2015-10-18,带着孩子去看动物，是不错的选择哦！值得一游，,56145
A39,2016-03-01,非常good的地方，欢迎大家有空多走走，值得一去之地！,56146
A39,2016-02-12,动物园与植物园相结合，还可自助烧烤。,56147
A39,2016-02-29,挺好玩的，下次带女朋友去逛逛，给个满月,56148
A39,2016-02-18,之前和小孩去，没什么好玩的，感觉没有报纸啊广告上吹的好,56149
A39,2016-02-24,**景区总体不错，性价比超高。比较适合小孩子玩,56150
A39,2016-02-11,挺好的，挺舒服，放松一下，身心。,56151
A39,2016-02-08,挺好的，风景优美，树林阴翳，好,56152
A39,2016-02-06,挑战很好。还有动物看，小孩喜欢，空气好。,56153
A39,2016-02-08,那里值得去，又好玩，风景好好看看。,56154
A39,2015-12-25,这里真的很好玩，每次我都不会放过这里。不信，你试过就知道了。,56155
A39,2016-02-05,很好玩，坐车也很方便，小朋友很喜欢,56156
A39,2016-01-08,还不错吧。适合小朋友们去玩。摩天轮锈迹斑斑 、鬼屋太无语。卫生真的不敢恭维。,56157
A39,2016-02-04,地方有点远。不过还是很高兴的 下次还会去,56158
A39,2016-01-19,很值得一游，空气清新，环境优美，噪音小，适合放松心情，陶冶情操，乃郊游佳境。,56159
A39,2016-02-03,还不错，适合一家人或者朋友去放松,56160
A39,2015-12-22,第一次過去森林公園，很大玩了差不多一天。植被很多，休閒娛樂都有，適合一家去玩,56161
A39,2015-11-04,好，很好。。非常非常好好，很好。。非常非常好好，很好。。非常非常好,56162
A39,2016-01-02,里面的动物都很可爱，迷宫也很具有挑战性，特别是动物表演，希望**公园越办越好。小孩子很喜欢。,56163
A39,2015-09-16,真想茂名还有个**公园，真的太美了，就是去的时候公路烂了点,56164
A39,2015-11-05,對於是自己本土的旅遊景點！就算差也要說成好的！,56165
A39,2015-10-31,挺好玩的，是我去去所去的景点中觉得挺好玩的，值得去玩玩。,56166
A39,2015-12-18,环境不错，儿童娱乐设备丰富，小朋友很喜欢。,56167
A39,2015-12-02,很好，很多东西玩，里面有很多动物，还是不错的,56168
A39,2015-12-03,非常棒的旅游点，空气好，景点行车方便，住宿，饮食都顺利。点赞,56169
A39,2015-11-24,还可以，门票不贵，适合一家大小去玩。。。,56170
A39,2015-10-18,特别适合一家老小出游，既可观景亦增见识还能娱乐,56171
A39,2015-10-28,里面绿化很好，环境很好，让人心情很舒服。,56172
A39,2015-11-01,公园保护得比较好，而且动物都好多，公园够大，儿童游玩的地方也比较多。满意。,56173
A39,2015-10-31,门票10-15元，可以逛上一整天。勇者之路每次必玩，还有些其他的游乐设施。,56174
A39,2015-07-21,在这里玩的很开心，是勇敢者之路，铁索桥，迷宫，，，，，，各种好玩的，还有景点也很美，是一次值得的旅行。,56175
A39,2015-10-27,休闲娱乐的地方，环境，交通都是还可以吧！,56176
A39,2015-10-16,感觉不错，每次出差都会经常去的，带上家人，带上你的爱，去享受吧！,56177
A39,2015-10-03,动物品种挺多，休闲娱乐都可以，很合适和家人朋友去玩,56178
A39,2015-09-07,适合亲子游，景色不错，还有小动物看，小朋友很欢乐啊,56179
A39,2015-09-04,里面能玩儿的地方挺多的，还有游乐场和动物园，一家人一起来挺好的，还能看个动物表演，挺开心。,56180
A39,2015-09-11,这里可以说空气真的很好，风景也很漂亮。如果能住这里面你的肺绝对干净无污染。,56181
A39,2021-02-16,很适合一家老小，环境不错,56182
A39,2020-08-05,还不错的一个地方 里面看的东西蛮多的 挺划算的,56183
