景区名称,评论日期,评论内容,序号
A42,2016-01-02,比较偏僻的地方，风景还不错，幽静，可是酒店服务水平奇低，设施比较旧，房间设备很不够人性化考虑，唯一有私家池的鸣春谷围栏都是破破烂烂的，服务和硬件都远远值不上这个价钱，希望去找专业培训酒店员工的公司进行长期培训,56984
A42,2016-04-12,到前台取钱非常方便，价钱也便宜很多小孩跟大人玩的开心,56985
A42,2016-03-30,不错，取票方便又便宜，下次再来！,56986
A42,2016-01-20,兑换很方便，人也不算很多，就是面积小了些，设施再多一些就好了,56987
A42,2016-03-28,较本地旅行社订票还便宜，直接到前台验证就可以了，满意好评！,56988
A42,2016-03-21,环境不错，设施完备，值得一去。,56989
A42,2016-03-23,感觉还不错，不过人家在支付宝订的才72，,56990
A42,2015-10-26,不错。里面的员工服务超级好，到处设有饮水机。各种功效的温泉池。唯一不足的是好多不开放了,56991
A42,2016-03-07,不错，不错，不过缺少些其他节目,56992
A42,2016-03-06,非常放松的心情，泡完很好睡,56993
A42,2016-03-03,景点值得再去，风景悠闲，是享受生活的好去处。,56994
A42,2016-03-03,环境好:，园内有各种小吃，玩得非常开心,56995
A42,2016-03-01,不错，水很干净。就是被蚊子咬了好多块,56996
A42,2016-03-01,很好玩，下次还会来。露天温泉暖暖哒,56997
A42,2016-02-24,不错，就是地热床当时没开，有点遗憾，绝对会再去,56998
A42,2016-02-29,环境舒服，装修风格不错。,56999
A42,2016-03-01,非常好，又实惠，取票超级方便！,57000
A42,2016-02-24,取票蛮方便的 便宜了好几十块,57001
A42,2015-12-12,这个温泉在茂名算很不错了！温泉池多舒适。度假也是不错的,57002
A42,2016-02-20,选错日期了，下雨呢，要不玩的更开心了,57003
A42,2016-02-23,还行，游玩的项目太少，只能泡,57004
A42,2016-02-20,市区去那里挺远的，不过挺值得的,57005
A42,2016-01-02,主要卖点是温泉，各种类型温泉池都有，数量也较多。同时还配备酒店，一般入住酒店送不限次温泉。也有饭店。这样吃住玩都可以搞定，周报自然环境比较原生态，短期度假好去处。,57006
A42,2016-02-16,不错，便宜，有保障，靠谱，,57007
A42,2016-02-15,"服务员态度很好很礼貌,环境优美,温泉类型多,泡得很舒服全身都舒畅！还有其他疗……",57008
A42,2016-02-16,服务满意，交通方便，环境不错,57009
A42,2016-02-15,小孩子很喜欢，不错，鱼池也还可以,57010
A42,2016-02-13,总体还可以。那地方第一次去有点难找。,57011
A42,2016-02-11,环境不错！就是换票有点慢,57012
A42,2015-10-15,里面鱼疗池需要另外收费，服务态度跟不上，一开始还不让进，说没有预约，紧急人工服务才处理好，不是很爽吧,57013
A42,2016-02-07,人很少水很干净，地热板和矿沙池很有特色，就是服务有待提高。,57014
A42,2016-02-11,不错！！！！！！？？,57015
A42,2016-01-25,大冬天去很舒服，人少时还挺自在，有姜汤,57016
A42,2016-01-25,一如既往的好。温泉水是真温泉。,57017
A42,2016-02-11,用二维码进去很方便，不用取票。就是里面温泉很多池子都不开放。。。,57018
A42,2016-01-23,玩得比较开心。服务也不错！继续保持,57019
A42,2016-03-15,环境很好，舒适，挺适合一家人去。,57020
A42,2016-01-17,贵了点，配套设施还是单调了些。,57021
A42,2016-01-17,不错，泡的很舒服。就是缺少了点节目,57022
A42,2016-02-14,一点都不好玩，水不是太烫就是冷的，里面全是脏东西没人清理,57023
A42,2016-02-14,破破旧旧，展示的温度一点都不对，烫的烫死人，否则满满的居然是冷水！,57024
A42,2016-01-17,还是可以的温泉，只是预定需要一个小时才能入圆，效率慢了点,57025
A42,2016-01-07,取票方便，服务较好，配套设施一般,57026
A42,2016-01-13,很不错的一次泡温泉，感觉很好。,57027
A42,2016-02-24,很好，不错，值得去玩，但人少的时候感觉水不太干净,57028
A42,2016-03-04,环境几好，我去的时候比较少人，几干净，无咩玩，去了1小时就走了,57029
A42,2016-03-03,温泉酒店环境不错，不少小池，还有游泳池，泡的时候还有姜水喝，附近还可以爬山打cs，挺好的！,57030
A42,2016-01-04,不错的温泉，环境好，服务也很好,57031
A42,2016-01-04,玩得挺开心，服务态度也很好，池子多,57032
A42,2015-12-31,方便快捷环境挺不错的,57033
A42,2015-12-31,方便，即买即出二维码！,57034
A42,2015-12-27,现在感觉人有点少了，还有以前说好的免费番薯去哪儿了？,57035
A42,2015-12-22,买的东西便宜，靠谱。服务态度很好值得信赖购物网点,57036
A42,2015-12-26,非常不错的一次休闲度假，五星值得一去,57037
A42,2015-12-24,还不错，就是周末有点小贵,57038
A42,2016-02-13,很美很好，这是就我家乡的美景，,57039
A42,2016-02-09,景色很美，温泉真的没话说，没想到在茂名也能泡到正宗的温泉,57040
A42,2015-12-21,不错，很方便，很好玩,57041
A42,2016-02-05,这个环境一流，温泉天然泉水。服务周到！还会再来的,57042
A42,2015-12-18,还不错，服务挺好的，环境也好。,57043
A42,2015-12-26,还可以，不错，只是很多设施没开，没体验到，不爽！,57044
A42,2015-12-17,还不错，玩得很开心，,57045
A42,2015-11-29,5分，在那里一边泡温泉，一边看石山，情人的好去处,57046
A42,2015-11-29,很方便，提前预定，去到就可以办理。,57047
A42,2015-12-10,坏境不错，温泉池很多,57048
A42,2015-11-29,价格优惠，方式便捷，办理时间短。,57049
A42,2016-01-14,温泉环境确实不错，是个休闲的好地方！,57050
A42,2015-11-26,很多人，里面还可以免费喝姜茶。,57051
A42,2015-12-06,感觉不错，但人不多，服务员也不多，温泉区离换衣服的地方有点远,57052
A42,2015-11-20,5分，很优惠，休闲，开心，服务好，下次再来,57053
A42,2015-12-05,茂名**设施好，里面有十几个药池和花他，沙坑、热地坑、蒸浴、冲浪等等，假日优闲享受好地方。,57054
A42,2016-01-12,取票方便，环境优美，服务一般般。,57055
A42,2015-09-11,茂名**温泉池多达40多个，分布在绿树林荫之中。南亚式洋楼及别墅都有独立温泉池，在大自然环境中尽情享受温泉浴，不愧为度做好去处。,57056
A42,2015-11-04,非常不错的温泉度假村，下次再去。,57057
A42,2015-11-01,凭名字就可以拿票，挺方便。,57058
A42,2015-12-22,环境很好，各种各样的室外温泉，感觉很舒服，很喜欢这里,57059
A42,2015-11-02,刚好天气有点冷，去泡温泉刚好，价钱比较划算！,57060
A42,2015-10-26,5分，泡得很舒服，回来很久，脚都一直暖暖的，水看起来也挺干净的。,57061
A42,2015-10-25,取票方便，服务态度好  ，价格便宜 ，玩得开心,57062
A42,2015-10-30,景色很美，最主要的是水很干净。,57063
A42,2015-10-20,很好玩，舒服，有机会还想去,57064
A42,2015-12-03,非常好的旅游度假之地，有机会再去，住，吃都非常方便。,57065
A42,2015-07-19,取票方便，快捷，便宜实惠,57066
A42,2015-09-07,环境好，幽静，适合周末三三两两去，渡假圣地，强烈推荐大家伙儿都来玩,57067
A42,2015-07-12,方便快捷，价格优惠！,57068
A42,2015-07-02,我去时不是时候。冬天或者好点吧。价格略高,57069
A42,2015-09-11,这里的温泉确实很一般，没有那些是天然温泉的地方好。价格有些贵,57070
A42,2015-05-06,太差了，很多地方不开。水脏的要死，下次都不会去了,57071
A42,2015-02-12,好多好玩的池都没开，总体还是不错,57072
A42,2015-03-29,靠近住的地方是个优势，设施一般，没有什么特色，水上乐园没开，玩不了。,57073
A42,2015-03-05,方便快捷！！！价格合理！！！,57074
A42,2015-03-12,无法证实是否是天然温泉了…,57075
A42,2015-02-15,环境不错，晚上更多人去,57076
A42,2015-02-02,还可以吧…去了好几次了…都是在网上订票的…,57077
