景区名称,评论日期,评论内容,序号
A42,2020-04-21,去哪儿网上订的票94.2一张，我们两个人。环境很好，温泉挺多的，有红酒池、牛奶池、中药池等，水温挺热的，特别喜欢的是鱼疗池和地热床，被小鱼咬得痒痒，酥酥麻麻哦。地热床躺上去就不想起来了，还可以敷青瓜面膜，但我们没敷到。现在好多还在建设，期待越来越好。,56781
A42,2020-12-23,**很好、玩了一天、有玩的、有节目。真心值得去玩。晚上人很多、更热闹，水很干净、环境好、水质好、不像那些水上乐园有一股消毒水的味道、温泉里没有什么异味、很好玩了一天、晚上十点才出来了。,56782
A42,2020-02-12,环境不错，出票非常快，房间宽敞，干净利落，温泉种类齐全，冷热适中，服务员态度非常好，新装修高大上了许多，会经常来的！,56783
A42,2020-05-24,垃圾，餐厅说是5点30分可以就餐，5点35分过来餐厅又说6点20。我问为什么办理入住手续时前台为何没告知，餐厅人员一句“不知道”，其实是接待一个什么团队就强制把我们的时间推迟到6点20分。,56784
A42,2020-12-10,前台办理的服务态度超差，特别是消费完出来后。跟消费前完全是两种态度，这是第一次去也是最后一次去了，宁愿去远点都不去**古,56785
A42,2020-04-02,曲径通幽处，盘石是路标。眼前疑无路，转角又洞天。五棱与奔驰，皆为泡温泉。贫富虽有别，养生却无异。若非自驾游，交通很不便。本人非富有，此地却重游。,56786
A42,2020-05-31,【景色】是茂名市最大的温泉度假村。有几十个小温泉，适合各种人群使用和需要。【趣味】来这里有免费小吃，也有许多供大家休息的地方，差不远有开水供应，你有绿豆水，姜汤等。,56787
A42,2020-04-05,小孩不小心弄丢了手环，赔偿100元，本身儿童也才50元，有点糟心。前台说，如果第二天阿姨清池时找到就退回100元，但是第二天微信问，说没找到。的确啊，谁吃进去的肉还会退出来？,56788
A42,2020-03-24,环境干净，服务态度很好，非常满意,56789
A42,2020-12-22,都很不错，环境，设施，服务。唯一要说的是提供的拖鞋都是客人随便穿的，有的真是太咸鱼了，不知道还以为是身处海边，简直咸到没朋友，主要是不卫生，拖鞋也没有提供小朋友的码数，一下子把温泉的逼格拉低一大截。建议是提供一次性拖鞋，大家都是山长水远来泡温泉，适当收费也是正常的。,56790
A42,2020-06-27,感觉还可以，可以带家人再去一次,56791
A42,2020-04-17,宝宝特别喜欢，能玩上一天，就是那天有点冷，下次还去,56792
A42,2020-05-03,第二次去，不错小孩大人都玩得开心,56793
A42,2020-07-04,不错。之前去玩的现在补评论，还是可以的。,56794
A42,2020-06-05,自助非常丰富，就住附近，一有时间就过去泡,56795
A42,2020-03-07,值得一去，从下午泡到晚上吃完饭才走。,56796
A42,2020-08-28,有点像唐代的风格，好多设师在建。,56797
A42,2020-03-23,很多好玩的项目，环境不错，配套齐全,56798
A42,2020-03-08,温泉水滑洗凝脂，趣味性强，温泉里的服务员小姐姐态度很好,56799
A42,2020-03-12,环境不错，前台服务超级好。非常热情。,56800
A42,2020-08-23,这里周围环境幽雅，自然风光得天独厚，**温泉采用100[%] 纯天然优质温泉水，令人留连忘返。餐厅充满农家风格、洋溢着乡土情调，地道的绿色菜肴、独具地**色的农家小炒，令人赞不绝口。豪华气派的多功能国 际会议中心可同时容纳300多人就座，令人记忆犹新。,56801
A42,2020-02-22,环境优美，前台接待服务态度热情,56802
A42,2020-03-02,泡泡更健康，我个人感觉还可以，就是交通不怎么方便，,56803
A42,2020-02-25,还不错，玩的非常开心，下次还会去,56804
A42,2020-01-16,很棒，环境好，温泉炒鸡舒服，西餐也好吃，下图是西餐厅,56805
A42,2020-02-15,还不错哦*****。就是感觉小了点****,56806
A42,2020-03-11,首先我被评论所影响，差点就改去其它地方。体验后想写详细点，让后人参考。我只吃午餐和泡温泉，星期五中午到大厅，人不多，出示验证码，温泉手牌很快就弄好，但餐券就弄了有些时间，因中途有电话来订房打断并优先处理对方，这点我还能忍，从前台的服务来说不算专业，没有那种积极的服务精神，但礼貌程度还不错。午餐：看菜单以为是西餐，但是偏中式，是炒的。味道还过得去，配上白饭就挺饱，两三只苍蝇总是飞来飞去。温泉：更衣室很大，设备足，柜子不臭。温泉水质不错，普通温泉的水能清晰见底，无杂质，功能温泉因有中药，水质还是能见底，杂质少。进去泡第一个池时，服务员阿姨见我们来就主动倒姜茶给我们，我们也礼貌的谢谢。里面服务员不多，园子很大，毛巾在柜子里，柜子也挺多的。当时园子里的客人可能50人左右，比较少。总结，值得一去，但要避开假日人流多的时候会比较好。,56807
A42,2020-07-29,看评价说态度不好意思，第一次去有点忐忑，去的时侯是网上顺风车，从茂名站去六十多，感觉路上郊区，开车一个小时左右进去，地方偏僻，门口没有什么车搭，基本自驾游多，前台办理入住顺便问服务员有没有出租车，热心介绍当地司机，留了号码，总体服务都很好。泡温泉时，有服务人员递送罗汉果水，随时有干毛巾用，还提供免费花生绿豆汤，温泉池有养生池，有当归，杜仲等中药包的升阳固本池，有三味汤（人参，芦荟，当归）三个小池，此外还有红酒池，熏衣草池，茶池等，冷热水池组成冰火两重天，蒸桑拿房，儿童游戏的海贼王船，滑梯为主戏水池，因装修，有些场地不开放，像艾草池，地热床我都没体验，刺激的大滑梯也没开放，因施工地板有泥巴……洗澡换衣服处服务很好，还有脱水机帮泳衣脱水，有工作人员递水给我，让我感觉服务态度挺好的，可能提高服务水平了吧！除了一点小插曲要不然会是完美的旅行，午夜一点多居然停电，七月夏天不开空调不行，开阳台推拉门外面也没风还有蚊子飞进来，索性不开阳台窗，屋里一片漆黑，备用照明灯也没有，房间电话也没电打不了服务总台，用自己的手机拨打电话也不通，房间走廊没有人员，周围住宿也没有人出来看情况，要不是怕留我和小孩不安全，老公就去总台找服务员……周围荒山野岭，又不知什么时候来电，房间又热又缺氧，担心害怕好久，终于最后两点多来电，老公说下次再不来这了,56808
A42,2020-02-07,服务挺好的！！！！！！！！！,56809
A42,2020-02-04,很好，一家人玩的很开心，下次再来！,56810
A42,2020-12-06,完全改变以往风格，值得去，服务态度很好,56811
A42,2020-01-23,环境很好，已经来了很多次了。五星推荐！！,56812
A42,2020-01-02,票价又涨了这么多，几个大池都没开，划不来，下次去阳江或者阳西。千万不要来,56813
A42,2020-01-31,古色古香，可以的！有特色，可以体验。,56814
A42,2020-01-22,环境很好，服务态度也很好，下次再会来,56815
A42,2020-01-21,服务态度很好，非常满意，下次还会光顾,56816
A42,2020-01-21,很好的温泉度假之地，环境舒适。服务周到,56817
A42,2020-01-15,不错很好玩，值得去看看，放松心情,56818
A42,2020-01-20,既有东南亚风情设计，也有古代园林设计，最特别有一个中央戏台，很赞！,56819
A42,2020-08-27,去好几次了，感觉非常棒。每次来都是下雨天。非常舒服。,56820
A42,2020-01-20,装修一新的温泉，有一个很大的中央泡池，还有小朋友喜欢的儿童区域，超赞，水温刚刚好。有下次哦,56821
A42,2020-12-26,稍有点偏，适合自驾去，温泉还是挺棒，面积够大，池够多，鱼疗不收费，还有小孩子超爱的大型滑梯,56822
A42,2020-11-06,我喜欢。一个星期来  比其他公司订便宜,56823
A42,2020-04-09,取票方便，环境优美，服务态度很好！,56824
A42,2020-04-25,已去多次，感觉还是很好，休闲舒服，待装修完再来,56825
A42,2020-12-23,环境很好。优美。喜欢喜欢一直喜欢,56826
A42,2020-12-23,一直以来喜欢去。一年几次。黄静很好。,56827
A42,2020-12-14,前台态度很好 热情 电瓶车接送 值得大家过来玩,56828
A42,2020-10-20,不错，非常休闲，度假一天的好去处,56829
A42,2020-12-14,非常好  不错！可以再来一间！,56830
A42,2020-07-21,地方环境优美，非常满意，值得推荐,56831
A42,2020-12-02,不错，好评，服务态度也超好的，整个环境也美美哒，值了,56832
A42,2020-11-30,温泉很好，服务好，前台美女很热心，耐心回答提问！,56833
A42,2020-11-30,环境不错，没白来，没来的时候还担心环境很差,56834
A42,2020-11-29,服务特别满意！环境优雅特别特别满意！！,56835
A42,2020-11-27,很好，很干净，人不多很精致！！,56836
A42,2020-12-08,蛮好的，朋友们都很开心。。。。。,56837
A42,2020-11-25,不错，不错，不错，不错，不错，不错，,56838
A42,2020-12-07,服务很好，环境也好，还会再来的。,56839
A42,2020-11-27,很好，环境越来越美了！！！！！,56840
A42,2020-11-15,前台服务热情，冯经理沟通很好，提前入住，帮忙调到位，非常好 好好！,56841
A42,2020-02-20,升级改造过的**古真心不错  值得一玩,56842
A42,2020-11-13,这里环境优美，前台服务员热情，强力推荐,56843
A42,2020-11-10,前台服务态度好，热情有礼貌，)推大家过来玩！,56844
A42,2020-11-10,非常好，好多美女，好多帅哥啦啦啦,56845
A42,2020-04-25,环境优美，泡着温泉喝着姜茶真的是一种享受,56846
A42,2020-11-02,前台美女服务太态好，笑脸相迎。,56847
A42,2020-10-28,非常好，值得一去。。。。。。。。,56848
A42,2020-11-02,前台服务热情 很好 值得再来！,56849
A42,2020-04-25,重装装修了，但还未完全完成，全部完工就好玩了，有各种不同水温，泡着也舒服，服务非常周到。,56850
A42,2020-04-21,环境不错喔，到处分布有休息的椅子，喝水的地方，而且还有不同的茶饮提供！工作人员还会把你的鞋摆正，非常棒鱼疗不需要另外收费，但池子有点小，几乎都是坐满了的，懒得去打挤了！再大一点就好了！,56851
A42,2020-10-24,环境不错，前台卢秋琼黄盘珠海服务好，还有礼物送,56852
A42,2020-10-24,好玩。服务又好。全部开放下次还来哈哈,56853
A42,2020-10-23,环境不错，前台卢秋琼、黄盘珠服务很好，,56854
A42,2020-10-14,非常不错，可以再来，好好好好好！前台服务也好！,56855
A42,2020-07-08,交通十分便捷；在**，我们可以欣赏到美轮美奂的山石之美，只见景区四周群山环抱，山上巨石峥嵘，造型各异，令人叹为观止。,56856
A42,2020-04-21,很好，舒服，停车方便，价不高，还会再来,56857
A42,2020-07-22,挺好的，舒服，环境得好 满意,56858
A42,2020-10-11,很好，有点好玩。下次还去！适合度假！,56859
A42,2020-05-01,重新规划和装修过了。比以前漂亮和多了些古韵味！,56860
A42,2020-08-29,去的时候在改建，现在应该都开放了，环境挺好的,56861
A42,2020-05-17,度假村环境优雅、幽静，纯天然的温泉水质清纯，感受舒适，独立的温泉池让你有种随心所欲的感觉，与周围的环境绿树掩映，倍感宁静舒爽。,56862
A42,2020-08-21,服务挺好，非常好，下次还来，再来！,56863
A42,2020-08-22,黄丹婷服务态度很好，笑容很甜，水上乐园也挺好玩的,56864
A42,2020-08-22,环境不错。黄丹婷服务态度很好，非常适合度假,56865
A42,2020-05-14,携家人 朋友的好去处，环境优美、温泉品种多样，泡着温泉听着音乐，人身一大享受……好地方！！！！！！！,56866
A42,2020-08-18,黄丹婷服务态度很好：水上乐园跟适合小孩子玩：值得推荐哦,56867
A42,2020-08-05,好好好好好好好好好好好好好好好好好好好好好好,56868
A42,2020-08-09,很好，很舒服！超赞！值得下次再来！好！好！,56869
A42,2020-08-03,还好，挺不错，有机会再去，价格也不贵,56870
A42,2020-08-15,好、很好、环境非常不错、黄丹婷服务态度很好,56871
A42,2020-04-23,环境很好，服务不错，到那都有人送饮料,56872
A42,2020-07-26,池子很多但浪池没开。总体还行吧。,56873
A42,2020-04-20,管理很到位，随时可以用上干爽的毛巾，这点比别的温泉度假村好，可口的姜糖水随手可取，热石板区竟然有黄瓜给做面膜，大赞！会建议朋友选择这里的。,56874
A42,2020-07-18,很不错，就这个价了，和几个朋友一起去的，很多东西都是新建的，还会再来,56875
A42,2020-01-03,不错，推荐！目的地导航过去很方便，环境也不错，适合一家大小出游！消费不高，附近也有当地吃饭的饭店，很方便！,56876
A42,2020-07-16,一般般，服务不错，一般般，服务不错,56877
A42,2020-07-06,这里确实是个好地方，下次还来,56878
A42,2020-07-14,方便，快捷。不用提前预约即可享受,56879
A42,2020-04-26,联系店家几次退住房押金，一直都没答复，都是敷衍了事，说查查给我答复，谁知道就再也没有下文，退房到现在已经八天了，押金迟迟未退，简直是抓狂,56880
A42,2020-07-08,真心很开心，很享受，下回还会来。,56881
A42,2020-07-03,天然生成泉眼，大大小小有很多池，也有酒店住，度假休闲好地方。,56882
A42,2016-07-17,不错，选傍晚去泡温泉很合适，夜景也好漂亮的，里面有很多温泉池，冲浪的，花香的，药材的，牛奶的，水温很合适，很多地方提供干净的毛巾和水可以喝，还有地热床，冰屋，洗浴中心也很大很干净，很满意的一次旅行，下次再带家人过去玩。,56883
A42,2020-06-19,两广地区最棒的温泉，非常值得推荐！,56884
A42,2020-04-30,十分好，环境和设施都是一流的……,56885
A42,2020-04-30,不错环境和设施都是非常不错，值得来,56886
A42,2020-04-30,不错 感觉很好 环境很漂亮！！,56887
A42,2020-05-29,还好吧，有些池的水有小虫子，药池泡得很舒服,56888
A42,2020-05-25,茂名**，很不错的温泉，泡了很舒服。,56889
A42,2020-05-14,现在在装修 几年没来了，总体还是不错的 水也很好 孩子玩的开心,56890
A42,2020-05-14,经常去，环境还算不错。还有一小部份在装修。。,56891
A42,2020-05-10,舒服环境好好，不错，挺好，值得推荐。,56892
A42,2020-04-29,温泉环境不错，池很多，我们是下午5点左右去的，那时人很少，安安静静很舒服。,56893
A42,2020-04-27,很棒的地方，我女儿一直念念不忘。吃饭有点小贵，现在正装修，希望装修完工后更好。,56894
A42,2020-04-27,环境不错，工作人员很热情。大池也是热的，游泳是种很好的体验。,56895
A42,2020-04-27,环境不错，工作人员很周到，有些地方正在装修，装修完后也许更好！,56896
A42,2020-04-23,很不错，非常满意这次的温泉，棒棒的。,56897
A42,2017-10-14,**温泉度假村里 面的东南亚风格的综合楼位于湖中央，各式洋楼和别墅掩映于绿树丛中；拥有160套24小时供应温泉水的高级客房，28套私家 温泉池别墅。温泉池区，小桥流水、楼台亭榭，设有养生药浴、土耳其鱼疗和温泉SPA，还有迷人的巴厘岛风情,56898
A42,2020-04-22,温泉水清，环境温馨。共有十多种温池浴，还有冷水和温水大游泳池可供游泳！很不错！,56899
A42,2020-04-14,不错，虽然还有很多池在建设中，但还是很尽兴！,56900
A42,2020-04-14,几乎每个月都来一次，环境好，离家近。就是贵了点,56901
A42,2020-04-12,环境在修改中，做得越来越不错了,56902
A42,2020-04-11,环境优美，干净舒服，服务态度好，装修得比以前漂亮好多了,56903
A42,2020-02-22,环境不错，就是这次太多人了。,56904
A42,2020-02-21,地方很大，环境优美，下次还去,56905
A42,2020-03-07,服务态度超差，温泉池比较多。冲凉的水太咸,56906
A42,2020-01-02,感觉环境各方面都挺好的，下次再去,56907
A42,2016-04-10,温泉还不错，就是休息的地方野猫很多！一看见人吃东西就蜂拥而上，而且不怕人，一离开凳子野猫就跳上凳子爬上桌子，很可怕！工作人员根本不理！,56908
A42,2017-04-04,清明假期去的，人不算多，里面布局挺雅致，景色宜人，温泉池很多，水温冷热都有，配套设施都算齐全，还会再去，下次去打算住在温泉区里面，,56909
A42,2017-05-12,非常不错的一次游玩，跟朋友去的，住宿的可以免费泡温泉还不限次数，温泉池也多，说是大众池，但因为池多也有私人空间，很不错，下次打算和家人一起再去,56910
A42,2017-10-01,总体来说感觉比较不错的地方，毕竟这里是茂名市的一大景点之一，景色怡容感觉一般般啦，趣味性也还可以啦。,56911
A42,2016-12-31,比想象中好很多，环境清幽，有很多种类的池供选择，由于是节前人比较少，我们泡了一个多小时，很是惬意，感觉服务员较少，总体好评,56912
A42,2017-03-21,好赞、 很休闲，温泉项目比较多！比较专业,56913
A42,2017-11-10,我们住酒店遇见了一件麻烦事，客服部小夏急我们之所急，加班加点为我们解决问题。非常感谢,56914
A42,2017-07-28,有空可以住一个晚上慢慢泡，减减压，很不错的地方，是茂名市有名的休闲好去处，环境优美，舒适，是一个渡假的好去处，值得去泡泡，有各种温泉池。,56915
A42,2016-10-10,温泉很不错，碰巧遇上国庆节，酒店晚上有节目看，很嗨，温泉里的服务员态度都很nice，但是晚上去酒店夜茶，服务员态度极差，不理人，点两三个菜，等了一个小时，等最后一个菜还说没帮我们下到单，晕死，那不早说，催了那么多次，都没说没下到单。,56916
A42,2017-10-21,服务态度差，收费贵，差评,56917
A42,2017-10-19,**，地方面积算是很大。,56918
A42,2017-10-26,总体来说感觉还不错，表示支持一下吧,56919
A42,2017-10-31,环境挺不错的，可以去转一转……,56920
A42,2017-10-25,环境挺好的，可以带家人一起去转一转,56921
A42,2017-10-13,水质算是不错的环境相对清净优雅，适逢春节出游，边泡温泉边赏烟花，好有情调！！最爱花香泉棒棒,56922
A42,2017-10-09,**温泉水清，景观美美，服务热情好处所。,56923
A42,2017-09-08,特别喜欢去，非常好玩。自驾游也不错。,56924
A42,2017-09-01,很棒的温泉舒服有便宜，有很多选择，住的也好。,56925
A42,2016-10-07,环境优美，安静舒适，是度假好去处。,56926
A42,2017-02-15,舒适豪华、宽敞明亮。度假村布局上全是东南亚式洋楼和别墅，最主要的是每间都设有独立温泉池，让你随心所欲在“家”里泡温泉，周围环境绿树掩映，是绿色与宁静的完美组合。巴厘岛风情的温泉池区中，有43个形状不一、功能各异的温泉池错落有致地分布在绿树林阴之中。温泉泡浴、温泉冲浪、温泉SPA、温泉鱼疗、温泉磁沙、养生保健、干湿蒸、水上拓展等项日一应俱全。,56927
A42,2017-07-16,挺好的，住的小别墅，有私家小温泉，适合一家大小去,56928
A42,2016-02-17,第一次泡 去玩的游客说多不多 说少不少 可惜就是没完全开放齐温泉池  浴巾后勤补给不够快 有些少乘客在等浴巾的，里面的消费还可以,56929
A42,2017-07-15,现在这个季节泡温泉，会不会有点热哈,56930
A42,2017-08-21,**温泉温度舒适，景观美美，趣味多多，设施新好。,56931
A42,2017-07-02,很舒适的环境，清幽宁静，让烦恼抛开，全身放松，好享受的一个夜晚！,56932
A42,2016-05-10,很棒的温泉舒服有便宜，有很多选择，住的也好。,56933
A42,2017-05-24,装修得不错，设施还好，价格有点贵,56934
A42,2017-05-23,适合休闲度假！，养心养身！！！,56935
A42,2016-12-13,觉得泡澡好舒服，好安静的地方，非常喜欢。,56936
A42,2016-12-19,挺不错，只是我们去时少人，有些池不开。,56937
A42,2017-04-14,强烈推荐地，园木林设景，大大小小温泉星罗棋布，,56938
A42,2017-04-10,茂名电白有个热水村，因为地里冒热水而得名。因此建了温泉主题**古,56939
A42,2016-07-04,自驾游的，好好玩，晚上有傣族泼水节的节目,56940
A42,2017-04-13,泡着温泉，和朋友聊聊天，太舒服了,56941
A42,2016-04-18,温泉很好，环境优雅，清幽不错选择。,56942
A42,2017-03-20,环境不错，也挺优惠的，就是里面吃的也不贵，性价比超高，不错！,56943
A42,2017-01-23,不错，比以前好多了！变漂亮了,56944
A42,2017-01-27,玩得很好，很愉快。下次再来,56945
A42,2017-03-19,它是我国唯一载入县志的**温泉。,56946
A42,2016-12-01,粤西性价比较的温泉度假村，喜欢那里的风景及**，设施充满东南亚的风格……如果周末小闲，家人或朋友三五成群，结队前往不失为放松心情的好地方……,56947
A42,2017-01-06,没去成 其实票买了应该去的 而且也退不了,56948
A42,2016-06-11,温泉很棒，温泉池很干净，下次还来玩！,56949
A42,2016-10-10,房间很大但是设备比较旧了，，里面有温泉，温泉的种类很多很舒服，过了国庆以后人比较少，很非常性价比高。建议网上订票，可以便宜不少，提前两个小时就可以了,56950
A42,2017-02-26,泡的全身都放松很服务，环境不错，,56951
A42,2017-01-29,这个地方值得去玩玩，好地方！！,56952
A42,2017-01-05,现在开发得比较好了，设施比较齐全,56953
A42,2017-01-12,新建不久的景区。设置比较新和好,56954
A42,2016-12-21,真温泉，泡的很是舒服，以后还来的,56955
A42,2016-10-28,地理位置还可以，温泉泡得很舒服。,56956
A42,2016-10-21,挺干净卫生的，水质也好，泡温泉很舒适,56957
A42,2016-10-10,位置比较偏远，不知道温泉是不是天然的,56958
A42,2016-11-08,各种各样的池，水非常清，泡在里面舒服呀！,56959
A42,2016-06-07,**环境优雅 高贵 大人小孩都玩的尽兴于归 来过玩过还想着来**,56960
A42,2016-02-06,网上预订很划算，取票很快，服务态度也很好。值得购买。,56961
A42,2016-08-11,环境不错，服务周到，小吃也棒棒的。,56962
A42,2016-10-07,距离市区有28公里，到那边差不多要35分钟。不近不远还行，温泉的环境整体还过得去。,56963
A42,2016-05-17,网上订票真便宜，比实际订票便宜多了，就是要签很多个名字,56964
A42,2015-10-14,环境不错，，下次再来过………,56965
A42,2016-09-11,还可以吧，就是人还不多，哈哈哈,56966
A42,2016-07-20,去那儿定的，就是方便快捷，赞。,56967
A42,2016-06-12,去了很多次了，出票很快。。。夏天温泉还是第一次。。。,56968
A42,2016-06-25,玩得很开心，泡得很舒服。环境也不错，值啦,56969
A42,2016-04-12,服务还可以，电视太老旧了，房价偏贵了！,56970
A42,2016-07-15,小孩子玩得开心，餐厅做的菜味道不错！,56971
A42,2015-08-21,晚上去的，人不算多，环境好，网上订的票也便宜，取票也方便!进去后环境很好，池水挺干净，种类挺多，大人小孩都玩的开心!不知是不是因为晚上，园里的服务员少了点，但是偶尔碰到服务员态度还是挺好！最后是对水质的评价，挺好，将首饰都浸的闪闪发光！挺好哈哈,56972
A42,2015-08-21,儿童票也挺划算 晚上去的，人不算多，环境好，网上订的票也便宜，取票也方便!进去后环境很好，池水挺干净，种类挺多，大人小孩都玩的开心!不知是不是因为晚上，园里的服务员少了点，但是偶尔碰到服务员态度还是挺好！最后是对水质的评价，挺好，将首饰都浸的闪闪发光！挺好哈哈,56973
A42,2016-04-10,环境很好，硬件OK，只是去的时候很,56974
A42,2016-07-18,还OK，温泉不错啊！食物不是很好吃,56975
A42,2016-05-12,还不错，泡得很舒服，已经是第二次了！,56976
A42,2016-02-27,很方便，过去直接就可以进去了。。。很好。。。,56977
A42,2016-05-07,可以可以可以可以可以,56978
A42,2015-12-17,非常好，有各种各样的温泉，还有几个未尝试，有机会下次再试试,56979
A42,2015-11-14,温泉水好好，环境美，值得去，交通方便，早餐丰富。,56980
A42,2016-05-06,玩的很开心，主要是有许多的不同种类的温泉，实是减压放松的好去处。,56981
A42,2016-04-29,好好用，真的，比门市价便宜多了,56982
A42,2016-04-10,温泉不错，就是野猫很多！不怕生，有些可怕,56983
